Brand,Product Name
Buckle-Down,"Buckle-Down Pet Leash - Buffalo Plaid Black Green - 4 Feet Long - 1 2"" Wide"
Pamela's,"Pamelas Products Pamelas Cookies, 7.25 oz"
Generic,"eos Essential Hand Lotion, Delicate Petals, 24 hours of deep moisture, 1.5 fl.oz"
Generic,"El Mexicano Ground Chili, 1 oz"
Pro Teeth Whitening,Activated Charcoal Teeth Whitening Powder - 2 oz. by Pro Teeth Whitening (pack of 3)
Chico Creek Signs,HAYNES'S Game Room Sign Vintage Distressed 8x12 Chic Metal Wall Décor 8125982
Country Brook Design,Country Brook Petz | Candy Cane Christmas Martingale Dog Collar
Avery,Avery Comfort Touch Color Spine Slant-D VW Binders
3dRose,"3dRose German uboat submarine in shallow waters with shark, Greeting Card, 6 x 6 inches, single"
centerlinkmedia,Large Makeup Brush Cleaning Pad
DOCO,Doco DCROPE2072-02L Reflective Rope Leash with Stylish Loop&#44; Blue - Large
Bazzill Basics Paper,Bazzill Bling Cardstock 8.5 Inch X 11 Inch-Fresno
SIGVARIS,Sigvaris Secure 553 Women's Closed Toe Thigh Highs w/Silicone Band - 30-40 mmHg
Mirage Pet Products,Adopt Me Rhinestone Shirt Brown XXXL (20)
SignMission,USS ASTERION AF 63 Street Sign us navy ship veteran sailor gift
burton + BURTON,"Burton & Burton 60"" Fresh Picks Mother's Balloon"
,Litetronics 49580 - L-12151 13W T4 S GX23 2700K 2-PIN Single Tube 2 Pin Base Compact Fluorescent Light Bulb
Wonder Wafers,Wonder Wafers 10CT Individually Wrapped Air Fresheners CREAMY VANILLA
In Diet,IN Diet Dog Supplement - Blue Label 3.5lb
Amscan,Smiley Beverage Napkins (16)
500-070 TCLGXL,Mirage 500-070 TCLGXL Koi Fish Puppy Holdem Sling Tan w/Cheetah Lg/XL
Bulk Buys,Bulk Buys PB997-72 Trick or Treat Round Party Plate Set - 72 Piece
Little Ones,"ConvaTec - Little Ones - Two-Piece 1/5 to 1-1/14"" Cut-to-Fit Full Hydrocolloid Skin Barrier, Flexible Fabric Collar"
Reyane,Insurrection by Reyane 3.3 oz EDT for women
Sylvania,Osram Sylvania 64415 10W 12V G4 base Halogen Halostar Light Bulb
UpStart Components,2-Pack Replacement Light Bulb for Maytag MER5555QAQ - Compatible Maytag 8009 Light Bulb
DIDAX EDUCATIONAL RESOURCES,MANIPULATIVE KIT FOR CC MATH A STORY OF UNITS: MODULES GRADE 2
Buckle Down,"Buckle-Down Lion King Simba & Nala Growing Up Scenes Plastic Clip Collar, Large/15-26"""
Cybrtrayd Life of the Party,Volleyball Lolly Chocolate Candy Mold with Exclusive Cybrtrayd Copyrighted Molding Instructions
ANDOVER COATED PRODUCTS INC,"Bandage Co-Flex 4""X5Yds - 4"" X 5 Yard - 1 Roll / Each"
Home Fragrance Oil,Home Fragrance Oil by Ganz - Mint Chocolate Latte Scented
FUBU,Fubu Eau De Parfum Spray 1 oz
CHOSEN SUPPLIES,Replacement for MERCEDES BENZ SL-CLASS YEAR 2014 STEP COURTESY LIGHT 10 PACK replacement light bulb lamp
Great Value,"Great Value Beef Gravy, 10.5 oz"
Ept,E.p.t. Digital Early Pregnancy Tests (Pack of 24)
n/a,Santa's Cutest Elf Screen Print Dog Dress Black Lg
,BOSS ORANGE MAN by Hugo Boss
Juicy Couture,I AM JUICY COUTURE WOMEN 3 PIECE GIFT SET - 3.4 OZ EAU DE PARFUM SPRAY by JUICY COUTURE
Body Essence,"Body Essence Nourishing Body Cleansing Oil, 18 fl oz"
CHOSEN SUPPLIES,Replacement for V13H010L2 LAMP and CAGE replacement light bulb lamp
The Relief Products,3 Pack - The Relief Products Ring Relief Formula Ear Drops 0.33 oz
Pure Co,"Pure Co USDA Organic Apple Cider Vinegar (Powder) with Black Pepper + Cayenne for Better Absorption & Metabolism Boost - Detox, Diet & Weight Loss ACV Supplement - 50 Servings: No Capsule Pills"
Versace,Versace Eau De Parfum Spray 3.4 oz
Unique Bargains,Unique Bargains 12mm Width 98ft Length Polyimide BGA High Temperature Heat Resistant Tape
Rainey,Rainey WH1-AK High Back Body Compression w/ Zippers-Above Knee-Med-BLK
Lasercrafting,Engraved EMPLOYEES ONLY office sign-Silver
CHOSEN SUPPLIES,Replacement for LIGHT BULB / LAMP 60A15/CL 120V 24 PACK replacement light bulb lamp
Unique Bargains,Unique Bargains Plastic Antislip Handle Telescopic Back Scratcher 30cm Length 10 Pcs for Home Essential
Fashion Pet,Lookin' Good Pumpkin Dog Costume X-Small - (Fits 8-10 Neck to Tail) - Pack of 6
,Pet Dog Warm Clothes Puppy Jumpsuit Hoodie Coat Doggy Apparel
Classique,Classique 766 Post Mastectomy Fashion Bra-Beige/Skin-38D
Kaytee,"Kaytee Forti-Diet Pro Health 100502100 Seed-Based Blend Parakeet Bird Food, 5 lb"
proraso,"Proraso Shave Soap, Sensitive 150 ml + Proraso Shave Soap, Sandalwood 150 ml + Double Edge Razor + Proraso Styptic Gel 10ml + Old Spice Deadlock Spiking Glue, Travel Size, .84 Oz"
CHOSEN SUPPLIES,Replacement for CHRYSLER CONCORDE YEAR 1998 PARKING LIGHT 10 PACK replacement light bulb lamp
Bronco Bobs,"LWC Brands Bronco Bobs Smoked Bacon Chipotle Sauce, 15.25 oz"
Laddawn,"Laddawn Layflat Conductive Poly Bags, 12 X 16, 4 Mil, Black, 100/Case"
Pawstruck.com,"7"" Straight Bully Sticks for Dogs [Large Thickness] (250 Pack) - Natural Low Odor Bulk Dog Dental Treats, Best Thick Pizzle Chew Stix, 7 inch, Chemical Free"
Revlon,4 Pack Revlon ColorSilk Beautiful Permanent Hair Color (43) Medium Golden Brown
Post-It,"Pop-Up Note Dispenser Cat Shape, 3 X 3, White"
Thinoptics,"ThinOptics Manhattan Reading Glasses + Milano Anodized Aluminum, Magnetic case | Round Black Frames, 2.00 Strength"
CHOSEN SUPPLIES,Replacement for LIGHT BULB / LAMP 51586-G
OfficeSpace,Color Reinforced Top Tab Legal File Folders&#44; Green
Various,Sesame Street Vintage 'Happy Birthday' Lunch Napkins (16ct)
,STC211 30 Inch x 24 Inch 3.1 Mil Open End Transparent Static Shielding Poly Bags CASE OF 100
ICAPS,"2 Pk Icaps Lutein and Omega-3 Eye Vitamin and Mineral Supplement, 30 Softgels Ea"
TerraVita,"Tarrify Herb Powder (1 oz, ZIN: 512659) - 3-Pack"
By Calendar,"2019 Recycled Poster Style Reversible/Erasable Yearly Wall Calendar, size 24 x 37"
62-26 XLCR,Mirage 62-26 XLCR Happy Meter Screen Printed Dog Pet Hoodie Cream - Size XL
DryPro,"DRYPro Waterproof Vacuum Sealed Full Leg Cast Cover, Small"
Laitner Brush Company,"Laitner Brush Company 24"" Assembled Block Push Broom with Metal Handle & Brace"
Rx Systems,Rx Systems Anti-Aging Skin Care System Normal to Oily
CHOSEN SUPPLIES,Replacement for VOLKSWAGEN GTI YEAR 2010 BACK UP LIGHT WHITE LED REPLACEMENT replacement light bulb lamp
CHI,3 Pack - CHI Volume Booster Liquid Bodifying Glaze 8.5 oz
McKesson,"Elastic Bandage Medi-Pak - Item Number 13-244BX - 4"" X 4-1/2 Yard - 10 Each / Box"
Viugreum,Children's Decoration Cute Butterfly Bat Baby Rattles Doll Baby Stroller Hanging Bed Hanging Toy Baby Infant Rattles
Swartz Ink,"""Package of Two"" Casio Casiowriter, CW-110, CW-150, CW-200 and CW-220 Typewriter Ribbon, Correctable, Compatible"
Dana,Toujours Moi Set-Eau De Cologne Spray 4 Oz & Cologne Spray 1 Oz By Dan
Victoria's Secret,Victoria's Secret Eye Shadow Quad Jeweled .25 Oz
Various,Strawberry Shortcake 'Dolls' Compact Mirrors / Favors (4ct)
CHOSEN SUPPLIES,Replacement for NISSAN ARMADA YEAR 2014 BRAKE LIGHT 10 PACK replacement light bulb lamp
Note Card Cafe,24 Holiday Note Cards - Holiday Typography Stocking - Blank Cards - Red Envelopes Included
Mamma's Cheese,"Burrata with Truffles, 4 x 16 oz"
Dr. Scholl's,Men's Fashion Compression Socks 1 Pair
Mac,"MAC Gareth Pugh Collection Pigment, Deceit"
Home Comforts,LAMINATED POSTER Dog Imprint Dog German Shepherd Alsatian Dog's Paw Poster Print 24 x 36
Eye Buy Express,Ebe Reading Glasses Mens Womens Blue Silver Temples Anti Glare remarkable grade ckb8147
CHOSEN SUPPLIES,Replacement for PLUSRITE 50PAR30/FL/120 replacement light bulb lamp
CHOSEN SUPPLIES,Replacement for DAMAR 00616F replacement light bulb lamp
Evercoat,Evercoat Marine 100923 Sea-Glass 6' X 50 Yds 6 oz Fiberglass Tape
China Glaze,(3 Pack) CHINA GLAZE Nail Lacquer - Anchors Away - Sea Spray (DC)
Max Mara,Max Mara Eyeglasses 51 0581 Havana Black
,"(2 Pack) B & G Foods Ortega Seasoning Mix, 6.5 oz"
Revlon,2 Pack - Revlon Quick Dry Top Coat [960] 0.5 oz
3dRose,"3dRose candy bears colorful , Greeting Card, 6 x 6 inches, single"
CHOSEN SUPPLIES,Replacement for ARCTIC CAT Z1 BRAKE LIGHT MODEL YEAR 2009 10 PACK replacement light bulb lamp
Kettle Brand,"Kettle Brand Potato Chips, Korean Barbeque, 2 Oz, 6 Ct"
That's It,"That's it Super Sampler, Pack of 24, (4 Apple+Blueberry, 4 Apple+Strawberry, 4 Apple+Pineapple, 4 Apple+Pear, 4 Apple+Cherry, 4 Apple Banana)"
Mirage Pet Products,Black Bone Widget Genuine Metallic Leather Dog Collar Emerald Green 16
Global Groove,Felt Lady Bug Mobile - Global Groove
Nature's Bounty,2 Pack Nature's Bounty Cardio-Health Probiotic Support 60 capsules each
oriental,Noise Putty(pack of 6)
Gillette,Gillette Venus Embrace Women's Razor Pink 1.0 ea(pack of 6)
MAUREY Power Transmission Products,13V2.2 JA QD SHEAVE MAUREY FACTORY NEW!
Kenneth J Knapp,Cyber Security and Global Information Assurance : Threat Analysis and Response Solutions
Insten,Insten 3D Embossed Printing Paris Dual Layer Hybrid PC/TPU Rubber Case Cover For Apple iPhone XS Max - Pink (Bundle with BasAcc MFI Certified Lightning Cable)
SignFever,"Harper's Parking Only All Others Will Be Towed Name Gift Novelty Metal Aluminum 8""x12"" Sign"
CHOSEN SUPPLIES,"Replacement for PART-617573 SVC-EURO VOLTAGE ADAPTER,BFS"
,"(3 Pack) Nicorette Nicotine Gum, Stop Smoking Aid, 2 mg, Fruit Chill Flavor, 100 count"
Panda Superstore,Panda Superstore PS-SPO7702515011-SUSAN00280 Creative Multifunction Wash Bag Portable Travel Pouch Cosmetic Bag&#44; Dark Blue
MLS,MLS-Vancouver Whitecaps-Women's Middle Logo Scarf Tee
Tripp Lite,"Tripp Lite 25m Duplex Multimode Fiber Patch Cable LC/LC 50/125 100Gb, Lime Green"
ELENXS,Motorcycle voltage regulator rectifier
,"WP000-MH6-300 MH6-300 MH6-300 Forceps Splinter MH Plain 3-1/2"" SS Ea From Miltex-Integra Miltex"
CHOSEN SUPPLIES,Replacement for CHEVROLET CAMARO V8 4.4L 350CCA SIDE MARKER YEAR1981 10 PACK replacement light bulb lamp
Pet King,3 PET KING RAWHIDE BRAIDED WHITE BONES 8 TREATS CLEANS TEETH STRENGTHENS GUMS
Sigvaris,SIGVARIS 242CSSW10 20-30 mmHg All-Season Merino Wool Sock-Sm-Shrt-Navy
buckle-down,black white grey mini owls in honeycomb pattern fun animal seatbelt pet collar
,Conserving Culture : A NEW DISCOURSE ON HERITAGE
Accessory Avenue,Whimsical Lionesses in the Snow Flat Round - Shaped Christmas Holiday Hanging Tree Ornament Disc Made in the U.S.A.
Eurovillage Series - Residential Buildings & Accessories 25mm,Dark Age Cottage New
Distrib Films,Monsieur & Madame Adelman (DVD)
BUSH'S,"BUSH'S BEST Refried Beans Traditional, 16.0 OZ"
Hollister,Hollister Newport Beach by Hollister Body Spray 4.2 oz-125 ml-Men
STARWEST,STARWEST PLANTAIN LEAF POWDER WC 1 LB
CHOSEN SUPPLIES,Replacement for GE GENERAL ELECTRIC G.E 40GW 24 PACK replacement light bulb lamp
Kraft,"Kraft Honey Hickory Smoke Barbecue Sauce, 18.0 oz Bottle"
CHOSEN SUPPLIES,Replacement for LIGHT BULB / LAMP 50036-OP
CHOSEN SUPPLIES,Replacement for CLUB CAR 102963301
Accessory Avenue,Hipster Elements on Polka Dots - Wallet Style Cell Phone Case with 2 Card Slots and a Flip Cover Compatible with the Apple iPhone 7 Plus and 8 Plus Universal
Denali Pure,"5-Pack Replacement Whirlpool GS2SHGXKT01 Refrigerator Water Filter - Compatible Whirlpool 4396508, 4396510 Fridge Water Filter Cartridge - Denali Pure Brand"
Coleman Cable Inc,"Coleman Inc Coleman 09503 50', 14/2, Black, Stranded Underground L"
Sqwincher Quik Stik Zero,"Sqwincher Zro Stck, Pdr Sngl Grp 20Oz/.11Ozpkt (Units Per Each: 1)"
Buckle-Down,Buckle-Down Digital Camo Martingale Dog Collar
Auburn Leathercrafters,Auburn Leathercrafters Tuscany Leather Dog Collar
Attack,ATTACK 180mm 50Degree Longboard Skateboard Trucks BLACK STAR SERIES RKP Set of 2
Xulon Press,Difficult People
PID,1959-63 (CD)
Hawaii Pharm LLC,"Partridge Berry (Mitchella Repens) Tincture, Dried Herb Liquid Extract, Squaw Vine, Herbal Supplement 64 oz"
Hifashion,Hascon Face Fluorescent UV Glow Neon Body Paint Pigment 20ml Super Bright HITC
Eye Buy Express,Ebe Reading Glasses Mens Womens Round Black Silver Full Frame Engraved Anti Glare grade ckbtr9091
ggiveume,"AB Wheel, The Best Fitness Equipment for 6 Pack Abs & Core Workout Roller - with Innovative Non-Slip Rubber, Comfort Foam Grips"
MID-USA,Diagnostic Scan Tools For Late Models
AddOn,AddOn HP to Brocade Dual OEM Direct Attach - direct attach cable - 10 ft
Drylock Technologies,"Presto flexright underwear, extended absorbency, large, 44""-58"" part no. aub44040 (56/case)"
st. ives,St Ives Body Wash 13.5 oz - Nourishing Vanilla (Pack of 2) + Yes to Tomatoes Moisturizing Single Use Mask
Teacher&apos;s Aid,Christmas Presents Between Friends Chinese Crested Black Sticky Note Holder
Klairs,"[KLAIRS] x Between Mochi BB Cushion Pact SPF 40, 15g"
CHOSEN SUPPLIES,Replacement for APRILIA RS 125 50 CC YEAR 1997 LOW BEAM replacement light bulb lamp
Eclectic Collections,"Eclectic Collections Mona Lisa Eau de Parfum Spray for Women, 100 ml, 3.4 Ounce"
Camila,"Camila Paris NV135 (7&quot;) French Made Hair Accessories, Hair Banana Combs"
PackagingSuppliesByMail,"Clear Packing List Envelopes 7.5"" x 5.5"" Plain Face Top Side Load 9000 Pieces"
Hard Core Brands,"Hard Core Brands Lighted Dog Collar, Multiple Colors and Sizes Available"
CHOSEN SUPPLIES,Replacement for ADVANCED PURE AIR UV-1000 replacement light bulb lamp
Insten,Apple iPhone 8 plus case by Insten Frosted Rubber Case for Apple iPhone 8 Plus / iPhone 7 Plus - Blue
Rufus & Coco,Rufus & Coco RCSFG4US Sensitive & Fabulous Grooming Pack
CHOSEN SUPPLIES,Replacement for LED14P30D27KFL DIMMABLE 14W SMOOTH PAR30 27K FL replacement light bulb lamp
Unique Bargains,Unique Bargains School Teacher Restaurant Eatery Dinner Order Hand Bell Handbell 9.6cm
Seifelden Refurbished,Seifelden 500GB Hard Disk Drive with 3 Year Warranty for Sony VAIO VPCSA-2SGX/T Laptop Notebook HDD Computer (Certified Refurbished)
Hi-Tec,Allied Compatible XFP TAA Transceiver&#44; 1310 nm Wave
Kingfisher Lane,Kingfisher Lane Guest Chair in Black
N/A,Aberdoggie Uk Screen Print Dress Bright Pink Xxl (18)
burton + BURTON,Burton & Burton 360 Deluxe Grey Pk/50 Pack/50 Balloons
CHOSEN SUPPLIES,Replacement for MERCEDES BENZ SL-CLASS YEAR 2008 STEP COURTESY LIGHT 10 PACK replacement light bulb lamp
Superb Choice,Superb Choice 9-cell HP Pavilion dv6-1010tx Laptop Battery
D&D PowerDrive,D&D PowerDrive 250-S14M-2940 Timing Belt
Generic,"Replacement Battery For Panasonic KX-TG2481B Cordless Phones - P504 (700mAh, 3.6v, NiMH)"
Arcadia Publishing (SC),Lawrence Police Department
,"Prickley Pear Cling Stamps 1.75""X2.5""-Scribble Kitty"
Orajel,2 Pack - Orajel Moisturelock Cold Sore Treatment 0.105 oz
Bilo,Ralyn Shoe Care Sure Steps 2 Pairs
MAJESTIC GLOVE,"3227 Xl Foam Nit.Palm Kevlar Shel Glove13Gacut Level 3, Majestic Glove, PACK_12,"
,Rainy Day Sessions
Ferrera Farms,"Ferrera Farms Prime Cuts Bully Stick 12\"" Prime Stick"
creative-shapes-etc,mini notepad - statue of liberty
Bard Medical,"Tube, Leg Bag Extension Bard - Item Number 000538EA - 1 Each / Each"
Allied Brass,Remi Collection 24 Inch Towel Bar
,Principles and Practice of Poultry Husbandry
Fuzion,Fuzion TOURING 205/65R15 94H Tires
ARP,"ARP INC. 134-3602 SB CHEVY, W/DART II HEADS, HEAD BOLT KIT"
3M,"1/4"" x 24"" Coated Sanding Belt 60 Grit PK200 3M 60440274664"
C.R. Gibson,"NBA Cleveland Cavaliers Composition Book, 7.5"" by 9.75"", 100 Sheets, College Rule"
RC Hagen,Habitrail Playground Loft
Oregon,Oregon for Craftsman (10 Pack) Replacement Primer Bulb # 49-085-10PK
DeSantis,"DeSantis Speed Scabbard Belt Holster for Walther Creed, Tan, Right Hand 002TA1GZ"
Flexible Magnets,Flexible Magnetic Tape Roll with Adhesive Backing- Super Sticky! Superior Quality! By Flexible Magnets- 30mil x 0.5in x 50ft
LSE Lighting,LSE Lighting UV Bulb for UVX-LAMPDM1700 UVX-DM1700 Purifier
Adorable Supply Corp,Prime-Kote J10 14.87 x 11 2-Part Carbonless Computer Forms With .5 In. Blue Bars
Ed Hardy,Ed Hardy The Gambler Zeke Sunglasses - Tortoise
AJJ Cornhole,All Weather Cornhole Bags - Set of 8
EPIC Cameras,"Christmas ""Twilight Ornament"" Theme Square Ceramic Trivet Hot Plate"
Tiger Claw,Shaolin Warrior Monk Robe Grey Large
Dickens,A Christmas Carol
OMNIHIL,OMNIHIL (32FT) 2.0 High Speed USB Cable forCocktail Audio - X12 - CD Ripper - Music Server & Streamer - White
Vogue International,4 Pack Organix Hydrate + DeFrizz Kukui Oil Conditioner 13 Oz Each
Ernie Trio Coleman,Be Gentle Please
Maxxis,Maxxis Bighorn 2.0 Radial Tire 28x11-14 for Arctic Cat PROWLER 700 XTX 2012-2014
,Noahs Ark and the Ararat Adventures
Stonehouse Collection,Modern Dandelion Design Stationery - 8.5 x 11-60 Letterhead Sheets - Contempary Letterhead (Modern) - B6503
CHOSEN SUPPLIES,Replacement for ORBITEC T 12 PSB GREEN LED REPLACEMENT replacement light bulb lamp
Delfield VFR3G Door Gasket Part# (170-1285),Delfield VFR3G Door Gasket Part# (170-1285)
CHOSEN SUPPLIES,Replacement for AUDI A4 L4 1.8L 640CCA OPTIONAL YEAR1998 10 PACK replacement light bulb lamp
Caroline's Treasures,Letter C Retro Tribal Alphabet Initial Retractable Badge Reel CJ2013-CBR
GIVEME,Mini Automatic 7 Egg Incubator di gital Chicken Poultry Hatcher Egg Hatcher Incubator With Automatic Temperature Control
Nortel,NT2N24AD1141 A0404585 Nortel Meridian M8009 Black Business Phone With 6 Programmable Buttons Networking Phones / Telephones - New
dealabs,8 Inch 4CH 2.4G 6-Axis Gyro Remote Controlled Quadcopter Drone with HD Camera
General Mills,Fiber One Chocolate Chip Protein Bars - 4.8oz (Pack of 4)
,NEW Jinhao The Shark Spiral Transparent Colourful Office Fine Nib Fountain Pen
CR Laurence,"CRL Charcoal 84"" Heavy-Duty Fiberglass Screen Wire"
Johnson Controls,"WEL14A602R Thermowell, Brass/Copper"
Tusk Racing,Spoke Sleeves White for Honda CRF230L 2008-2009
SPI,SPI Throttle Cable for Snowmobile POLARIS IQ WIDETRAK/EURO 2011-2014-SINGLE
Smartfood,"Smartfood White Cheddar Flavored Popcorn Snack Pack, 0.625 oz Bags, 40 Count"
Impecca,Impecca-Bamboo-Designer-Keyboard-Walnut-KBB103
First Equipment Quality,First Equipment Quality W0133-1613359 CV Axle Assembly for Mazda Models
,Culinary Herbs; Their Cultivation Harvesting Curing and Uses
Lamy,"Lamy Z24 Fountain Pen Ink Converter, Pack of 5 (LMY_Z24_P5)"
Safety 1st,Safety 1st - Clear View Clippers
Jillson & Roberts,"Jillson & Roberts Medium Gift Bags, Traditional Nutcracker (12 Pcs)"
Global Industrial,"Steel Medical Chart Hanging Wall File Holder, 10 Pockets, Black, Lot of 1"
Cure Putters,Cure Putters Classic Series RX5 Blade Style Putter with Incredible Stability
3dRose,"3dRose Snowglobe Winter Village with Bunnies - Greeting Cards, 6 by 6-inches, set of 12"
Alpine,"Leg Bag, 32Oz Mentor (Units Per Each: 1)"
ShippingSuppliesByMail,Orange Color Stretch Wrap Narrow Banding 5 inch x 1000' x 80 Gauge 36 Rolls
Cambium Networks,Cambium ePMP 2000 5GHz Access Point Lite with Intelligent Filtering and Sync (FCC)
,"15.6"" WXGA Glossy Laptop LED Screen For HP 2000-430CA"
SignMission,USS GREENE APD 36 Street Sign us navy ship veteran sailor gift
Ace Martial Arts Supply,"Medium Weight Color Karate Uniform, Red"
CHOSEN SUPPLIES,Replacement for EZGO / CUSHMAN / TEXTRON U3215-56507
IRWIN TOOLS,"Irwin Vise - Grip Diagonal Cutting Pliers 6""L"
Chico Creek Signs,WEST'S Blue Game Room Sign Vintage Look 8x12 Chic Metal Wall Décor 8126768
CHOSEN SUPPLIES,Replacement for BULBRITE BAB-GU7 replacement light bulb lamp
European Crafts,"4&quot; Horse in the Forest, Animal Glass Ball Christmas Ornament"
,Seconds
CONVATEC,"Natura + Drainable Pouch with InvisiClose, Transparent, Standard 57mm, 2-1/4"" Model #: 51416421 Qty of 10"
CHOSEN SUPPLIES,Replacement for PETERSON 1157 10 PACK replacement light bulb lamp
Bob's Red Mill,"Bob's Red Mill Organic Unbleached White Flour, 5 Lb"
DecoArt,"DecoArt ADC-17 Americana Chalky Finish Paint, 8-Ounce, Vintage"
Mopar,CHRYSLER OEM 2017 Pacifica-Outside Exterior Door Handle Right 5RR20KBXAC
Zoan,Zoan Synchrony Duo Sport Electric Snow Helmet Tourer Graphics Flou Green XXL 821-338
,The Compassion Switch
SOEHNLE,Soehnle Easy Control Bathroom Scale
Kenneth Wain,Between Truth and Freedom : Rousseau and Our Contemporary Political and Educational Culture
Mightyskins,"MightySkins Skin For OtterBox Commuter iPhone 8 Plus | Protective, Durable, and Unique Vinyl Decal wrap cover | Easy To Apply, Remove, and Change Styles | Made in the USA"
unknown,Benmer Strap Quick Release Clip Clamp Mount 360 Degree Rotation for Gopro Hero 4 3+ 3 2 1 Black
Volkswagen,Genuine Volkswagen OEM 1J3 881 633 B B41 RELEASE LEVER
Larissa Veronica,"Citrus Blossom, Natural Super Strength Flavor (16 oz, ZIN: 527651)"
evolur,"Evolur Nova Reversible Seat Stroller, Gray"
Clean & Clear,3 Pack - CLEAN & CLEAR Continuous Control Acne Cleanser 5 oz
L.A. Colors,"(6 Pack) LA COLOR Jellie, Shimmer &amp; Sparkle Lip Gloss - Fabulous"
,Techtronics
TAPECASE,"3M 361 2 x 1.25100 White Glass Cloth/Silicone Adhesive Electrical Tape, 65 degrees F to 450 degrees F, 1.25 Length, 2 Width"
SoftNFresh,"6 Pack - Pacific Blue Select A300 Disposable Patient Care Washcloth by GP PRO (Georgia-Pacific), 29505, 1/4-Fold, White"
buckle-down,white skulls and stars on black and grey fun animal seatbelt pet collar
Reese,"World Finer Foods Reese Olives, 4.75 oz"
Elizabeth Arden,"Elizabeth Arden Ceramide Ultra Lipstick 10 Cinnamon .12 Oz. (New, No Box)"
K-Kraft,"Red Gift Wrap Bag by K-Kraft (Festive Red Stripes, 13 x 17.5 inches)"
,I-Squeegee Phone Screen Cleaner with Keychain
CREATIVE TEACHING PRESS,ANCIENT EGYPT CHART
ClearBags,"Crystal Clear Photography & Art Bags 11 in. x 14 in., pack of 25 (pack of 2)"
Gulfe,Laptop AC Power Adapter Charger for HP Pavilion dv2035US
Kids Preferred,Kids Preferred Butterfly Baby Gym Mat
Ness Enzymes,"Ness Enzymes, GI Relief #6 90 caps"
Torani,Torani Lime Syrup 25 oz each (3 Items Per Order)
Austin,Austin Cookies and Crackers Variety Pack 45 Count New
Omega Nutrition,Omega Nutrition Essential Balance Oil Blend 32 oz
Country Brook Design,Country Brook Design Premium Schnauzer Ribbon Dog Collar
BETALLIC BALLOON,2018 Megaloon Set
Ergodyne,"ERGODYNE 1505 Back Support, S, 25 to 30in, 6-1/4inW, Black"
Hudson Baby,"Hudson Baby Boy and Girl Fitted Crib Sheet, 2-Pack - Forest"
Colavita,"Colavita Capers, 4.76 Oz"
Heepo,Heepo 1Pc Unisex Compression Leg Sleeve Sock Sports Running Football Calf Support Brace
Buckle-Down,"Buckle-Down ""Steaks with MEAT Text"" Martingale Dog Collar"
TerraVita,"Boxthorn Berry (Lycium, Goji) Powder (4 oz, ZIN: 513818) - 3-Pack"
Humco,Humco Sulfur Sublimed Powder USP 12 oz
PKPOWER,PKPOWER 6.6FT Cable DC 6V AC / DC Adapter For YuHai Electronic (NanHai) Model No.: YH-UA-0606 YHUA0606 6VDC 1000mA Class 2 Transformer Power Supply Cord Cable Charger PSU
Carson-Dellosa,PERIODIC TABLE OF ELEMENTS CHART
SoCozy,SoCozy Curl Gel-Cream 4oz
Atlantis Plastics,"Plastic Table Cover, 54"" x 108"", Hunter Green"
mwgears,Infocus IN34C Replacement Color Wheel
CHOSEN SUPPLIES,Replacement for IT-Z1525 REPLACEMENT replacement light bulb lamp
Bianca Rosa,"Chayote Cream (2 oz, ZIN: 519842)"
Mightyskins,MightySkins Skin Decal Wrap Compatible with Lenovo Sticker Protective Cover 100's of Color Options
Mightyskins,Mightyskins Protective Vinyl Skin Decal Cover for LG Thrill 4G Cell Phone wrap sticker skins Argentina Flag
ONLINE,Scalloped Metal Hinge Embellishments 15/
Hat Shark,Adventure Time Cartoon Network Tv Show - Marceline Jake Finn Group HUG Logo Sticker
Chris Epting,Vanishing Orange County
Olivenation,Granulated Honey
CHOSEN SUPPLIES,Replacement for VOLKSWAGEN BEETLE YEAR 2007 GLOVE COMPARTMENT LIGHT 10 PACK replacement light bulb lamp
Pixnor,ROSENICE 2pcs Portable Natural Loofah Luffa Bath Body Shower Sponge Scrubber
Bob's Red Mill,"Bobs Red Mill Spelt Flour, 24 Oz"
Optuminsight,Radiology Cross Coder 2014
Gareth Stevens Publishing,Using Math Outdoors
Frantic Stamper,Frantic Stamper - Dies - Small Pine
DNA Motoring,For 1994-2001 Honda Accord 2.2L/Prelude AT Performance OE Style Full Aluminum Core Radiator 1494
Johnson's,"(2 pack) Johnson’s Detangling 2-in-1 Kids Shampoo & Conditioner, 13.6 fl. oz"
Col Conk,Trac II Chrome Handle + Colonel Ichabod Conk Trac II Razor Blades 10 ct. + Schick Slim Twin ST for Sensitive Skin
Bare Nature,"Bare Nature Vitamin Iced Tea - Guava Pineapple, 20 Fl. Oz. Bottles, 12 Ct"
Boscoli,"Boscoli Olive Salad Italian Oil, 32 OZ (Pack of 6)"
Mightyskins,"MightySkins Skin for Tile Mate w/ Replaceable Battery (2018) - Army Star | Protective, Durable, and Unique Vinyl Decal wrap cover | Easy To Apply, Remove, and Change Styles | Made in the USA"
Fox Valley Traders,Folding Step Stool
Rubie's,Faora Secret Wishes Adult Halloween Costume
Made-to-Stick,Counterfeit Detector Pen&#44; with UV Light Cap&#44; Black
TelSell,Pro Milano Hair Straightening Brush Comb Italian Designed Hair Brush Straightener -Pink
CHOSEN SUPPLIES,Replacement for DOLAN JENNER 02-015850-0000 replacement light bulb lamp
Discount Starter and Alternator,New Steering Stem Bearing Kit Honda CT90 Trail 90cc 1966 - 1979
GLOBALSCAPE INC,SCCONNECT 50U DEV MNT & SUP RENEWAL
Nostalgic Warehouse,Nostalgic Warehouse Meadows Privacy Door Knob with Studio Plate
Petflect,"Petflect Green Purple Vertically Striped Dog Collar - Reflective - Nylon - Super Strength - X-Large, Neck 26""-32"""
Ktaxon,"Ktaxon 2 Mil 48"" x 100' Lightproof Reflective Mylar Film Roll"
Race-Driven,Complete Gasket Kit fits Ski-Doo Legend 600 SDI 2004 Snowmobile by Race-Driven
Bridgestone,180/55ZR-17 (73W) Bridgestone Battlax S21 Hypersport Rear Motorcycle Tire for MV Agusta Stradale 2015-2016
UpStart Components,Replacement Light Bulb for General Electric GCE23LGTBFBG Refrigerator - Compatible General Electric WR02X12208 Light Bulb
3dRose,"3dRose Keep Calm You Will Finish Nursing School - Greeting Cards, 6 by 6-inches, set of 12"
Unique Bargains,Unique Bargains Unique Bargains 2 Bags Flexible Rubber Hair Ties Bands Ponytail Braid Holder Elastics Black
Mightyskins,MightySkins Protective Vinyl Skin Decal for OtterBox Defender Galaxy S6 Active Case wrap cover sticker skins Watercolor Flowers
Party Central,"Club Pack of 12 Mardi Gras Themed ""Welcome"" Door Cover Party Decorations 5'"
Troy Lee Designs,Troy Lee Designs 2016 Ruckus Bike Jersey Formation Red Mens All Sizes
Aquatop,Aquatop Plastic Aquarium Plants Power Pack - Assorted Colors 12 Pack - (7 High Plants) - Pack of 6
