Brand,Product Name
Mightyskins,"Skin For YETI Tundra 45 qt Cooler Lid – Coffee Understands Me | MightySkins Protective, Durable, and Unique Vinyl Decal wrap cover | Easy To Apply, Remove, and Change Styles | Made in the USA"
Lutema,Lutema Projector Replacement Lamp with Housing / Bulb for Epson EMP-280
Rareelectrical,NEW STARTER MOTOR FITS EUROPEAN MODEL AUDI A2 1.4L 1999-02 0-001-121-016 0001121017
Marvel,Marvel Men's Hulk Comic Book Cent T-Shirt
Urbane,Urbane Urbane Classic Crossover Scrub Top Scrub Top
Acerbis,Acerbis Lower Fork Cover Set White for Kawasaki KX250F 2009-2016
Taye,Taye BS5300 5000 Series 3 Sections Boom Cymbal Stand
EZAUTOWRAP,EZAUTOWRAP Gray Velvet Suede Texture Cabinet Car Vinyl Wrap Vehicle Sticker Decal Film Sheet Furniture Decoration Peel And Stick
ShadeTree,"Shade Tree 20'x40' Heavy Duty, Fire Resistant, Event Tent w/Sidewalls - 500g/m2 PVC Fabric"
centric,centric 83.133.0023.73
CHOSEN SUPPLIES,Replacement for TOTAL MICRO TECHNOLOGIES QK641AA-TM replacement battery
Ernst Wilhelm Hengstenberg,"Christology of the Old Testament, Vol. 4 : And a Commentary on the Messianic Predictions (Classic Reprint)"
Microsoft,"Microsoft Surface Studio 2 28"" All-In-One Intel Core i7 32GB Memory 2TB SSD (Latest Model) Platinum - LAM-00001 - i7-7820HQ - Quadcore - 45000 x 3000 - Nvidia GeForce GTX 1070 - 802.11ac compat"
Diane Barnet,Inside South Austin : A Guide - Paperback
WorldJewels,"14K Yellow Gold Natural Citrine, Opal & Lemon Quartz Ring 3-Stone 7x5 mm Oval Diamond Accent, sizes 5 - 10"
Old Glory,Can't Regret Cinco De Mayo Black Juniors Soft T-Shirt
Homden,Pair High Low R1234YF A/C Quick Coupler Connector Adapter for Jaguar Land Rover
Sandra Calkins,Who Knows Tomorrow? : Uncertainty in North-Eastern Sudan
Custom Party Shop,Custom Party Shop Baby's Happy Hanukkah Onepiece Grey - 18 Months
Saucony,Mens Saucony Grid SD Ether Rose Gold S70310-1
Touch Up Express,Porsche Boxster 8B1 Carmon Red Metallic Quart Basecoat Paint for Car Auto Truck
Complete Tractor,Complete Tractor Flush Face Coupler 3001-1212 for Universal Products FEM-501-8FP-NL
SPU,Lumix GC Carburetor For Trailmaster 150 XRX Go Kart Buggy 4 Wheeler 150cc
,"Biofictional Histories, Mutations and Forms"
Riders by Lee,Women's Slender Stretch Slimming Skinny Jeans With Glitz Back Pocket Available in Regular and Petite
Teeblox,Colorful Paisley Monkey Head Muscle Tank Women's -Image by Shutterstock
Online Metal Supply,"Polyamide Imide (PAI) 4203 Round Rod, Diameter: 1.750 (1-3/4 inch), Length: 8 inches"
MYBAT,For Samsung Galaxy Tab E 9.6 Clear LCD Screen Protector Film Cover
MilitaryDecals23,USS Valor AMc-108 License Plate Frame American Made - Veteran Approved!
UpStart Battery,"Compatible Lintronics MX12120 Battery - Replacement UB12120 Universal Sealed Lead Acid Battery (12V, 12Ah, 12000mAh, F1 Terminal, AGM, SLA) - Includes TWO F1 to F2 Terminal Adapters"
Simplicity,"Simplicity Pattern Bags, One Size"
Molly Hatch; Kathleen Morris,A Teacup Collection : Paintings of Porcelain Treasures
Maevn,"Maevn PURE Women's 3 Panel V-Nect Top & Modern Yoga Pants Scrub Set [XXS - 3XL, FREE SHIPPING]"
,The Vandals
LNKOO,LNKOO Wireless Bluetooth Speakers Portable Stereo Bass Mini Hifi Classic Music Radio Player With Subwoofer For Mobile Cellphone Indoor Outdoor Home Picnic Party-White
Katherine Andarcia,Luz de Los Angeles : Alcanza La Felicidad En Todas Las Areas de Tu Vida Con El Amor Angelical
ASUS,60-OK0AMB7000-C07 Asus TF201 Docking Board
TrekCases,OtterBox Symmetry Samsung Galaxy S6 Case - Silhouette Volleyball Woman on Black OtterBox Case
Insten,Insten Book-Style Leather Glitter Cover Case w/stand/Diamond For Alcatel One Touch Evolve 2 - Hot Pink/Silver
Electronic Arts,Refurbished NASCAR 2008 - PlayStation 2
DOT-01,2x DOT-01 Brand 2000 mAh Replacement Olympus BLS-5 Batteries and Charger for Olympus PEN E-PL7 Compact System Digital Camera and Olympus BLS5
Gulfe,Battery for Asus Pro52H Laptop
SPS,SPS Brand 12V 12Ah Replacement Battery for Belkin Regulator Pro 1000VA Network F6C100 (2 Pack)
Blick,Blick Stationery
Disney,Disney's Tinker Bell Light Green Dress Children's Costume (Size 4-6X)
Port & Company,Port Company PC61 Traditional Menâ€s T-Shirt - Athletic Maroon - Large
Best Welds,"Power Cable Adapter, 3/8 in - 24, Brass, Rh"
Fleur De Lis Living,Fleur De Lis Living Boxwood Ball Topiary in Pot
Fly Racing,Fly Racing Kinetic Vector Pants Red/Black/Yellow 30 369-53230
Ralph Compton; David Robbins,Fatal Justice
MindWare,Keva Brain Builders Junior
Awkward Styles,Awkward Styles Sugar Skull Shirts for Men Jolly Roger Skull and Crossbones Men's Tee Shirt Tops Day of Dead Tshirts Pirate Flag Shirts Skull T-shirts Dia de Los Muertos T Shirts for Men
Mirage Pet Products,"You Come, You Sit, You Stay Screen Print Bandana Purple Large"
Turning Point Propellers,TURNING POINT HUB KIT #201
Introtech,Gold Roll-up Sunshade Fits Cadillac Escalade 1999-2000
,"Beruflich in Peru : Trainingsprogramm Fur Manager, Fach- Und Fuhrungskrafte"
Optoma,Lamp Housing For Optoma EzPro731 Projector DLP LCD Bulb
Online Metal Supply,"17-4 Stainless Steel Square Bar, Size: 2.750 (2-3/4 inch), Length: 5 inches"
TrekCases,LG X Power Armor Hybrid Case - Beige Hexagons on Green Fields
Kenneth James,Kenneth James Sultana Lattice Texture Wallpaper
Colosseum Athletics,Mens NCAA Mississippi State Bulldogs Quarter-Zip Long Sleeve Tee Shirt (Heather Charcoal)
,Compatible HP/Compaq Pavilion ZD7389CL-PM018UA ZD7389CL-PM018UAR zd7390 zd7390EA ZD7390EA-PN592EA zd7392 zd7392EA ZD7392EA-PN602EA zd7395 zd7395EA Deep Blue 6600mAh/98Wh 12 Cell Compatible Battery
Insten,Samsung Galaxy Express Prime 3 case J3 2018 case by Insten Hard Plastic/Soft TPU Rubber Case Cover For Samsung Galaxy Express Prime 3/J3 (2018)/J3 Achieve/J3 Star/J3 V 3rd Gen (2018)
BikeMaster,BikeMaster Rear Steel 47 Tooth Sprocket for Yamaha YZF-R6S 2006-2010
Rebecca Wood; Paul Pitchford; Peggy Markel,The New Whole Foods Encyclopedia : A Comprehensive Resource for Healthy Eating
Accessory Avenue,Hearts Kitten Silhouette Bauble Christmas Ornaments Red Bauble Tree Xmas Balls
Holloway,Youth Zoom 2.0 Shirt-222620
Smart-AVI,Smart-AVI HDC-VXS Format Converters
Cr Laurence,"CRL Stainless Steel 3/8""-16 x 1-1/4"" Long Allen Screw - pack of 10"
MIP,"Apple iPhone 6 6s Hybrid Shockproof Impact Hard Cover / Soft Silicone Rubber Inside Case Eat Sleep Play Baseball Softball (Hot Pink/Blue),MIP"
Aviana,Women's Aviana 2457 Satin and Lace Minimizer Bra
CHOSEN SUPPLIES,Replacement for BATTERIES AND LIGHT BULBS 5038-BATTERY replacement battery
RECON LIGHTING,RECON 264292RBK Ford Superduty F250HD/350/450/550 For 99-07 & F150 97-03
Ply Gem,Ply Gem Raised Panel Shutter (Set of 2)
UrbanX,UrbanX Dual USB Car Charger with QC 3.0 and 2.4A Ports Emergency Window Breaker and 6 FT (2m) Type C USB-C Cable Compatible with Motorola Moto Z2 Play - Black
Alliance,Material (Vinyl)
Bling Jewelry,Origami Small Giraffe Zoo Animal Anklet Dangle Charm Ankle Bracelet 925 Sterling Silver Adjustable 9 to 10 Inch Extender
Dell,"Dell Optiplex Desktop Computer 2.6 GHz Pentium D Tower PC, 4GB RAM, 160 GB HDD, Windows 7"
Baruch Spinoza Chair Giorgio Agamben,Opus Dei : An Archaeology of Duty
Mercury,Mercury Mercruiser Quicksilver New Oem Part # 90-8M0056559 Manual-Parts
Genuine,Genuine W0133-1605472 Radius Arm for Nissan Models
Shubham Pandey,The Book of James Carrom
Danielson,"Danielson Salmon Knotless Net with 42"" Handle, 27"" x 30"""
IN MY PARENTS BASEMENT,Yo Gabba Gabba Mens T-Shirt - Hello Friends Distressed Yellow Print Group image
Magic Plastics,"Gate Valve, UniBody, Magic, 2""Union x 2"" Spigot, 80psi"
SPI-SPORT PART,SPI-SPORT PART Imported CDI Box for Snowmobile POLARIS EURO WIDETRAK GT 1995 & 1997
,Plant Pathology and Plant Pathogens
Coco Electrik,White Ink
Alta,"Replacement Alta MDD03D-HEL,MDD03D-HER Pair Power Mirror For LHS Concorde Vision"
Firefly Imports,"Brown Birds Print Cotton Linen Ribbon, 5/8-inch, 10-yard"
ACDelco,"AC Delco 18A2484 Brake Disc, Stock Replacement, Rear Driver Or Passenger Side"
Nearly Natural,Nearly Natural 31 In. Bell of Ireland Artificial Flower (Set of 3)
PowerStar,"BATTERY,8V,3.2AH,POWERSONIC,PS-832,SVL,FASTON TABS"
Gloria D Miklowitz,The Enemy Has a Face
Nostalgic Warehouse,"Nostalgic Warehouse MEABRN_PSG_238_NK Brown Porcelain Solid Brass Passage Knob Set with Meadows Rose and 2-3/8"" Backset"
MIP,For Apple iPhone Clear Shockproof Bumper Case Hard Cover Engineer Always Right (Pink for iPhone 7 Plus)
NEWMANS,Newmans 2ASDPLATE Backing Plate With Nut 3/4' Hole
,"Las 113000 Envolturas Del Copo De Nieve / the 113000 Covering of the Snowflake (Montana Encantada) (Spanish Edition) [Paperback] [Oct 26, 2009] Ricardo Chavez Castaneda and Fran Bravo"
Unique Bargains,"22"" Windshield Windscreen Bracketless Wiper Rubber Refill Strip for Car"
LA Choppers,LA Choppers Complete Handlebar Cable And Brake Line Kits Black Vinyl/Stainless Mini Ape Hangers LA-8110KT2B-08B
Champro,"Champro Adult Wristband Playbook, Single, Cardinal Camo Adult"
Unique Bargains,20pcs Red 17mm Car Wheel Lug Nut Cap Tyre Hub Screw Bolt Dust Cover Protector
Seifelden Refurbished,Seifelden 80GB Hard Disk Drive with 3 Year Warranty for Compaq Presario V6107AU Laptop Notebook HDD Computer (Certified Refurbished)
Chaco,Chaco Women's Zvolv Athletic Sandal
,Buddhism and Jainism
iFrogz,ifrogz Tadpole On the Go Bluetooth Speaker w/ Belt Clip - Blue
HPI,85054 Shock Body Set 12x67-87mm Firestorm (2)
Eddie Bauer,Eddie Bauer Women's Favorite Long-Sleeve Crewneck T-Shirt
Puzzled,Peg Puzzle - Dc Monuments
CC Glass,Tulane Green Wave Muscle Mug
Dynojet,Dynojet 2167 Jet Kit
HMF,HMF Performance Full System Black w/TD-Blk Cap Exhaust Can Am Outlander L 15-16
Unique Bargains,"20pcs Cabinet Cupboard Drawer Door Stainless Steel Pull Handle 4.5"" Long"
Overstock,"5"" Pull - Precision - Satin Nickel"
Generic,"Egret Baits VuDu Shrimp 3.25"" , Cajun Pepper"
RSD,RSD Bronzo Leather Gloves
HJ Scott,HJ Scott St. James Rustic Dartboard Dart Board Cabinet - Antiqued Grey Finish
Frame USA,"Plein Air Culvert-RUSFRE98534 Print 14.25""x11"" by Rusty Frentner in a Affordable White Medium"
Unique Bargains,Colors LED Light 6 Buttons Wired USB2.0 Optical Gaming Game Mouse for Computer
Bachmann,Bachmann 62452 Union Pacific GP7 Diesel Locomotive #116 w/DCC
,Psychotherapy for Individuals with Intellectual Disability
HFP,Quantum OEM New Fuel Pump Replacement Volkswagen Scirocco 16V 1986 - 1992
Pixnor,12 Pcs 3D Butterfly Stickers DIY Mural Art Decal Wall Stickers Crafts Wall Paper Decor (Yellow Series)
TrekCases,LG Harmony Hybrid Slim Case - Grizzly Bear
M David Sills,"Hearts, Heads, and Hands- Module 2"
,New West Indian Readers
BlingLights,2011-2017 Jeep Patriot Halo Fog Lamp Driving Light Kit Angel Eyes
Anime Soundtracks Pioneer Entertainment,Technolyze 2 - Man of Men Soundtrack New Condition!
Speak Out,Speak Out Kids vs Parents Game
American Imaginations,American Imaginations 21.5-in. W 3H8-in. Ceramic Top Set In White Color - Overflow Drain Incl.
Sculpey,Sculpey Polymer Clay Just Orange
Trevco,Trevco Jla-Face Off Short Sleeve Toddler Tee&#44; Athletic Heather - Medium 3T
CafePress,CafePress - Surf's Up! - Men's Light Pajamas
Microbead Car Covers,2011-2011 BMW 550I (F10) Select-Fit Car Cover Kit
SONICWALL - SOFTWARE,2YR ADVANCED GATEWAY SECURITY SUITE BNDL FOR TZ 300 SERIES
,Wind in the Reeds
CC Christmas Decor,6.5’ Pre-Lit Dunhill Fir Artificial Christmas Tree – Clear Lights
Ariel Bath,Ariel Bath 48'' x 29'' Dual Air and Whirlpool Walk-In Bathtub
Accessory Avenue,#1 P.T. - Wallet Flip Style Phone Case Compatible with the Samsung Galaxy s8 Plus / s8+ Universal
Fintie,"Fintie Samsung Galaxy Tab A 9.7 Tablet Case - Ultra Slim SmartShell Cover with Auto Sleep/Wake, Flower Burst"
Planet Waves,"Planet Waves American Stage Series Microphone Cable, XLR Male to XLR Female, 25’"
Bridget Riley; Richard Shiff; Robert Kudielka,Bridget Riley: Works 1981-2015
KATARINA,"Diamond Solitaire Promise Ring in 14K White Gold (1/10 cttw) (I-Color, SI3-I1 Clarity) (Size-7)"
Harriton,Harriton Men's Paradise Short-Sleeve Performance Shirt
Shimano,Shimano ES300 68 x 126mm Octalink V2 Spline English Bottom Bracket
N-Fab,N-Fab Nerf Step 10-17 Dodge Ram 1500 Crew Cab 6.4ft Bed - Tex. Black - Bed Access - 3in
HOMECARE PRODUCTS,Stright Shank Core Drill&#44; High Speed Steel - 1.093 dia. x 6.875 Flute Length x 11.50 OAL with 4 Flutes - Series D254
HP,Refurbished HP EliteBook 8540p Laptop i7 Dual-Core 8GB 500GB Win 7 Pro B v.WBA
Style and Apply,Style and Apply Banksy Paratrooper Rat Wall Decal
PKPOWER,6' Feet 1.8m Extension Power Cord For IRONMAN Achiever AEROS CDT R7 Transistion
C S Lewis; Derek Jacobi,Chronicles of Narnia: The Voyage of the Dawn Treader (Audiobook)
Style & Apply,"Hibiscus Flowers Wall Decal - Wall Sticker, Vinyl Wall Art, Home Decor, Wall Mural - 2186 - 8in x 19in, Dark green"
KMG,KMG 12V 18Ah Replacement Battery for Sonnenschein 889556500 95555
Scott Spector,"Violent Sensations : Sex, Crime, and Utopia in Vienna and Berlin, 1860-1914"
ROHL,"Rohl A2400 Country Bath Shower Valve Trim, Available in Various Colors"
allwitty,1042 - Unisex Long-Sleeve T-Shirt Free Hugs And Maybe A Kiss If You're Lucky
,Agency and Embodiment
Ana Goncalves Matos,Literary Texts and Intercultural Learning : Exploring New Directions
Mightyskins,MightySkins Protective Vinyl Skin Decal for Motorola Moto 360 Smart Watch cover wrap sticker skins Checkered Flag
CafePress,CafePress - FIN Nuts Squirrel - Cute Infant Baby Football Bodysuit
Master Of Bling,Holy Angel Pendant Simulated Diamonds 14k Yellow Gold Finish Lab Created Cubic Zirconias Iced Out Solid Back
MCBOSON,MXQ Android Quad-Core WiFi HDMI 1080P Smart TV Box 8GB Support Kodi
Fishouflage,Fishouflage Classic Perf. L/S Crew (M)- Redfish/Black
Mopar,Ram CHRYSLER OEM 13-14 3500 Overhead Roof Console-Module 68105821AB
JJ FLY,Car Motor Xenon White T10 Car Side Wedge 3528/5630 SMD LED Backup Light
Sanyo,Sanyo POA-LMP105 Osram Projector Lamp Module
Mightyskins,MightySkins Protective Bumper Case Cover for Motorola Moto G XT1032 hybrid tpu rubber plastic Love Jesus
Generic,Rawlings NCAA Polycarbonate Hoop Set University Of North Carolina Tar Heels
TrekCases,LG Fiesta Wallet Case - Basket Ball Case
Halyard Health,Halyard Health KIM 10042 Lab Coat&#44; White - Large&#44; 25 Per Case
Nintendo,"Little Buddy LLC, Splatoon: 7"" Judd / Judge Kun the Cat Stuffed Plush"
MyNetDeals,"Premium Over-Head Stereo HandsfreeHeadset Headphones w/ Mic for LG Q8, Q9, Candy,Tribute Empire, Phoenix 4,Phoenix Plus, K11 Plus (White Pattern) + MND Stylus"
TrekCases,LG Fortune Armor Hybrid Case - Soccer Ball
"Xtreme Mower Clutches, Warner Upgrade",Replaces Warner 5219-55 Electric PTO Clutch - Free Bearing Upgrade!
Fruit of the Loom,Fruit of the Loom T-Shirts HD Cotton Tank Top
L'Occitane,L'Occitane - Peony Pivoine Sublime CC Cream SPF 20 - #Medium -30ml/1oz
Yusuf Toropov,Jihadi: A Love Story
WorldJewels,"14K Yellow Gold Natural Green Amethyst, Morganite & Tiger Eye Ring 3-Stone 7x5 mm Oval Diamond Accent, sizes 5 - 10"
Nike,Pittsburgh Pirates Nike Vapor Classic Swoosh Performance Flex Hat - Black
NA,KMC REVERT 22x9.5 6x120.00 CHROME (15 mm) RIM
TCK Socks,"TCK Elite Baseball Football Knee High Striped Socks (F) Graphite, Purple, White (M)"
KBETHOS,Classic Mesh Ivy Newsboy Ivy Cap Hat Crochet Driving Golf Ventair Cabbie
Gerber,"Assorted Short Sleeve Onesies Bodysuits, 5pk (Baby Girl)"
Sax,"Sax Versatemp Heavy-Bodied Tempera Paint, Primary Yellow, Gallon"
Superb Choice,Superb Choice 8-cell GATEWAY 7000GZ Series Laptop Battery
GreatNeck,"Great Neck Saw 10"" Tongue-and-Groove Pliers, W100C"
SuperJeweler,Men's 1ct Diamond Ring In 10K Yellow Gold G-H I2-I3 Size 11.5
Heritage,(Pre-Owned Original Part) Driver Left Taillight Tail Light Fits 04 05 06 Chevrolet Tahoe GMC Yukon R307594
myDriversPlus,"HP Pavilion DV4-1136BR Drivers Recovery Restore Resource Utilities Software with Automatic One-Click Installer Unattended for Internet, Wi-Fi, Ethernet, Video, Sound, Audio, USB, Devices, Chipset ..."
JGB Enterprises,"JGB Enterprises Eagle Hose Tank Truck 150 Oil and Fuel Resistant Rubber Hose Assembly, Black, 3"" Male x Female Camlocks (CxE), 150 PSI Max Pressure, 3"" Hose ID, 20' Length"
Teeblox,Arabesque Flower Circle Design Tee Women's -Image by Shutterstock
The Holiday Aisle,The Holiday Aisle Decorative Ship Wheel With Seagull Christmas Tree Ornament
Goodmark,Girls Cutie Captain Child Halloween Costume Pirate Outfit Small (4-6)
Swimline,Swimline Hydrotools Starter Pool Cleaning Set
Bridgestone,Bridgestone Potenza RE960AS Pole Position RFT P245/50RF18 100W B (4 Ply) BW
POWERFILM,Flexible Thin-Film Solar Module 15.4 Volt 50 mA
Superb Choice,Superb Choice 4-cell LENOVO IdeaPad S300-ITH Laptop Battery
Cosmas,Cosmas 9508ORB Oil Rubbed Bronze Cabinet Pull
Crane Cams,Crane Cams 680931 Crane Racing Camshafts
1060 Graphics,"SOLID 9"" inch wide Custom Racing Stripes / ICE BLUE / Universal fit / car truck auto vehicle hood van race motorcycle bike mustang dodge ford chevy vinyl strip decal / By 1060 Graphics."
Keyscaper,UCLA Wired USB Keyboard NCAA
Design Toscano,"Bigfoot, the Holiday Yeti Holiday Ornaments: Set of Three"
sterling,Multi-Purpose Cleaning Cloth
Stupell Industries,Stupell Industries Chevron Initial Wall D cor
Ives Comme,Ives Fs441 Us5 Floor Door Stop
Denali Pure,"2-Pack Replacement Filter Kit for Watts HT-5-VOC-B RO System - Includes Carbon Block Filter, PP Sediment Filter & Inline Filter Cartridge - Denali Pure Brand"
TrekSkins,"SKIN DECAL FOR Otterbox Commuter Apple iPhone 6 Case - Peace on Chevron Green Orange Blue DECAL, NOT A CASE"
Hollywood Thread,Dude! Your Girlfriend Keeps Checking Me Out - Funny Men's T-Shirt
EMPIRE,"""Sony 5836 Cordless Phone Battery Ni-MH, 2.4 Volt, 1500 mAh - Ultra Hi-Capacity - Replacement for Panasonic HHR-P546A, Type 23 Rechargeable Battery"""
NYDJ,NYDJ Womens Marilyn Slimming Fit Medium Wash Straight Leg Jeans
MowerPartsGroup,"(2) Blades Replace Cub Cadet MTD 942-04244 942-04290 LTX1046 LTX1045 46"""
Home Comforts,Peel-n-Stick Poster of Mountains Scenic Water Lake Sky Orange County Poster 24x16 Adhesive Sticker Poster Print
EEEkit,"EEEKit LED Light Bar 18W 6000K Waterproof LED Work Light Bar 10-30V 6 LED Driving Lights Fog Offroad Lamp For Vehicles, ATV, Truck"
Fanatics Branded,San Francisco Giants Women's Oversized Long Sleeve Ombre Spirit Jersey T-Shirt - Black
Unique Bargains,5Pcs 3296W-503 50K Ohm Resistor Trim Pot Potentiometer Trimmer Blue
,Possession of a Highlander - eBook
Carolyn Haines,Rock-a-Bye Bones : A Sarah Booth Delaney Mystery
I-N-C,I-N-C Mens Contrast Sitching Casual Denim Shorts
Rusticware,"Rusticware 972 Double Knuckle Cabinet Pull with 5"" Center"
Huetron,AC Power Cord Cable compatible for Samsung TV UN46F7100AF - 6ft
Oregon,Oregon 71-816 8-inch Straight Valve Inner tube 480/400-8 (2 Pack)
Made-to-Print,Moon Stars- Die Cut&#44; 0.25 in. to 1.25 in.
Stuffems Toy Shop,"Blue Top Ruby Pants Outfit Teddy Bear Clothes Fits Most 14"" - 18"" Build-a-bear and Make Your Own Stuffed Animals"
,In Search of Jefferson's Moose: Notes on the State of Cyberspace
PPD,PPD Yellow Idler Wheel 165MM O.D. X 25MM I.D. for BOMBARDIER/SKI-DOO All models S2000/GT/MX 1999-2001
Mignova,"iPhone 7 4.7"" Case, Mignova Wallet Case with [Kickstand] Credit Card ID Holders Folio Case Cover for iPhone 7 4.7"" (Gold)"
Tee's Plus,Election 2016 Keep Calm and Vote Santorum Black Adult Hoodie
StylesILove,"Toddler Kid Boys Girls Lightweight Breathable Trendy Slip-on Sneaker (6M US Toddler, Red)"
Beadaholique,"Czech Glass Beads, 2-Hole Pyramid Studs 6mm, 8 Pieces, Crystal Labrador"
Mightyskins,Mightyskins Protective Vinyl Skin Decal Cover for Sony PlayStation 4 PS4 Console wrap sticker skins Carved Wood
Keyscaper,Villanova University Confetti Glitter Case for iPhone X
DAYTON,"Truck,Hand,800 Lb DAYTON 6W857"
Sunsets,Sunsets Stained Glass Muse Bikini Top D-DD Cups
Wyndham Collection,Wyndham WCS777760DGWARINTM24 Morano Double Sink Bathroom Vanity in Glossy White
Janusz Korczak; Antonia Lloyd-Jones,Kaytek the Wizard
Ixir,Ixir Motorola ATRIX HD MB886 Charger Micro USB 2.0 Cable Kit by Ixir (Car Charger + Cable) True Digital Adaptive Fast Charging uses dual voltages for up to 50% faster charging!
DeSantis,"Desantis Mini Scabbard Holster fits KAHR P380, Right Hand, Tan - 019TAR8Z0 - Desantis"
HELIX RACING PRODUCTS,"Pre Filter Foam - Black, Manufacturer: Helix Racing Products, PRE-FILTER FOAM BLACK 750-1105"
Anouk Ricard; Anouk Ricard; Helge Dascher,Anna and Froga : Completely Bubu
MyNetDeals,"Huawei P20 Case, Premium Leather Wallet Pouch Holster Belt Case w/ Loops Holder Cover for Huawei P20 (Fits Phone with Slim Case Cover On) - Built In ID Card Holder - Black"
Tee's Plus,Election 2016 Carly Fiorina Varsity Black Adult Tank Top
Depo,"Replacement Depo 325-50002-202,325-50002-201 Outside Front Pair Door Handle For"
Mightyskins,MightySkins Skin Decal Wrap Compatible with Ring Sticker Protective Cover 100's of Color Options
Ikon Motorsports,M10*1.5 Manual MT Blue T-R Style Gear Shift Knob For VW Jetta Golf Beetle Rabbit
Zexpa Apparel,Call of the Wild Howling the Full Moon Women's Racerback Alpha Wolf
Unique Bargains,"8#-32 x 1/8"" Thread Cup Point Head Hexagon Socket Set Grub Screws Black 50 Pcs"
ITP,ITP Mud Lite XL Tire 25x8-12 for Polaris RANGER 700 HD 2009
Genuine,Genuine W0133-1736911 Engine Cooling Fan Blade for Audi Models
MichaelElectronics2,"HP Z2 Mini G3 Workstation Ultra Small Form Factor Premium Workstation Desktop PC (Intel Xeon E3 Quad-Core, 32GB RAM, 1TB HDD + 256GB PCIe SSD, NVIDIA Quadro M620, WiFi, Bluetooth, Win10 Pro)"
Astro,Astro Pneumatic 4008 Spray Gun with Cup - Red Handle 1.8mm Nozzle 4-Pack
TrekTumblers,TREK Blue Intense Translucent 20 oz - Pom Pom Cheer Mom Tumbler
,Minimum Contract Justice : A Capabilities Perspective on Sweatshops and Consumer Contracts
Wallmonkeys LLC,"Knee Joint Anatomy 3D Wall Mural Decal Sticker, Wallmonkeys Peel & Stick Vinyl Graphic (18 in W x 13 in H)"
Anime,FREEing Kantai Collection: Kancolle: I-168 PVC Figure
Trevco,Jla/New Gl Costume S/S Adult 18/1 Kelly Green Jla390
SULLIVAN PRODUCTS,S590 Aluminum Ball Connector w/Sleeve 2-56 Red
GATES BELTS & HOSES,GATES BELTS & HOSES - 16GS16FLH90120X
DNA Motoring,For 2007-2014 Chevy Silverado/GMC Sierra 6.5Ft Short Bed Aluminum Frame Hard Tri-Fold Tonneau Cover 08 09 10 11 12 13
Mightyskins,MightySkins Skin Decal Wrap Compatible with SteelSeries Sticker Protective Cover 100's of Color Options
INSTEN,INSTEN 6-foot Type A to Mini 5-pin Type B USB Cable/ 4-Port USB Hub
OCSParts,"Whipper Blade/ Propeller, Replaces Wilbur Curtis CA-1008-03"
Awkward Styles,Awkward Styles Shamrock Flag St. Patrick's Day Shirt Men Irish Gifts for Him Lucky T Shirt Saint Patrick's Day Shamrock Tshirt Irish Clover Shirt Funny Irish Men's Shirt Lucky Irish Flag Tshirt
Alumagoal,Ultimate Telescopic Aluminum Volleyball Standard & Pad-Color:Royal
Chloe Inkpen; Mick Inkpen,Look at Me!
Platinum,Platinum 437U Genesis Machined Black 17x7.5 5x4.25 / 5x4.5 40mm (437-7714U+40)
FUNimation Productions,Flesh For The Beast (R-Rated Version)
Toyopia,50 Piece Needle Set on a Hanging Card - Pack of 24
Reaper Miniatures,Reaper Miniatures Toadman #03030 Dark Heaven Legends Unpainted Metal RPG Figure
WeCheer,"Wecheer Collet, 1/4"""
Dave Black,"Alfred's Drum Method, Book 1"
Studebaker,"Am Fm Radio Speaker, Black Studebaker Small Outdoor Retro Portable Am-fm Radio"
LB1 High Performance,LB1 High Performance Laptop Battery for Toshiba C650-191 [6 Cells 10.8V]
Cosmic Flux Musiq,Ikon Massive
Shinko,180/55ZR-17 (73W) Shinko 003 Stealth Rear Motorcycle Tire for Yamaha XSR900 2016-2018
Insten,Insten Tuff Vines Hybrid Case For Samsung Galaxy Grand Prime - Yellow/Black (+ Tempered Glass Protector)
Ganma,Ganma Michael Jackson Case For Samsung Galaxy Note 4 Hard Case Cover
CHOSEN SUPPLIES,Replacement for HP 466747-001 replacement battery
,Miss Lulu Bett
Kenneth S Broun,Black Lawyers White Courts : Soul Of South African Law
PROMAXX AUTOMOTIVE,Zombie Defense Rocker Switch
CHOSEN SUPPLIES,Replacement for CLUB CAR 102787201
UpStart Battery,"2x Pack - UpStart Battery Olympus LI-40B Battery - Replacement for Olympus LI-40B, LI-42B Digital Camera Battery (800mAh, 3.7V, Lithium-Ion)"
Faria Beede Instruments,Faria Beede 13805 Chesapeake White SS 2 in. Voltmeter 10-16 Vdc
Unique Bargains,Water Level Sensor Curved Two Wire Stainless Steel Horizontal Float Switch
Heart of America,"Stallion Braided Stair Tread, Oval 8in. x 28in."
VENTSHADE CO,AVS 04-09 Lexus RX330 Ventvisor Outside Mount Window Deflectors 4pc - Smoke
Omega Products Corporation,"""Soccer"" Vinyl Graphic - Large - Ivory"
Paul Creswick; N C Wyeth,Robin Hood
Itsaskin,Skins Decals For Sigelei Fuchai 213W Plus Vape Mod / City Glow At Night Skyline View
Mais Um Discos,A CURVA DA CINTURA [DIGIPAK]
Mightyskins,Skin Decal Wrap for Hana Modz V3 DNA 40 Mini sticker vape Colorful Hearts
NATIONAL BRAND ALTERNATIVE,FITTING BRUSH 1/2 IN.
Jackson Ultima,Ice Skates Jackson Supreme 5500 Women's Boot
conversation concepts,DHF50A Fox Terrier Brown &amp; White Doogie Head
Accessory Avenue,Yorkie Dog with a Bow Flat Print Design Black Rubber Phone Case That Is Compatible with the Apple iPhone 7/8
Mighty Max Battery,12V 55AH Internal Thread Replaces Everest Jennings 3W Scooter
Electriduct,"1.5"" Flexo Remix PET Expandable Braided Sleeving - Jungle - 40FT"
AquaClear,Aquaclear Bio Max Filter Insert Bio Max 50 (Fits AquaClear 50 & 200) - Pack of 4
Teeblox,Go Sit On A Cactus Fun Font Tee Women's -Image by Shutterstock
various-artists,Instrumental Sonatas of Antonio Bertali
Itsaskin,Skin Decal For Apple Iphone X 10 / Baby Blue Truck Rust
Zebra Pen,"Split Cable, ZebHym,"
Unique Bargains,Unique Bargains 12x Red Black Plastic Cover Metal Alligator Clips Clamps 55mm
Coveroo,Zebra Vertical Black Design on Apple iPhone 5SE/5s/5 New Guardian Case by Coveroo
,Trading Nation : Advancing Australia's Interests in World Markets
Clipsandfasteners Inc,15 Moulding Screw Grommets With Sealer For Nissan 76848-35F00
Lutema,Original Osram Projector Replacement Lamp for Acer MC.JG611.001
