Brand,Product Name
MansBestFriend,2 Level Lounge Activity Center with Retreat Hide Away Corduroy
SmartGifts,Gemstone Globe Bright Silver Keychain - Marine Blue Ocean
CHOSEN SUPPLIES,Replacement for LINCOLN MARK LT YEAR 2008 LICENSE PLATE LIGHT 10 PACK replacement light bulb lamp
CHOSEN SUPPLIES,Replacement for AGILENT / HP AA475 HOLLOW CATHODE LAMP BORON B
CHOSEN SUPPLIES,Replacement for STERLING 827 YEAR 1989 BRAKE LIGHT YELLOW LED REPLACEMENT replacement light bulb lamp
Envelopes.com,6 1/4 x 6 1/4 Gatefold Invitation - Mandarin Orange (500 Qty.)
,Eiko 09320 - LED12WT8F/36/840K-G7D 3 Foot LED Straight T8 Tube Light Bulb for Replacing Fluorescents
Ecosox,"Diabetic Bamboo Quarter Sock, White/Grey Medium - 1 Pkg"
Buckle-Down,Buckle-Down Flying Owls with Leaves Black Multi Color Martingale Dog Collar
Silver,Silver Metallic Foil Streamers
Tampico,"Tampico Spice Tampico Chili Pods, 3 oz"
Frontier,Frontier - Frontier Cut & Sifted Oregano 0.38 oz 19528 4 PACK SD
CHOSEN SUPPLIES,Replacement for MINOLTA RP-606Z replacement light bulb lamp
Ralph Lauren,POLO RED by Ralph Lauren
3dRose,"3dRose Sailboat With Red and Purple Florida Sunset, Greeting Cards, 6 x 6 inches, set of 12"
First Aid Only,"First Aid Only Hand Sanitizer Packets fit First Aid Kit, 10 Packets (FAOFAE4007)"
Dingo,Dingo Meat in the Middle Rawhide Chew Bones Mini - 2.5 (21 Pack) - Pack of 12
American White Cross,"American White Cross Tricot Adhesive Strips Bandages 3/4"" x 3"" 200-Ct"
Vibrant Life,"Vibrant Life Reflective Red Bones Dog Collar, Large, 15-26 in, 1 in"
Creative Images Systems,"4 Pack - Creative Images Systems Adore Semi-Permanent Haircolor, [060] Truly Red 4 oz"
GoodSense,Good Sense Miconozole 3 Combo with Disposable Applicators Tube&#44; 0.32 oz- Case of 12
RoomFactory,Wood Tones Pencil Cup&#44; Black&#44; 2 3/4 x 2 3/4 x 4
Chico Creek Signs,Patty's Green Wine Bar Personalized Sign Wall Decor 16 x 24 Matte Finish Metal 116240043254
Le Jasmin,LE JASMIN by Miller Harris
N/A,Peppermint Widget Genuine Leather Dog Collar Red 10
,"Kirkland Signature Sweet Mesquite Seasoning, 4-pack"
Nishiki,"Nishiki Medium Grain Rice, 10 lb"
JAM Paper,"JAM Paper Plastic Envelopes with Snap Closure, Letter Booklet, 9 3/4 x 13, Assorted Colors, 6/Pack"
Depend,"6 Pack - Depend Men Maximum Absorbency Underwear, Small/Medium 19 ea"
,PB3655R Red 10 Inch x 12 Inch 2 Mil Reclosable Poly Colored Plastic Reusable Bags CASE OF 1000
Farmers Market Bar Soap,"Farmers Market Natural Bar Soap Pumpkin Spice, 5.5 Oz, 3 Pack"
Tonic,"Tonic Studios Scissor 8"" General Purpose"
Calendars,"2019 Classic Comic Book Covers 2019 Desk Calendar, Cartoons | Comics by Retrospe"
Pantene,6 Pack - Pantene Pro-V Gold Series Hydrating Butter-Creme 6.8 oz
Inktastic,Worlds Best Aviation Mechanic Daddy Baby Bib
CHOSEN SUPPLIES,Replacement for USHIO 1000833 replacement light bulb lamp
ProCare Braces,ProCare Clinic Shoulder Immobilizer
Ebern Designs,Ebern Designs 'Cross Dressing' Print
Carrera,"Carrera 5032/COV Sunglasses CA5032COV-0ZT8-5218 - Green Frame, Lens Diameter 52mm, Distance"
CHOSEN SUPPLIES,Replacement for VOLKSWAGEN BEETLE L4 2.0L 480CCA YEAR 2001 GLOVE 10 PACK replacement light bulb lamp
Simon Sez,Michigan State Spartans Angry Birds - Black
NCAA,Kolder ALABAMA ALT Kolder Kaddy
Laddawn,"Laddawn Gusseted Poly Bags, 2 Mil, 10 X 6 X 24, Clear 500/Case"
Generic,comfortable Flex-Knee Support Brace for Maximum Pain Relief and Stability
Morning Star Farms,"Morning Star Farms Breakfast Maple Flavored Sausage Veggie Patties, 6 count, 8 oz"
DollarItemDirect,"CANDY PEPPERMINT BARK ROSE BOX 4 OZ., Case Pack of 12"
Pantene,"Pantene Pro-V Radiant Color Shine Conditioner, 24 fl oz"
,Norman 90404 - LED-G9-4W-4KDIM LED Bi Pin Halogen Replacements
Hawaii Pharm LLC,"Chuan Bei Mu, Tendrilleaf Fritillary (Fritillaria Cirrhosa) Glycerite, Dried Bulb Powder Alcohol-Free Liquid Extract, Yellow Himalayan Fritillary, Glycerite Herbal Supplement 15x4 oz"
Pooch Outfitters,Pooch Outfitters PJRC-XS Jake Raincoat&#44; Brown - Extra Small
The Party Aisle,The Party Aisle Abigayle Balloons with Banner Happy 26th Birthday Coffee Mug
Bigelow Tea,"Bigelow Tea Decaf Chai Spiced, 20 CT (Pack of 6)"
,(4 Boxes) Lipton Magnificent Matcha Green Tea Bags Ginger 15 ct
SignFever,"Claire's Parking Only All Others Will Be Towed Name Gift Novelty Metal Aluminum 18""x24"" Sign"
TerraVita,"Comfrey Root (Certified Organic) Powder (1 oz, ZIN: 517628) - 3-Pack"
3dRose,"3dRose Funny Cute Hyena Playing Banjo Cartoon - Greeting Card, 6 by 6-inch"
Marc Jacobs,Eyeglasses Marc Jacobs 250 0807 Black
Birdz Eyewear,Three Bottles of Birdz Eyewear Amazing Purity Lens Cleaning Spray
bulk buys,Woven Figure Eight Dog Rope Toy
Fairy Tales,"3 Pack - Fairy Tales Lice Good-Bye, Lice Removal System w/ Comb 1 ea"
New Way,New Way 1120 - Crewneck Your Job Could Be Worse Toilet Paper Sweatshirt 4XL Light Pink
NBS,"Vending-World - 18x Flavor Strip For 12 oz Cans Soda Pepsi Coke Vending, fits Dixie Narco, Vendo"
Box Packaging,"Box Packaging White Deluxe Literature Mailer, 50/Bundle"
Mi Amore,Owl shaped keychain kekc6231
2Bhip,The Wonder Years TV Show Original Hipster Paul Pfeiffer Adult T-Shirt Tee
Birddog Distributing Inc.,BirdDog CC-50-RB4 13.12 ft. Brilliant Custom Cut 120V SMD-5050 LED Strip Plant Grow Light
Cybrtrayd,"Bulb Chocolate Candy Mold with Exclusive Cybrtrayd Copyrighted Molding Instructions, Pack of 6"
Fun Express,IN-13681932 Umbrellaphants Pink Swirl Hanging Decorations 3 Piece(s) 2PK
SleekLighting,"SleekLighting BR30 LED 13.5 Watt, ""Dimmable"" Wide Flood Light Bulb(110°), Warm White (3000K), 1100 Lumens, E26 Medium Base, 85 Watt Equivalent, UL Approved (PACK OF 4)"
Eros,Eros F01-TB217 Hologram & Printed Word Strip - 15 per Pack - Case of 48
Dezicakes,"Christmas Cake Fake Cake Prop Decoration Dezicakes 6"" Cake"
Ouidad,Curl Quencher Moisturizing Conditioner (Tight Curls)-1000ml/33.8oz
Unique Bargains,Nail File Buffer White Sanding Block Tips Manicure Tool 4 Way 5pcs
New Green Nutrition,Hand-selected A Grade American Ginseng Medium Thin-Short Size (4 Oz. Bag)
CHOSEN SUPPLIES,Replacement for RENAULT R5 YEAR 1986 FRONT SIDE MARKER LIGHT 10 PACK replacement light bulb lamp
Quickie,Quickie Cotton Deck Mop
Envelopes.com,A6 Invitation Envelopes w/Peel & Press (4 3/4 x 6 1/2) - Baby Blue (1000 Qty.)
Revision,Revision Skincare Teamine Concealer Light 0.35 oz - New in Box
CHOSEN SUPPLIES,Replacement for SVP841003 PANEL COWL AWD CRIMSON RED
Cybrtrayd,"Corset Lolly Chocolate Candy Mold with Exclusive Cybrtrayd Copyrighted Molding Instructions, Pack of 3"
AG Hair,4 Pack - AG Hair Care Renew Clarifying Shampoo 33.8 oz
Kinsman Enterprises,Kinsman Polycarbonate Partitioned Plate
CHOSEN SUPPLIES,Replacement for PORSCHE 911 YEAR 2009 BACK UP LIGHT AMBER LED REPLACEMENT replacement light bulb lamp
Regency Products,"Regency 5-Piece 36"" Square Table with Black Post Legs with 4 Stackable Chairs"
Rayne Mirrors,Rayne Mirrors American Made Rayne Stitched Black Leather Blackboard/Chalkboard
Jrheller,Orange Crepe Streamer Case Pack 36
Eye Buy Express,Ebe Reading Glasses Mens Womens Amber Red Oval Round Full Frame Anti Glare grade ckbdp9118
LIEBERS,LIEBERS MARSHMALLOW CHOC CVRD
Ever Ready First Aid,EverStop First Aid Blood Stopper Compress Multi-Purpose Wound and Trauma Dressing- 3 Pack by Ever Ready First Aid
NARS,NARS Night Series Eyeliner
Unique Bargains,Unique Bargains A6 Paper Zipper Closure Files Folders Holder Bag Green
Maple Holistics,Moisturizing Shampoo for Dry Damaged Hair - Natural Hair Care - Curly Hair Frizz Control - Sulfate Free Hydrating Shampoo for Color Treated Hair - Pure Oils for Men Women Kids Sensitive Skin - 10 oz
Giorgio Armani,New Giorgio Armani 5043 Mens Designer Half-Rim Taupe Frame Demo Lenses 56-19-150 Eyeglasses/Eyeglass Frame
Bianca Rosa,"Camu Camu Salve (2 oz, ZIN: 523920)"
Country Brook Design,Country Brook Design 3/4 Inch Nylon Dog Leash (Various Colors & Lengths)
Cybrtrayd,"Squares with Bows (Presents) Chocolate Candy Mold with Exclusive Cybrtrayd Copyrighted Molding Instructions, Pack of 6"
Deflecto,"Deflecto DocuPocket, Wall File Organizer, Stackable, Letter Size, Black, 1 Compartment, 13""W x 7""H x 4""D"
Masimo,"Masimo Radical Series Power Cord Lock, 5/Pack"
Langers,"(8 Pack) Langers Juice Cocktail, Kiwi Strawberry, 64 Fl Oz, 1 Count"
CHOSEN SUPPLIES,Replacement for ORBITEC 12277812V55WPX26D replacement light bulb lamp
Buckle-Down,Buckle-Down Martingale Dog Collar - Mohawk Skulls - NO Star
Touch of Color,"Party Creations Hot/Cold Cups, 9 Oz, Pastel Blue, 8 Ct"
Ames Walker,Ames Walker Women's AW Style 7061 Lymphedema Compression Armsleeve w/ Silcone Band - 20-30 mmHg AW7061-P
SheaMoisture,3 Pack - Shea Moisture African Black Soap Clarifying Mud Mask with Tamarind Extract & Tea Tree Oil 0.5 oz
Graham Field,"Graham-Field Health FR566DGH6717 Recliner Dr Arm Ht&amp;Mas Moss Ca-133, Lumex"
Wahl,Wahl Cordless Battery Operated Beard Trimmer 1 ea
CHOSEN SUPPLIES,Replacement for BMW 2002TI L4 2.0L 345CCA TAIL LIGHT YEAR1972 10 PACK replacement light bulb lamp
CHOSEN SUPPLIES,Replacement for WESTINGHOUSE 04747 replacement light bulb lamp
mirage-pet-products,mirage 614-02 bk-18 two row ab crystal black ice cream dog collar - size 18
CHOSEN SUPPLIES,Replacement for VOLKSWAGEN PASSAT CC YEAR 2011 CORNERING LIGHT replacement light bulb lamp
DOCO,Doco DCA201-18XL Puffy Air Mesh Step-In Harness Leash&#44; Raspberry Pink - Extra Large
Unique Bargains,Pet Cat Puppy Hoodie Single Breasted Sleeved Apparel Coat Clothes Gray Size XL
DDI,"DDI 2184791 54"" X 108"" Rectangular Heavyweight Plastic Tablecloth - Purple Case of 72"
My Personal Journals,N: Personalized Initial Journal/Notebook/Diary (Paperback)
Lgp,JAKE and the NEVER LAND PIRATES Red STAR 5 Birthday PARTY Supplies Mylar BALLOONS by Lgp
Moxxie,"""Cure For All Double-Sided Cardstock 12""""X12""""-Hope"""
Donna Karan,Be Delicious Crystallized Eau De Parfum Spray 1.7oz
Crystal Dream,Personalized Name Nautical Pacifier
CHOSEN SUPPLIES,Replacement for AH LIGHTING CF14/R30/27K replacement light bulb lamp
Country Brook Design,Country Brook Design Premium Puppy Picnic Ribbon Dog Collar
Ishow Hair,"Ishow 7A Brazilian Loose Wave Frontal Closure with Bundles 13x4 Ear to Ear Lace Frontal Closure with 3 Bundles, 12""14""16"" with 10"""
CHOSEN SUPPLIES,Replacement for HEINE BETA 200 OPHTHALMOSCOPE TL CONNECTOR replacement light bulb lamp
UBesGoo,UBesGoo Large Dog Pet Crate Kennel Warm Bed Beds Mat Blanke For Pad House
Unique Bargains,Metal Faux Rhinestones Inlaid Design French Hair Clip Barrette Gold Tone
Rubba Ducks,Rubba Ducks RD00018 Duckhorn Collector Display Box
Divinity,Monarch M-initial keychain h-(Pk/2)
Oberto,Oberto All Natural Beef Jerky Teriyaki10.0 oz.(pack of 1)
Summer Infant,(2 Pack) Summer Infant ComfortMe Neck Support
Montblanc,Montblanc Rectangular Eyeglasses MB583 028 Size: 56mm Rose Gold/Black 583
Ruby Rock-It,"Fusion Double-Sided Cardstock 12""X12""-Yellow Damask"
Vinnic,ECO FRIENDLY 12pc AA Heavy Duty 0% MERCURY 0% LEAD 0% CADMIUM Battery LR6 E91
EG Envelope Gallery,"Shipped Free Ivory 100 Boxed A7 (5-1/4 x 7-1/4) Contour Euro Flap 70lb Envelopes Perfect for 5 x 7 Invitations, Announcements, Weddings by The Envelope Gallery"
Mirage Pet Products,Birthday Girl Rhinestone Shirt Red XS (8)
Black Duck Brand,"Set of 4 Black Duck Brand Non-Woven Reusable Fabric Holiday Gift Bags 12""x13""x8.25"" (Red)"
VIRGINIA,Virginia Magnetic List Pad Va Cavaliers
Estee Lauder,Double Wear Stay In Place Makeup SPF 10 - No. 93 Cashew (3W2) 1oz
Solaray,"Solaray Ginger Trips 67 mg Chewable Wafers, 60 Ct"
Duck,"Duck Tape Colored Duct Tape, 1.87"" x 15 Yards, Neon Yellow"
Day-Timer,Day-Timer 2-Page-Per-Day Reference Planner Refill Notebook Size -
Larissa Veronica,"Lemon (Natural) Bakery Emulsion (16 oz, ZIN: 527236)"
Caroline's Treasures,American Foxhound Christmas Sticky Note Holder BB8433SN
Serge Lutens,Chergui Eau De Parfum Spray-50ml/1.69oz
"Puzzled, Inc.",Planet Pens Lighthouse
3dRose,"3dRose Cool Trendy Fashion Girl Watercolor Illustration for Chic Girls - Mini Notepad, 4 by 4-inch"
Caroline's Treasures,Letter C Flowers Retro Blue Retractable Badge Reel CJ2012-CBR
Eye Buy Express,Ebe Men Black Rectangle Half Rim Spring Hinge Eyewear Reading Glasses 2036
Adorable Supply Corp,Prime-Kote U24 8.5 x 11 3-Part White Carbonless Computer Forms
Griots Garage,Griot's Garage Wholesale 15939 Surface Cleaner - 35 Oz.
CHOSEN SUPPLIES,Replacement for TOYOTA PRIUS YEAR 2014 BACK UP LIGHT 10 PACK replacement light bulb lamp
Michael Steddum,Get It Golden Retriever Note Card Set
CHOSEN SUPPLIES,Replacement for AMERICAN ULTRAVIOLET UFA-30-2C replacement light bulb lamp
Verbatim,Verbatim 98566 - LED PAR20 P20-L490-C27-B40-W PAR20 Flood LED Light Bulb
Chico Creek Signs,Cleo's Green Wine Bar Personalized Sign Wall Decor 8 x 12 High Gloss Metal 208120043117
guzzie-plus-guss,"guzzie plus guss tiblit high-chair with mircofibre, orange"
Chico Creek Signs,COFFEY Street Sign Rustic Chic Sign Home man cave Decor Gift White G41804821
Eye Buy Express,Eye Buy Express Kids Childrens Reading Glasses Violet Rectangular Full Frame Style Anti Glare grade d5343
Super,"Green Direct Plastic Containers for Lunch/Large Food Container with Lid, Leak Proof, Microwavable, Freezer & Dishwasher Safe (36, 8 oz)"
Unique Industries,"Red Plastic Party Tablecloth, 108 x 54in, 2ct"
Fancyleo,Fancyleo Christmas Glasses Frames 2 Pack Glittered Eyeglasses Glasses Set No Lens Kids Family Xmas Party Ornaments Gift
Country Brook Design,Country Brook Design 3/4 Inch Christmas Wish Ribbon Leash - 4 Feet
SignFever,"Private Property No Unauthorized Parking Restriction Alert Attention Caution Warning Notice Aluminum Metal Sign 12""x18"" Plate"
Graphics and More,Pug Dog Pet Leather Luggage ID Tag Suitcase Carry-On
DC,Buckle Down DC Comics Pet Dog or Cat Leash
Choice One,6 Pack Nostrilla Nasal Decongestant 12 Hour Fast Relief 15 ml for Stuffy Noses
Nice N Easy,Clairol Nice 'N Easy Medium Brown (Pack of 20)
Kolder,Tennessee Titans Kolder Kaddy Can Holder - Glitter
LIGHTSMAX,Champion IR - Medical Ear Thermometer with Forehead Function - Infared Technology & LCD Screen for Improved Accuracy
Empirical Labs,"Empirical Labs, Auralife 120 caps"
RBI,LYON'S LEGACY EMPIRE by Simon James London EDT SPRAY 1 OZ
AIGNER INDEX,"Magnetic Label Roll,Perforated,50 Ft,Blk AIGNER INDEX MP-103R"
Pixnor,"90cm Dizzy Danglers Party Swirl Spiral Haning Pendants for Party , 6pcs (Bright Red)"
Echo Park Paper,Echo Park Getaway Paper 12x12 Lt Blue/Green
Jessica,Jessica GELeration Soak-Off Gel Polish 0.5oz/ 15ml (GEL-558 I DO!)
Sparkle,"Sparkle Paper Towels, Pick-A-Size, 15 Mega Rolls"
Partypro,Partypro TQP-3255 55! Dangler
The Best Card Company,'B6665AXSG Visions Of Christmas Christmas Cards' Box Set of 12 Funny Merry Christmas Note Cards with Envelopes by NobleWorks
Cicero Bacon Bloody Mary Mix 32 oz each,Cicero Bacon Bloody Mary Mix 32 oz each (5 Items Per Order)
Coppertone,3 Pack Coppertone Sport Sunscreen Lotion SPF 50 7oz Each
SUMMERFIELD TERRACE,"Secret Key Hider, Garden Key Hider Outdoor Cast Iron Small Key Holder Ladybug"
Japonesque,Japonesque Pro Performance Lip Lacquer 5ml New in Box [Choose Your Shade]
Sunco Lighting,"Sunco Lighting 16 Pack A19 Dusk to Dawn 9W LED Light Bulb 2700K, Soft White"
KILTER,KILTER Eyeglasses K5003 210 Brown 49MM
Eye Buy Express,Eye Buy Express Prescription Glasses Mens Womens Burgundy Crystal Clear Yellow Rounded Rectangular Reading Glasses Anti Glare grade
Bh Pet Gear,"Jelly Wellies Deluxe Raincoat, Extra Small, 11"", Pink"
Truly Indian,"Truly Indian, Sauce Butter Chicken, 13 Oz (Pack Of 6)"
,"Unique Pretzel Extra Dark Splits, 11 oz (Pack of 12)"
Unconditional Love,Skull Crossbones Screen Print Soft Mesh Harness Blue Medium
Unconditional Love,British Flag Heart Screen Print Shirt Baby Blue Sm - 10
Eye Buy Express,Ebe Reading Glasses Mens Womens Gold Harry Potter Style Horned Rim Anti Glare Cozy zsm5500
Model Model,Model Model Synthetic Fullcap Band - Carmen (1B)
Cybrtrayd,"Shell Assortment Chocolate Candy Mold with Exclusive Cybrtrayd Copyrighted Molding Instructions, Pack of 3"
AARCO,AARCO Enclosed Wall Mounted Bulletin Board
Pull-Ups,Pull-Ups Girls' Learning Designs Training Pants (Choose Pant Size and Count)
Graphics and More,Gray Wolf with Fall Background Double-Sided Oval Nail File Emery Board 4 Pack
Fresh Roasted Coffee,"Lava Java Coffee, 12 Oz. Whole Bean Bags, Fresh Roasted Coffee LLC. (3 Pack - Whole Bean)"
Emporio Armani,Emporio Armani 3071
Boss (hub),Boss (hub) Boss 0551 Eyeglasses 0INX 58 Black Ruthenium
Lalique,NOIR PREMIER OR INTEMPOREL/LALIQUE EDP SPRAY 3.3 OZ (100 ML) (U)
Eye Buy Express,Ebe Men Gold Shield Half Rim Spring Hinge Reading Glasses a970
Paper Accents,Snippets Card & Envelope 4.25x5.5 3pc Natural Parch
OPI,"OPI Nail Lacquer, OPI Classics Collection, 0.5 fl oz - Tutti Frutti Tonga S48"
Inktastic,Tuba Player Future Kids Music Baby Bib
PowerStar,PowerStar--FRESH New 12V 5AH Battery for UB1250 D5741 Home Security Alarm
Ghirardelli,"Ghirardelli Chocolate Melting Wafers, 30 Ounce Bag (White Chocolate)"
Axe,"6 Pack - Axe Body Wash for Men, You 16 oz"
3dRose,"3dRose Sarcasm noun the brains defense against the less intelligent. - Greeting Card, 6 by 6-inch"
CHOSEN SUPPLIES,Replacement for HALCO 55126
Beistle,Musical Cake Server w/Candles Set Party Accessory (1 count) (1/Pkg)
Heepo,Heepo Fashion Lovely Dog Style Pet ID Tag Collar Necklace Metal Pendant Accessories
Jordana,(6 Pack) JORDANA Incolor LipShine Glaze Brush On Gloss - Pina Colada
Createx,"Wicked Colors grey, 2 oz. (pack of 3)"
MAOTAIZI,MAOTAIZI Electric Pencil Sharpener Battery Operated Automatic Single-hole Pencil Sharpeners with LED Light for Classroom Office Home Art Drawing Blue
Holiday Time,Holiday Time 8 Ct Craft Hoho Tags
CHOSEN SUPPLIES,Replacement for CHEVROLET ASTRO YEAR 1988 BRAKE LIGHT 10 PACK replacement light bulb lamp
Sigvaris,SIGVARIS 781CMSO99 15-20 mmHg Eversheer Knee Highs-Med-Short OT-Black
Crimp Supply,"100 Feet Medium / Heavy Dual-Wall Adhesive Heat Shrink 1/4"" BLACK 3:1 Ratio 4ft. x 25 pc. by Crimp Supply"
Eclectic Lady,"Sweetgrass Bath Oil, 8 oz"
Unique Industries,"Square Fun Tropical Summer Party Plates, 7 in, 10ct"
Nashvillewraps,"1 Unit Fuchsia Tissue Paper 20x26""480 Sheet Ream Unit pack 1"
Mohawk,Mohawk Via Linen 8.5 x 11 Pure White Cardstock 80lb Cover 250/Ream
Envelopes.com,8 1/2 x 14 Cardstock - Crystal Metallic (500 Qty.)
ProTan,Pro Tan Man Up Magnum Dark Tan Accelerator 9 oz.
Sensationnel,Sensationnel Instant Weave Hand-Tied U-Part Wig OXFORD (F4/30)
WinCrest BulkFoods,Mini Chocolate Candy Chip Cookies - 1.5 Lb (24 Oz) Tub
Kong,"KONG EZ Soft Collar, Small"
Tussy,"Tussy Roll-on Deodorant, Powder Fresh 1.7 oz (pack of 3) + Schick Slim Twin ST for Sensitive Skin"
CSC Spa,CSC Spa KD-8908 Bio Wave Eye Wrinkle Remover
PackagingSuppliesByMail,"3"" Core, Thermal Transfer Label 4"" x 4"", Perforated, Ribbon Required 16 Rolls (23600 Labels)"
MULTIPET,"Egg Noggins, Assorted Colors Singles 4"""
CHOSEN SUPPLIES,Replacement for PARTS-44X4051 X6 FULL-18 I/O BOOK
Attends,"Attends Medium-Weight Dry Wipes, 50 count, (Pack of 20)"
Halco,Halco 109076 - PL26T/E/50/ECO Triple Tube 4 Pin Base Compact Fluorescent Light Bulb
Viugreum,"Makeup Brushes Premium Makeup Brush Set , 7PCS Fishtail Brush Bottom Powder Blush Brush Makeup Cosmetics Brush Makeup Brush Mermaid by Viugreum"
Caroline's Treasures,Seahorse Baby Bib & Burp Cloth BB7119STBU
Larissa Veronica,"Raspberry Chamomile Tea (Loose) (8 oz, ZIN: 530881)"
The Good Bean,The Good Bean Chickpeas Thai Coconut Lemongrass 6 oz
Breaktime,"Coffee Break Lunch Room Furniture FULLY ASSEMBLED ""Ready-To-Use"" 3pc Group BREAKTIME Model 2791 ? Espresso/Silver Metallic...INSTANTLY create a Lunch Break Room!!! (Includes Furniture Cabinets ONLY)"
Marvel,Marvel Avengers Landscape Canvas Wall Art with LED
Lipstick Queen,"3 Pack - Lipstick Queen Sinner Lipstick, Candy 0.12 oz"
MIXTEANDO,Mixteando La Cubana Mixer 6.8oz
Amscan,Teenage Mutant Ninja Turtles Thank-You Notes
Amscan,The Party Continues 50th Birthday Confetti - Party Supplies
Sterilite,Sterilite Plastic Heavy Duty File Crate Stacking Storage Container (12 Pack)
Inesscents Aromatic Botanicals,Organic Calendula Oil - 4 fl. oz. by Inesscents Aromatic Botanicals (pack of 3)
Yves Saint Laurent,Yves Saint Laurent Mascara Vinyl Couture - # 0 I'm The Endless
CHOSEN SUPPLIES,Replacement for PORSCHE 928 YEAR 1993 FRONT SIDE MARKER LIGHT 10 PACK replacement light bulb lamp
Cross,"Cross Jot Zone Journal, Black/Slate, Medium (AC273-2M)"
Health Adjuster,Compression Anti - Embolism Stocking 18 Knee High Closed Toe Compression Stocking White&#44; Large
NEST Fragrances,Nest Fragrances Limited Edition Laundry Detergent - Linen 32 fl oz
Primizie,Primizie Thick Cut Hatch Chile Crispbreads (18 oz.)
FindingKing,100 CLEAR Reclosable Zipper Bag. 4' x 6' - 2 mil. thick
Unconditional Love,Studded Dragon Hoodies Pink XXL - 18
Markings by C.R. Gibson,MIZZU TIGERS METALLIC 1-SUBJECT NOTEBOOK
Eye Buy Express,Ebe Prescription Glasses Mens Womens Burgundy Black Rectangular Half Rim Anti Glare grade s3130
Eye Buy Express,Ebe Reading Glasses Womens Mens Tortoise Regular Hinge Acetate Retro Anti Glare 268116
Runk,Kits Candy Vanilla flavor 5 pounds Vanilla Kits
HeroFiber,"Paper Tableware Set for 24 - White & Red - Dinner and Dessert Plates, Cups, Napkins, Cutlery (Spoons, Forks, Knives), and Tablecloths - Full Two-Tone Party Supplies Pack"
Pumpkin Tree,"Peter Rabbit Organics Beet, Carrot and Pear, 4.4-Ounce Pouches (Pack of 10)"
Echo Park Paper,Birthday Wishes Boy Double-Sided Cardstock 12 Inch X 12 Inch-Birth
Upper Crust,"Upper Crust Caribbean Coconut Panko Bread Crumbs, 10 Pound -- 1 each."
MegaCalendars,Schnauzer Calendar 2019 - Schnauzer Dog Breed Calendar - Schnauzers Premium Wall Calendar 2018-2019
Sunbelt Bakery Family Pack,"Sunbelt Bakery Family Pack Raspberry Fruit & Grain Bars, 11 oz"
Pentel,"Pentel EnerGel NV Liquid Gel Pen, 0.5mm, Needle Tip, Black Ink, 2 Pack (BLN15BP2A)"
CHOSEN SUPPLIES,Replacement for OSRAM SYLVANIA 30R20 120V replacement light bulb lamp
CHOSEN SUPPLIES,Replacement for 60/4625 HARLOW 5 LIGHT CHANDELIER WITH SLATE GRAY FABRIC SHADES POLISHED NICKEL CONTEMPORARY replacement light bulb lamp
Mott's,"(4 Pack) Mott's 100% Original Apple Juice, 4.23 fl oz, 4 pack"
Carrera,Carrera CA 8823 Eyeglasses 0R81 Matte Ruthenium
Project E Beauty,Portable Cold Warm Therapy Hammer Facial Masseager Skin Rejuvenation Anti-Aging Spa Beauty Salon Home Use Device
Alfred Dunhill,DESIRE by Alfred Dunhill - EDT SPRAY 3.4 OZ - MEN
Turkey Hill,"Turkey Hill Diet Decaf Lemon Tea, Half Gallon"
mirage-pet-products,mirage 62-25-04 mdpr feliz navidad screen print pet hoodie purple m
CHOSEN SUPPLIES,Replacement for ERGOTRON SV42-56E1-1
Quantum Research,Quantum Therazinc Cold Season Plus Lozenges Lemon - 14 Mg - 24 Lozenges
Unconditional Love,Bone Shaped American Flag Screen Print Shirts White XXL - 18
Dynarex Corporation,Dynarex - Itch Relief - 1% Strength Cream - 72/Case - 1 oz. Tube - McK
dickinson,"Dickinsons Lemon Curd, 10 OZ (Pack of 6)"
CHOSEN SUPPLIES,Replacement for SYLVANIA 23618 replacement light bulb lamp
Colorations,Colorations Glitter Confetti - 8 oz. (Item # GCON)
DOCO,Doco DCS005-10XL Double D-Ring Dog Neck Collar&#44; Olive Green - Extra Large
CARRERA,CARRERA Eyeglasses 8813 0A1A Transparent Matte Blue 55MM
L'Oreal Paris,"L'Oreal Paris Skin Expertise Revitalift Radiant Smoothing Cream Cleanser, 5.0 fl oz"
Tuscom,Tuscom Creative Crystal Metal Pen Rotary Ballpoint Pen Pen Pen Hotel Gift Pen
CHOSEN SUPPLIES,Replacement for JUNIPER 4229DCP
Bilt-Rite Mastex Health,LSO-Rite 2 Body Jacket
August Grove,August Grove 'Sunset Flight' Print
FLA Orthopedics,FLA Therall Heat Retaining Back Support - X-Large
Hawaii Pharm LLC,"Foxnut (Euryale Ferox) Glycerite, Organic Seeds Alcohol-Free Liquid Extract, Qian Shi, Foxnuts, Glycerite Herbal Supplement 2x2 oz"
Oliga Calura,Oliga Calura Permanent Shine Hair Color 2 fl.oz. (9-8) 9B
Sorbus,Sorbus Acrylic Cosmetics Makeup and Jewelry Storage Case X-Large Display Sets -Interlocking Scoop Drawers to Create Your Own Specially Designed Makeup Counter -Stackable and Interchangeable (Pink)
Displays2go,"Set of 10, Clear Acrylic Sign Holders for (2) 8.5x11 Graphics, Wall-Mounted Poster Frames Includes Hardware for Installation (AMZREG8511)"
HeroFiber,"50 Pink Plastic Plates (9""), 50 Hot Pink Plastic Cups (12 oz.), and 50 Pink Paper Napkins, Dazzelling Colored Disposable Party Supplies Tableware Set for Fifty Guests."
Penn-Plax,Penn Plax Ammonia Remover Infused Filter Media Pad - BULK - 3 Pads - (3 x 1 Pack)
Gen7Pets,"Gen7Pets Cool-Air Cot Pet Bed, Large, Trailblazer Blue"
Veronica's Treats,Birthday Chocolate Covered Oreo Cookie Gift Box
Kinsman Enterprises,Kinsman Enterprises KNE 37001 27 in. Ergo Plus Reacher Basic Hip Kit
Larissa Veronica,"Strawberry Black Tea (25 tea bags, ZIN: 530922) - 3-Pack"
MidWest Homes for Pets,"Midwest 30"" Canine Camper Sportable"
Protect Me Alert Series,"Protect Me Alert Series Hooded Sweatshirt and Bag Dispenser, Medium, Turquoise"
SIGVARIS,Sigvaris Advance Armsleeve 912AXRG77-PS 20-30 mmHg Advance Arm Sleeve With Gauntlet Plus; Beige; Extra Large and Regular
Spry,Spry Peppermint Gum 55 ct Jar
BRADY,"BRADY Wire Marking Sleeves,2in.Wx7/16in.H B33D-250-2-344"
Gillette,"Gillette Sensor Refill Blade Cartridges, 10 Count + Schick Slim Twin ST for Dry Skin"
Larissa Veronica,"Bergamot Lemon Lime Flavor Extract (8 oz, ZIN: 528879)"
Gillette,Compatible Razor fits with Sensor Excel for Women Refill Cartridges + Sensor Excel 10 Ct. (2 Pack) + Yes to Coconuts Moisturizing Single Use Mask
Giovanni,"Giovanni 2Chic Brazilian Keratin & Argan Oil Ultra-Sleek Hair & Body Super Lotion, 53 ml / 1.8 oz-Pack of 4"
Generic,"Mosquito Repellent Bracelets [No Spray, DEET-FREE] 2x FREE Repellent Refills - Best Pest Control Repeller for Ants, Inse"
POPCreation,POPCreation Floral School Pencil Case Pencil Bag Zipper Organizer Bag
CHOSEN SUPPLIES,Replacement for NATIONAL STOCK NUMBER NSN 6240-01-065-0009 10 PACK replacement light bulb lamp
BeYu,BeYu - Dip Eye Liner - Grey
