Available,Product Name
FALSE,Produce Houweling's Tom Snacking 10.5 Oz
FALSE,"matave organic 20% vitamin c anti-aging facial serum. reduces wrinkles & fine lines pure vegan formula contains 20% vitamin c, vitamin e, organic aloe, 11% hyaluronic acid, ferulic acid & amino blend"
FALSE,Heepo Tiger Skin Pattern Rainbow Soft Flannel Carpet Cat Dog Puppy Pet Blanket Mat
FALSE,"Unik Occasions Sparkling Collection Monogram Cake Topper, Silver"
FALSE,Country Brook Design 3/4 Inch Nylon Dog Leash (Various Colors & Lengths)
FALSE,Rapesco 923/12mm 23 Type Galvanised Staples
FALSE,Buckle-Down PC-W30348-NM Cameroon Flags Plastic Clip Collar
FALSE,Travel Cosmetic Makeup Toiletry Case Portable Wash Organizer Storage Pouch Bag
FALSE,"ConvaTec ActiveLife - 1-Piece Urostomy Pouch - 1"" Pre-Cut Convex Durahesive Skin Barrier and Fold-Up Tap, Transparent"
FALSE,DuraGlobe Monthly Planner
FALSE,British Flag Heart Screen Print Shirt Baby Blue Sm - 10
FALSE,Solid Dog Polo by Doggie Design - Ultra Violet - 3X-Large
FALSE,"Moleskine Messages Postal Notebook, Large, Plain, Persian Lilac, Soft Cover (4.5 x 6.75)"
FALSE,comfortable Flex-Knee Support Brace for Maximum Pain Relief and Stability
FALSE,Birthday Wishes Boy Double-Sided Cardstock 12 Inch X 12 Inch-Birth
FALSE,HILASON 1200D RIPSTOP WATERPROOF TURNOUT HORSE LIGHT WINTER SHEET GREN PLAID
FALSE,AARCO Enclosed Wall Mounted Bulletin Board
FALSE,"Gerber Nuk BPA Free Silicone Orthodontic Pacifier 6-18 Months, Size 2, Colors May Vary - 2 Ea"
FALSE,"Splash Home GEL-B Non Slip Bath Pillow Luxurious Cushion Spa for Bathtub, Hot Tub, Jacuzzi, With 2 Strong Suction Cups, Supports Neck and Shoulders - CLEAR"
FALSE,"Electric Height-Adjustable Teaming Table, Racetrack - 72x36"" Silver/Cherry"
FALSE,Patty's Green Wine Bar Personalized Sign Wall Decor 16 x 24 Matte Finish Metal 116240043254
FALSE,Strawberry Shortcake 'Dolls' Compact Mirrors / Favors (4ct)
FALSE,Osteo Bi-Flex Joint Health Omega-3 Formula 120 Rapid Release Softgels
FALSE,Buckle Down Marvel Comics Pet Dog or Cat Leash
FALSE,Norman 90404 - LED-G9-4W-4KDIM LED Bi Pin Halogen Replacements
FALSE,VERA WANG Sunglasses MIELA Crystal 53MM
FALSE,3 Pack - CHI Volume Booster Liquid Bodifying Glaze 8.5 oz
FALSE,2-Pack Replacement Light Bulb for Kenmore / Sears 79077519801 Range / Oven - Compatible Kenmore / Sears 316538901 Light Bulb
FALSE,"Diabetic Bamboo Quarter Sock, White/Grey Medium - 1 Pkg"
FALSE,Glasshouse Nourishing Body Bar For Women
FALSE,"Kettle Brand Potato Chips, Korean Barbeque, 2 Oz, 6 Ct"
FALSE,"Ishow Hair 7A Brazilian Water Wave Virgin Hair 3 Bundles with Baby Hair with Closure Brazilian Virgin Hair, 20""20""20""with 18"""
FALSE,Sunmark Pain Reliever Extra Strength Gelcaps - 100 Gelcaps
FALSE,Panda Superstore PS-BEA11057981-SUE01437 4.13 x 2.56 in. Womens Plastic Beautiful Hair Clips&#44; Purple
FALSE,Winter Warm Padded Thickening Vest Coat Dog Costumes Pet Clothes
FALSE,"guzzie plus guss tiblit high-chair with mircofibre, orange"
FALSE,Ecotrition Vita-Sol for Birds 4 oz - Pack of 10
FALSE,KILTER Eyeglasses K5003 210 Brown 49MM
FALSE,"Matrix Color Insider Oil-Cream Developer 33.8oz, PACK OF 2"
FALSE,Face Paint - Silver and Black
FALSE,"Handcrafted Ercolano Music Box Featuring ""Luncheon of the Boating Party"" by Renoir, Pierre Auguste - New YorkNew York"
FALSE,Deet Free Insect Repelling Band Family Pack - 4 Pack(s) by Bug Band (pack of 6)
FALSE,Ames Walker AW Style 16 Sheer Support 15-20mmHg Moderate Compression Knee Closed Toe Knee High Stockings - Relieves pain of tired aching legs-Helps prevent varicose veins
FALSE,"Chuan Bei Mu, Tendrilleaf Fritillary (Fritillaria Cirrhosa) Glycerite, Dried Bulb Powder Alcohol-Free Liquid Extract, Yellow Himalayan Fritillary, Glycerite Herbal Supplement 15x4 oz"
FALSE,Pull-Ups Girls' Learning Designs Training Pants (Choose Pant Size and Count)
FALSE,Graham Fields Paramount XD Part No.5PX106300111
FALSE,Rosalind Wheeler Wall Mounted Bulletin Board
FALSE,Ebe Women Reading Glasses Reader Cheaters Anti Reflective Lenses TR90 ry2209
FALSE,BeYu - Dip Eye Liner - Grey
FALSE,"Proraso Shave Soap, Sensitive 150 ml + Proraso Shave Soap, Sandalwood 150 ml + Double Edge Razor + Proraso Styptic Gel 10ml + Old Spice Deadlock Spiking Glue, Travel Size, .84 Oz"
FALSE,"(8 Pack) Langers Juice Cocktail, Kiwi Strawberry, 64 Fl Oz, 1 Count"
FALSE,"Ortho Flower, Fruit & Vegetable Insect Killer Ready-To-Use, 32 oz"
FALSE,DYMO CORP 1801611 RHINO 4200 PRINTER 1801611
FALSE,"Stain Cleaner&nbsp;, MPN: LF09919U By Nasco"
FALSE,"KONG EZ Soft Collar, Small"
FALSE,Women's Queen By Queen Latifah
FALSE,"ID Badge Size Thermal Laminating Pouches, 5 mil, 4 1/4 x 2 1/5, 10/Pack, Sold as 1 Package, 10 Each per Package"
FALSE,Heepo 6 Pcs Smooth Makeup Pen Eye Liner Eyeliner Pencil Women Cosmetic Accessories
FALSE,Bulk Buys PB997-72 Trick or Treat Round Party Plate Set - 72 Piece
FALSE,"Williams Express Fully Cooked Sausage, Egg & Cheese Croissants, 16 Oz., 4 Count"
FALSE,Decoteak LiftAide Symmetry Shower Seat
FALSE,Eyeglasses Marc Jacobs 250 0807 Black
FALSE,Pet Cat Puppy Hoodie Single Breasted Sleeved Apparel Coat Clothes Gray Size XL
FALSE,A6 Invitation Envelopes w/Peel & Press (4 3/4 x 6 1/2) - Baby Blue (1000 Qty.)
FALSE,Intermec EasyCoder PX6i Direct Thermal Transfer Monochrome Label Printer
FALSE,Kevin Murphy Night Rider Matte Texture Paste Firm Hold 100 g/ 3.4 oz.
FALSE,"KINDEEP Ceramic E17 LED Bulb for Microwave Oven Appliance, 40W Halogen Bulb E..."
FALSE,Country Brook Petz Bunnies and Chicks Ribbon on Lavender Half Check Dog Collar Limited Edition
FALSE,Tory Burch Absolu Roller Ball 0.2 oz / 6 ml Eau De Parfum
FALSE,Sensationnel Instant Weave Hand-Tied U-Part Wig OXFORD (F4/30)
FALSE,Jessica GELeration Soak-Off Gel Polish 0.5oz/ 15ml (GEL-558 I DO!)
FALSE,8 1/2 x 14 Cardstock - Crystal Metallic (500 Qty.)
FALSE,"Green Direct Plastic Containers for Lunch/Large Food Container with Lid, Leak Proof, Microwavable, Freezer & Dishwasher Safe (36, 8 oz)"
FALSE,Women's Breeze Walker
FALSE,"Burrata with Truffles, 4 x 16 oz"
FALSE,87357-1-2 Anti-Pest-O 32oz Ready To Use Insect Repellent
FALSE,"Dimmable 8W MR16 LED, 45W Equal, CRI 80, 40 Deg. Beam Angle, Civilight DMR16 WP08P8 23561"
FALSE,"2 Pk Icaps Lutein and Omega-3 Eye Vitamin and Mineral Supplement, 30 Softgels Ea"
FALSE,Tangle Pets Hair Brush - As Seen On Shark Tank (Tangle Kitty)
FALSE,"L'Oreal Paris Nutri Gold Extraordinary Facial Oil for Dry Skin, 1 Oz (30ml) + Schick Slim Twin ST for Dry Skin"
FALSE,Eros F01-TB217 Hologram & Printed Word Strip - 15 per Pack - Case of 48
FALSE,"Raspberry Chamomile Tea (Loose) (8 oz, ZIN: 530881)"
FALSE,Griot's Garage Wholesale 15939 Surface Cleaner - 35 Oz.
FALSE,"DDI 2184791 54"" X 108"" Rectangular Heavyweight Plastic Tablecloth - Purple Case of 72"
FALSE,LE JASMIN by Miller Harris
FALSE,"2019 Recycled Poster Style Reversible/Erasable Yearly Wall Calendar, size 24 x 37"
FALSE,"Regency 5-Piece 36"" Square Table with Black Post Legs with 4 Stackable Chairs"
FALSE,Seroyal USA - Muco coccinum 10t
FALSE,LIEBERS MARSHMALLOW CHOC CVRD
FALSE,Model Model Synthetic Fullcap Band - Carmen (1B)
FALSE,Baby Cie Suction Bowl - Princess - Pink
FALSE,Trademark Fine Art Fiona Stokes-Gilbert 'Ground Coffee' Canvas Art
FALSE,Green Dog Bikini Size 4
FALSE,MINNESOTA TWINS CLASSIC 3-SUBJECT NOTEBOOK
FALSE,"Attends Medium-Weight Dry Wipes, 50 count, (Pack of 20)"
FALSE,Unicorn Yellow Stripes #2 Baby Bib & Burp Cloth
FALSE,Heepo Fashion Lovely Dog Style Pet ID Tag Collar Necklace Metal Pendant Accessories
FALSE,"LA Girl Color Pop Polish, Frisky, 0.47 Oz"
FALSE,"1500 Thread Count Hospitality Fitted Sheet 1-Piece Fitted Sheet, Queen Size, Burgundy"
FALSE,"Gold Medal Popcorn Boxes, 5.5 oz. (200 ct.) - (Popcorn Packaging)"
FALSE,"Shell Assortment Chocolate Candy Mold with Exclusive Cybrtrayd Copyrighted Molding Instructions, Pack of 3"
FALSE,(2 Pack) Summer Infant ComfortMe Neck Support
FALSE,Tuscom Creative Crystal Metal Pen Rotary Ballpoint Pen Pen Pen Hotel Gift Pen
FALSE,"Ballreich's Classic Potato Sticks, 5 Oz."
FALSE,Verbatim 98566 - LED PAR20 P20-L490-C27-B40-W PAR20 Flood LED Light Bulb
FALSE,Cottcuboaba Unisex Bear bathing Softe baby bath towel
FALSE,UBesGoo Large Dog Pet Crate Kennel Warm Bed Beds Mat Blanke For Pad House
FALSE,"Skilcraft Cubicle Magnetic Dry-Erase Board, 14""x11"", Aluminum/White 6222132"
FALSE,5 Pcs Professional Nail Art Buffer File Block Manicure Set Rectangular Nail Files Brush Nail Art Supplies
FALSE,5pcs Health Safety Stainless Steel Professional Tattoo Needles Flat Shader 5F
FALSE,"Buckle-Down Pet Leash - Buffalo Plaid Black Green - 4 Feet Long - 1 2"" Wide"
FALSE,"Storz Milk Chocolate Angels 1.32 oz each (3 Items per Order, Not per Case)"
FALSE,"Tampico Spice Tampico Chili Pods, 3 oz"
FALSE,Cincinnati Pet Hooded Crewneck Type - Small
FALSE,Eiko 49613 - Q500CL/MC-120V Screw Base Single Ended Halogen Light Bulb
FALSE,Sunbeam Body Shape Heating Pad
FALSE,Philips Dimmable Efficient 9.5W A19 Warm 60W Replacement LED Light Bulb (4 Pack)
FALSE,"Royal General Purpose Vinyl Gloves, Medium, 100 Ct"
FALSE,"Carrera 5032/COV Sunglasses CA5032COV-0ZT8-5218 - Green Frame, Lens Diameter 52mm, Distance"
FALSE,Patch Magic Play to Win Bumper
FALSE,Aarco Products 120D-48M-242-854 Combination Tackboard at Each End&#44; Buttercup - 4 x 8 ft.
FALSE,Choco Strawberries (Pionir) 150g
FALSE,ETEREAUTY 3pcs Ear Curette Earwax Removal Ear Pick with Metal Case
FALSE,Activated Charcoal Teeth Whitening Powder - 2 oz. by Pro Teeth Whitening (pack of 3)
FALSE,PERRY ELLIS 360 COLLECTION by Perry Ellis EDT SPRAY 3.4 OZ
FALSE,"24 Hours A Day Neighborhood Watch Sign 18""x24"". 3M Engineer Grade Prismatic Reflective. By Highway Traffic Supply"
FALSE,(6 Pack) Wholesome Goodness - Granola Bar - Apple-Cinn Omega
FALSE,Stylus Pen - The Beatles - New Toys Gifts Licensed iw3120
FALSE,Toujours Moi Set-Eau De Cologne Spray 4 Oz & Cologne Spray 1 Oz By Dan
FALSE,Clear 18 Note Acrylic Box Musical Paperweight - Light My Fire
FALSE,"Party Creations Hot/Cold Cups, 9 Oz, Pastel Blue, 8 Ct"
FALSE,Cicero Bacon Bloody Mary Mix 32 oz each (5 Items Per Order)
FALSE,"Green Mountain Gringo Roasted Chile Pepper Medium Salsa, 16 oz (Pack of 6)"
FALSE,"Kirkland Signature Sweet Mesquite Seasoning, 4-pack"
FALSE,Replacement for MAZDA 2 L4 1.5L 525CCA/COLD CLIMATE FOR YEAR 2014 BACKUP 10 PACK replacement light bulb lamp
FALSE,Perfecto-Standard Rectangular Aquarium Tank- Black 55 Gallon
FALSE,Snippets Card & Envelope 4.25x5.5 3pc Natural Parch
FALSE,Eiko 09320 - LED12WT8F/36/840K-G7D 3 Foot LED Straight T8 Tube Light Bulb for Replacing Fluorescents
FALSE,8mm X 15yd Turquoise Decor Mesh Tubes by Paper Mart
FALSE,BELLINGHAM NITRILE TOUCH EQUESTRIAN GLOVES
FALSE,STC211 30 Inch x 24 Inch 3.1 Mil Open End Transparent Static Shielding Poly Bags CASE OF 100
FALSE,"FLORATA 24"" Women Ladies Long Curly 5 clips one piece 3/4 Full Head Clip in Hair Extensions"
FALSE,"Ishow 7A Brazilian Loose Wave Frontal Closure with Bundles 13x4 Ear to Ear Lace Frontal Closure with 3 Bundles, 12""14""16"" with 10"""
FALSE,"P & G Olay Total Effects CC Cream, 0.2 oz"
FALSE,Rumiano Organic Mozzarella Cheese Bar
FALSE,Oliga Calura Permanent Shine Hair Color 2 fl.oz. (9-8) 9B
FALSE,"Burton & Burton 60"" Fresh Picks Mother's Balloon"
FALSE,"The Kids Room by Stupell Baby Penguin with Blue Balloon Framed Giclee Texturized Art, 11 x 1.5 x 14"
FALSE,MANIPULATIVE KIT FOR CC MATH A STORY OF UNITS: MODULES GRADE 2
FALSE,MIZZU TIGERS METALLIC 1-SUBJECT NOTEBOOK
FALSE,"Hound & Gatos Pet Food Grain-Free Pork Wet Cat Food, 5.5 Oz"
FALSE,Ebe Reading Glasses Mens Womens Gold Harry Potter Style Horned Rim Anti Glare Cozy zsm5500
FALSE,Kinsman Enterprises KNE 37001 27 in. Ergo Plus Reacher Basic Hip Kit
FALSE,Mineral Fusion Eye Liner & Brow Brush
FALSE,"OPI Nail Lacquer, OPI Classics Collection, 0.5 fl oz - Tutti Frutti Tonga S48"
FALSE,"Griffin Heel Gel Liners - Heel Inserts, Protect your Heels, Prevent Slipping, with Added Comfort - 1 Pair"
FALSE,Lindt Excellence Bar (Dark Chocolate Intense Mint) - Pack of 4
FALSE,2 Pack - Revlon Quick Dry Top Coat [960] 0.5 oz
FALSE,"SlipX Solutions 4.5"" Pebble Bath Treads (6 count)"
FALSE,Tennessee Titans Kolder Kaddy Can Holder - Glitter
FALSE,"Nature Valley Sweet & Salty Nut Granola Bar, Almond, 1.2 oz (48 Bars)"
FALSE,New Giorgio Armani 5043 Mens Designer Half-Rim Taupe Frame Demo Lenses 56-19-150 Eyeglasses/Eyeglass Frame
FALSE,La Source Relaxing Body Lotion 8.5oz
FALSE,ADIDAS DEEP ENERGY by Adidas DEODORANT BODY SPRAY 5 OZ (DEVELOPED WITH ATHLETES)
FALSE,Stingray 10 Impeller Assembly
FALSE,"Popchips Original Barbeque Potato Chips, 4.8 oz (Pack of 12)"
FALSE,Virginia Magnetic List Pad Va Cavaliers
FALSE,PB3655R Red 10 Inch x 12 Inch 2 Mil Reclosable Poly Colored Plastic Reusable Bags CASE OF 1000
FALSE,"Poland Spring Natural Spring Water, 1 L, 6 Count"
FALSE,"Rough Rider RR1239 Fingernail Clippers 2 3/8"" Closed All Brushed Stainless Const"
FALSE,Buckle Down Buckle-Down Pet Dog or Cat Leash
FALSE,Good Sense Miconozole 3 Combo with Disposable Applicators Tube&#44; 0.32 oz- Case of 12
FALSE,"Leonard Mountain Motor Home Survival Kit Gourmet Soup Mixes, 6 oz, 5 count"
FALSE,Holiday Time 8 Ct Craft Hoho Tags
FALSE,"Gen7Pets Cool-Air Cot Pet Bed, Large, Trailblazer Blue"
FALSE,"MONO Removable Adhesive Applicator, 1/3"" x 472"", Roller, Sold as 1 Each"
FALSE,JAM Paper A6 Foil Lined Envelopes - 4 3/4 x 6 1/2 - Black Linen with Gold Foil Lining - 25/pack
FALSE,"Marketside Baby Carrots & Ranch Dip, 3.15 oz"
FALSE,Cherry Blossom Glycerin Soap
FALSE,Fresh Pico De Gallo Mild 12 Oz
FALSE,VERA WANG Eyeglasses EILONWY Lilac 52MM
FALSE,Victoria's Secret Eye Shadow Quad Jeweled .25 Oz
FALSE,Avery Comfort Touch Color Spine Slant-D VW Binders
FALSE,"Fusion Double-Sided Cardstock 12""X12""-Yellow Damask"
FALSE,6 Pack Nostrilla Nasal Decongestant 12 Hour Fast Relief 15 ml for Stuffy Noses
FALSE,Ebe Glasses Men Women Rx Reading Rectangular Full Frame Professional TR-90 ckbj0178w
FALSE,"Earth Friendly Lavender Opti-Strength Concentrated Laundry Detergent, 25 Oz (Pack of 6)"
FALSE,"Okra, 1 Lb."
FALSE,MONTBLANC MB 0638 Eyeglasses 005 Black/Other
FALSE,CLARINS DOUBLE SERUM & EXTRA FIRMING COLLECTION SET
FALSE,Pro Tan Man Up Magnum Dark Tan Accelerator 9 oz.
FALSE,Rayne Mirrors American Made Rayne Stitched Black Leather Blackboard/Chalkboard
FALSE,(3 Pack) CHINA GLAZE Nail Lacquer - Anchors Away - Sea Spray (DC)
FALSE,"Welch Allyn Blood Pressure Cuff, Adult Long, Soft~Female Locking"
FALSE,Ponzu Seasoning Sauce 12 fl oz
FALSE,San Jose Sharks 2018 Calendar
FALSE,"(3 Pack) Plastic PAW Patrol Goodie Bags, 9 x 7 in, 8ct"
FALSE,product not found
FALSE,"4 Pack - Stopain Extra Strength Pain Relieving Spray, 4oz Each"
FALSE,"Body Essence Nourishing Body Cleansing Oil, 18 fl oz"
FALSE,"Schiff Buffered Vitamin C Dietary Supplement Tablets, 500 mg, 100 count"
FALSE,"Bigelow Tea Decaf Chai Spiced, 20 CT (Pack of 6)"
FALSE,Kolder ALABAMA ALT Kolder Kaddy
FALSE,Unique Bargains Pet Dog Puppy Rose Lace Decor Princess Wedding Dress Skirt Gold Tone Size M
FALSE,"3dRose German uboat submarine in shallow waters with shark, Greeting Card, 6 x 6 inches, single"
FALSE,Yellow Dog Design MDB100C Madras Blue Standard Collar - Cat
FALSE,Primizie Thick Cut Hatch Chile Crispbreads (18 oz.)
FALSE,Sriracha Cashews 7 oz each (1 Item Per Order)
FALSE,"Funky Jesters 36-40 Inch Hawaiian Assorted Leis, 55 Count"
FALSE,Abba Volumizing Gel 6.8 oz 6 pack
FALSE,Sesame Street Vintage 'Happy Birthday' Lunch Napkins (16ct)
FALSE,Emporio Armani 3071
FALSE,"Shipped Free Ivory 100 Boxed A7 (5-1/4 x 7-1/4) Contour Euro Flap 70lb Envelopes Perfect for 5 x 7 Invitations, Announcements, Weddings by The Envelope Gallery"
FALSE,"L'Oreal Paris Colour Riche Lip Gloss, Soft Wine"
FALSE,"Munchkin See, Shave and Squirt Mirror Set Bath Toy - NEW"
FALSE,JAM Paper - Papercloops Assortment Pack - 7 Color Packs of Round Circular Paperclips - 50 clips per pack
FALSE,Adapter Peep-keep Dual Axis Swivel Angled 15mm Termination Non Sterile
FALSE,"Kate and Laurel Benbrook 24 inch 2-Pack Wood and Metal Floating Wall Shelves, Gray and Rose Gold"
FALSE,Enchanted Shimmer White Ruffles Rose Pink Birthstone Girls Headband New Born-Child
FALSE,Ebe Men Silver Rectangle Half Rim Spring Hinge Reading Glasses a963
FALSE,"Cousin Willie's Simply Better Sweet And Salty Mauve Popcorn, 1 Oz (Pack Of 40)"
FALSE,Monarch M-initial keychain h-(Pk/2)
FALSE,Ebe Reading Glasses Womens Mens Tortoise Regular Hinge Acetate Retro Anti Glare 268116
FALSE,Cranberries with Green Tea
FALSE,OXO Tot Transitions Soft Spout Cup With Removable Handles - 6 Ounce - Pink
FALSE,American Crew Daily Conditioner 8.4 oz - Pack of 2
FALSE,"Makeup Brushes Premium Makeup Brush Set , 7PCS Fishtail Brush Bottom Powder Blush Brush Makeup Cosmetics Brush Makeup Brush Mermaid by Viugreum"
FALSE,Mosunx Knit Dog Hoodie Sweater Pet Cat Puppy Coat Small Pet Dog Warm Costume Apparel
FALSE,SENI S-RE10-BQ1 Super Quatro Briefs-Regular-40/Case
FALSE,"ConvaTec - Little Ones - Two-Piece 1/5 to 1-1/14"" Cut-to-Fit Full Hydrocolloid Skin Barrier, Flexible Fabric Collar"
FALSE,Milani Even Touch Powder Foundation 0.42oz.
FALSE,Student Plastic Floral Pattern 0.5mm Needle Tip Gel Pen Assorted Color 6 Pcs
FALSE,LYON'S LEGACY EMPIRE by Simon James London EDT SPRAY 1 OZ
FALSE,Wonka Pixy Stixs Candy Powder Red 6 Inch 50 Count
FALSE,"Spiral Birthday Candles, 36 Count"
FALSE,Echo Park Getaway Paper 12x12 Lt Blue/Green
FALSE,Reusable Lint Roller with Handle&#44; Blue & White
FALSE,Eye Buy Express Prescription Glasses Mens Womens Burgundy Crystal Clear Yellow Rounded Rectangular Reading Glasses Anti Glare grade
FALSE,The Party Continues 50th Birthday Confetti - Party Supplies
FALSE,The Good Bean Chickpeas Thai Coconut Lemongrass 6 oz
FALSE,Nest Fragrances Limited Edition Laundry Detergent - Linen 32 fl oz
FALSE,Spry Peppermint Gum 55 ct Jar
FALSE,2019 Minecraft (Bilingual FRE) Wall Calendar
FALSE,BirdDog CC-50-RB4 13.12 ft. Brilliant Custom Cut 120V SMD-5050 LED Strip Plant Grow Light
FALSE,NARS Night Series Eyeliner
FALSE,Mini Chocolate Candy Chip Cookies - 1.5 Lb (24 Oz) Tub
FALSE,Replacement for ERGOTRON SV42-56E1-1
FALSE,Forever Gifts FG1345A 17. 4 inch Resin Rabbit Bird Bath
FALSE,Bayer Chewable Low Dose Aspirin Cherry 81 Mg 36-Count (Pack of 10)
FALSE,HyLite 77031 - HL-G24F-9W-27K LED Pin Base CFL Replacements
FALSE,Chergui Eau De Parfum Spray-50ml/1.69oz
FALSE,"CHOCOLATE CORDIAL CHERRIES QUEEN ANNE 5CT/3.3OZ BOX IN PDQ, Case Pack of 12"
FALSE,Frosted Clear Glass Straight Sided Jar with Gold Metal Airtight Lid - 4 oz / 120 ml (6 pack) + Spatulas and Labels
FALSE,Eye Buy Express Kids Childrens Reading Glasses Violet Rectangular Full Frame Style Anti Glare grade d5343
FALSE,"Nail DIP Powder, Classic Color Collection, Dipping Acrylic For Any Kit or System by DipWell (CL - 58)"
FALSE,Pure Encapsulations - Probiotic-5 - 60 Vegetarian Capsules
FALSE,Open End Arm Sling
FALSE,"16 inches 40 inches ""MERRY CHRISTMAS"" Letter Foil Inflated Balloon Float Helium Aluminum Balloons for Christmas Decoration"
FALSE,Swisspers 30ct Round Take A Long
FALSE,Eros ATT882930 Knit Headbands with Rhinestone Embellishment - Case of 120
FALSE,Double Wear Stay In Place Makeup SPF 10 - No. 93 Cashew (3W2) 1oz
FALSE,Offset Plaid Christmas Rolled Gift Wrap - 72 sq. ft.
FALSE,"Supreme-Detox-Tea Weight Loss Caffeine Free Probiotic Tea, 28 Count"
FALSE,"Toiletry Travel Cosmetic Makeup Case Wash Organizer Storage Pouch, Blue Flower"
FALSE,Stuffed Eggplant (turkili) 400g
FALSE,LuxStar T5 2' x 2 Bulb Fixture w/ Bloom Bulbs
FALSE,"Wicked Colors grey, 2 oz. (pack of 3)"
FALSE,Pet Dog Warm Clothes Puppy Jumpsuit Hoodie Coat Doggy Apparel
FALSE,"Ultimate Textile Spandex Stretch Fitted Table Cover - Fits 24 x 48-Inch Rectangular Tables, 36""H"
FALSE,Areo Home Wall Bubble Terrarium
FALSE,Thumbprintz On My Own Large Rectangle Pet Bed
FALSE,Ebe Reading Glasses Mens Womens Blue Silver Temples Anti Glare remarkable grade ckb8147
FALSE,"3-Pack Black Peel-Off Mask for Deep Cleansing, Purifying Skin, Removing Blackheads, Blemishes ( 3 Bonus Hair Removing Pen)"
FALSE,"Splat Hair Color Complete Kit, Midnight Amethyst 1.0 application(pack of 2)"
FALSE,Buckle-Down Flying Owls with Leaves Black Multi Color Martingale Dog Collar
FALSE,DUBL-TOUGH DRC MULTIPURP WPR 1/4FLD WHI 20/CS
FALSE,"Drive Medical Supp Trunk Walker Blk Sm, Each - Model CE 1080 S"
FALSE,"Howe Gummi Bears, 15 Oz."
FALSE,Hand Soap Pump-Grapefruit-12 oz
FALSE,McKesson Side Chair Clamshell Fixed Armrests Poly-Foam Upholstery - 1 Count
FALSE,Orange Crepe Streamer Case Pack 36
FALSE,Men's Fashion Compression Socks 1 Pair
FALSE,"ITA-MED Elastic Duo-Adjustable Back Support Belt (9"" Wide)"
FALSE,Frontier - Frontier Cut & Sifted Oregano 0.38 oz 19528 4 PACK SD
FALSE,E-MANIS Gold Paper Round Lanterns for Birthday Wedding Party Decorations Crafts 1-Pack of 6 Gold
FALSE,"Now Foods Grapefruit Oil, 1-Ounce Pack of 3"
FALSE,10m Universal Car Door Edge Guards Trim Molding Protection Strip Scratch Protector
FALSE,"3dRose candy bears colorful , Greeting Card, 6 x 6 inches, single"
FALSE,"Ishow Malaysian Virgin Hair Straight 3Bundles Malaysian Human Hair, 20""20""20"""
FALSE,"Sweet Secret Sugar Cookies-SHERAS17220 Print 13""x13"" by Shelly Rasche in a Affordable White Medium"
FALSE,"Feit Electric R30 Reflector 65W Replacement Bulb, Uses 15W - 4-Pack"
FALSE,"Caramel Apple W/sprinkles, 1 ct"
FALSE,KENSIE Eyeglasses CHARM Teal 47MM
FALSE,"Slippery Stuff Water-based Jelly, 8-oz"
FALSE,Woven Figure Eight Dog Rope Toy
FALSE,3 Pack - Adidas Get Ready Eau De Toilette Spray for Men 3.4 oz
FALSE,"Now Foods PROGESTERONE CREAM W/LAVENDER 3 OZ, Pack of 2"
FALSE,Country Brook Design Economy Nylon Dog Collars(Various sizes & colors available)
FALSE,"LWC Brands Bronco Bobs Smoked Bacon Chipotle Sauce, 15.25 oz"
FALSE,Fizzy Bath Bomb Trio by Hugo Naturals (pack of 2)
FALSE,Rx Systems Anti-Aging Skin Care System Normal to Oily
FALSE,Crew Diabetic Socks 12 Pieces Pack
FALSE,"Truly Indian, Sauce Butter Chicken, 13 Oz (Pack Of 6)"
FALSE,Aura Elite Compact Spray Tanning Machine with Focus Airbrush Tan Solution 3 Pack
FALSE,"Head & Shoulders 2-in-1 Instant Relief Shampoo + Conditioner 22.5 fl. oz., 2 pk"
FALSE,"S-noilite 16-24Inches Remy Tape in Hair Extensions Straight Human Hair 20pcs/pack Medium brown-24"",50g"
FALSE,"Puma Jam Eau de Toilette Spray for Men, 3 Ounce"
FALSE,Sosoft 20 - 30 Knee High Brocade Closed Toe Compression Stocking Black&#44; XL
FALSE,Instant Gift Photo Keychain
FALSE,Boss (hub) Boss 0551 Eyeglasses 0INX 58 Black Ruthenium
FALSE,Eiko 02760 - ESH Projector Light Bulb
FALSE,"Red Plastic Party Tablecloth, 108 x 54in, 2ct"
FALSE,"Revlon Colorstay Eyeliner, Charcoal (Pack of 2) + Beyond BodiHeat Patch, 1 Ct"
FALSE,Mixteando La Cubana Mixer 6.8oz
FALSE,Wood Tones Pencil Cup&#44; Black&#44; 2 3/4 x 2 3/4 x 4
FALSE,Eye Buy Express Kids Childrens Reading Glasses Pink Oval Round Rectangular Anti Glare grade sk9019
FALSE,Sorbus Acrylic Cosmetics Makeup and Jewelry Storage Case X-Large Display Sets -Interlocking Scoop Drawers to Create Your Own Specially Designed Makeup Counter -Stackable and Interchangeable (Pink)
FALSE,Gillette Mach 3 - 40 Count ( 10 x 4 Packs)
FALSE,Resers Sea Salt & Black Pepper R
FALSE,"110% Play Harder Alchemy Arm Sleeve (Single) Small Right (Bicep 8""-11.5"")"
FALSE,"Carlisle 8""L Polycarbonate 0.50 oz. Spoon, Black 446003"
FALSE,"3dRose Funny Cute Hyena Playing Banjo Cartoon - Greeting Card, 6 by 6-inch"
FALSE,The Party Aisle Abigayle Balloons with Banner Happy 26th Birthday Coffee Mug
FALSE,Strong Knee Sleeves by Sling Shot - Black Medium
FALSE,Portable Cold Warm Therapy Hammer Facial Masseager Skin Rejuvenation Anti-Aging Spa Beauty Salon Home Use Device
FALSE,"Jelly Wellies Deluxe Raincoat, Extra Small, 11"", Pink"
FALSE,PetFoodExperts 57577903 K9 Natural Freezed Beef
FALSE,Dechra Eicosa3FF SnipCaps Under 60lbs 120ct
FALSE,"Vidal Sassoon Pro Series Ultra Vibrant Color 3VR Deep Velvet Violet Hair Color, 1 application"
FALSE,"Buckle-Down ""Lucky Black White"" Martingale Dog Collar"
FALSE,"Hudson Baby Boy and Girl Jersey Cotton Sleeping Bag 2 Pack, Feathers, 18-24 Months"
FALSE,"Purity Home 100% Combed Compact Cotton Sheet Set,3 Piece Set, Bestselling TWIN SHEETS PERCALE Weave,Garment-Washed,Cool & Breathable, Smooth & Soft, Fitted Sheet Fits Up to 16"" Deep Pocket, KHAKI"
FALSE,Ames Walker Women's AW Style 7061 Lymphedema Compression Armsleeve w/ Silcone Band - 20-30 mmHg AW7061-P
FALSE,Ebe Prescription Glasses Mens Womens Burgundy Black Rectangular Half Rim Anti Glare grade s3130
FALSE,Kits Candy Vanilla flavor 5 pounds Vanilla Kits
FALSE,Ebe Men Gold Shield Half Rim Spring Hinge Reading Glasses a970
FALSE,British Sterling Cologne .75 Fl Oz.
FALSE,Strong Leather Company 79230-7932 Del Sgl Id Bdg Wal 793 - 79230-7932 - Strong Leather Company
FALSE,"Dog Seat Cover: BlizeTec Hammock Style Pet Back Seat Protector; Nonslip & Waterproof; Universal Fit for Car, SUV and Mini Van"
FALSE,Ebe Men Black Rectangle Half Rim Spring Hinge Eyewear Reading Glasses 2036
FALSE,Buckle-Down DL-W30921 I Heart Black Bacon Dog Leash
FALSE,Buckle Down DC Comics Pet Dog or Cat Leash
FALSE,"Sweet Pumpkin Body Spray, 2 ounces"
FALSE,GENESIS Eyeglasses G5014 604 Burgundy 52MM
FALSE,"Turkey Hill Diet Decaf Lemon Tea, Half Gallon"
FALSE,"(2 Pack) B & G Foods Ortega Seasoning Mix, 6.5 oz"
FALSE,Buckle Down Buckle-Down Pet Plastic Clip Dog Collar
FALSE,"FurHaven Pet Dog Bed | Cooling Gel Memory Foam Orthopedic Faux Fleece & Corduroy Lounge Pet Bed for Dogs & Cats, Sandstone, Jumbo"
FALSE,Replacement for PARTS-44X4051 X6 FULL-18 I/O BOOK
FALSE,MONTBLANC Eyeglasses MB0609 005 Black 52MM
FALSE,E.p.t. Digital Early Pregnancy Tests (Pack of 24)
FALSE,I'm a Princess Screen Print Shirts Red XL (16)
FALSE,Wella Color Charm Liquid # 12NG Surfside Blonde Plus Haircolor (Pack of 6)
FALSE,"Doodlebug 7311164 New! Simple Sets Hello Lovely Double-sided Cardstock 12""x12""-so Very Lovely - Case Pack Of 25"
FALSE,Cooling Shave Cream
