Available,Product Name
FALSE,"JAM Paper A6 Invitation Envelopes, 5 3/4 x 8 3/4, Presidential Blue, 50/pack"
FALSE,"Coffee Break Lunch Room Furniture FULLY ASSEMBLED ""Ready-To-Use"" 3pc Group BREAKTIME Model 2791 ? Espresso/Silver Metallic...INSTANTLY create a Lunch Break Room!!! (Includes Furniture Cabinets ONLY)"
FALSE,"Kikkoman Sriracha Mayo, 8.5 oz"
FALSE,"Skin Illustrator - Activator, 4oz"
FALSE,Birthday Party Filled Favor Box (Each)
FALSE,"Ghirardelli Chocolate Melting Wafers, 30 Ounce Bag (White Chocolate)"
FALSE,"Chicken Soup For The Soul Grain-Free Chicken & Duck Stew Wet Dog Food, 13 oz"
FALSE,Collapsible Rectangular Plastic Folding Clear Lens Reading Glasses Brown 2.5
FALSE,Berry Plastics HR404822N PEC 12-16 gal 23 x 32 ft. 6 MicronCan Liner On A Roll&#44; Black
FALSE,Dynarex - Itch Relief - 1% Strength Cream - 72/Case - 1 oz. Tube - McK
FALSE,Litetronics 49580 - L-12151 13W T4 S GX23 2700K 2-PIN Single Tube 2 Pin Base Compact Fluorescent Light Bulb
FALSE,ECRU New York Curl Essentials Kit
FALSE,Birthday Girl Rhinestone Shirt Red XS (8)
FALSE,Easy Care First Aid Kits for Outdoor Sport Outdoor Activities Camping Hiking Cycling Hunting Travelling + Survival tabs 15 days Emergency food (180 Tabs/Vanilla)
FALSE,Oberto All Natural Beef Jerky Teriyaki10.0 oz.(pack of 1)
FALSE,"MoYo Natural Labs 8 oz Travel Bottle, Empty Travel Containers with Flip Caps, BPA Free PET Plastic Squeezable Toiletry/Cosmetic Bottle (3 Pack, Clear)"
FALSE,Unique BargainsTravel Makeup Glass Cylinder Shape Liquid Perfume Spray Bottle Clear 5ml 4 PCS
FALSE,KERASTASE by Kerastase: REFLECTION CHROMA CAPTIVE MASQUE 6.8 OZ
FALSE,"El Mexicano Ground Chili, 1 oz"
FALSE,Buckle-Down Martingale Dog Collar - Mohawk Skulls - NO Star
FALSE,"rebuild athletic soak therapy -17 oz- foot bath, hot tub, &amp; spa aromatherapy salt fragrance for soaking aches &amp; pains"
FALSE,Sinister Black Eye / Lip Liner Gothic Cosplay Makeup
FALSE,Unique Bargains Plastic Antislip Handle Telescopic Back Scratcher 30cm Length 10 Pcs for Home Essential
FALSE,"Yosoo 32 Types 2018 World Cup Sticker National Flag Sticker Body Face Arm Temporary Waterproof Tattoo,Flag tattoo sticker, World cup sticker"
FALSE,Birthday Chocolate Covered Oreo Cookie Gift Box
FALSE,"Efavormart Pack of 5 Premium 17"" x 17"" Washable Polyester Napkins Great for Wedding Party Restaurant Dinner Parties"
FALSE,"Graham-Field Health FR566DGH6717 Recliner Dr Arm Ht&amp;Mas Moss Ca-133, Lumex"
FALSE,"Planet Wise Large Lite Wet Bag, To the Point"
FALSE,Buckle Down Buckle-Down Pet Seatbelt Buckle Dog Collar
FALSE,'B6665AXSG Visions Of Christmas Christmas Cards' Box Set of 12 Funny Merry Christmas Note Cards with Envelopes by NobleWorks
FALSE,6 1/4 x 6 1/4 Gatefold Invitation - Mandarin Orange (500 Qty.)
FALSE,Max Mara Eyeglasses 51 0581 Havana Black
FALSE,Victoria Klein 9076 Purple
FALSE,"Knot Antique Finish Fly Plaid Piper Brooch,3 pack"
FALSE,Blair's Ultra Death and Blair's Mega Death Hot Sauce Set
FALSE,Revlon Photo Ready Skinlights Face Illuminator - Bare Light - 1 Oz + Schick Slim Twin ST for Dry Skin
FALSE,New Way 1120 - Crewneck Your Job Could Be Worse Toilet Paper Sweatshirt 4XL Light Pink
FALSE,"Upper Crust Caribbean Coconut Panko Bread Crumbs, 10 Pound -- 1 each."
FALSE,"3 Pack - Lipstick Queen Sinner Lipstick, Candy 0.12 oz"
FALSE,"Square Fun Tropical Summer Party Plates, 7 in, 10ct"
FALSE,"Brm One Pair Of 48 Lash, Pkg - BLUE RIDGE MTN SPORT - BRM248"
FALSE,Halco 109076 - PL26T/E/50/ECO Triple Tube 4 Pin Base Compact Fluorescent Light Bulb
FALSE,1st Birthday Monster Bash - Dessert Cupcake Toppers - Little Monster First Birthday Party Clear Treat Picks - Set of 24
FALSE,"""Cure For All Double-Sided Cardstock 12""""X12""""-Hope"""
FALSE,Bulk Buys OF030-16 Compact Foldable Window Squeegee&#44; 16 Piece
FALSE,Evercoat Marine 100923 Sea-Glass 6' X 50 Yds 6 oz Fiberglass Tape
FALSE,(6 Pack) JORDANA Incolor LipShine Glaze Brush On Gloss - Pina Colada
FALSE,20 LEDs Touch Screen Folding Toilet Lighted Makeup Mirror
FALSE,"MATRIX Total Results Pro Solutionist Alternate Action Shampoo 16.9oz, PACK OF 7"
FALSE,Stephen's Gourmet Milk Chocolate Gourmet Hot Cocoa 2lb 8oz
FALSE,"Yerba Prima Organic Psyllium Whole Husks Supplement, 12 Oz, 3 Pack"
FALSE,"Laddawn Layflat Conductive Poly Bags, 12 X 16, 4 Mil, Black, 100/Case"
FALSE,"Sunbelt Bakery Family Pack Raspberry Fruit & Grain Bars, 11 oz"
FALSE,Fish Tank Ornament Plastic Decoration Plant Suction Cup 4 Pcs
FALSE,"Farmers Market Natural Bar Soap Pumpkin Spice, 5.5 Oz, 3 Pack"
FALSE,Fringe Table Skirt Purple 9 ft x 29 inches Pkg/1
FALSE,"Business Essentials 8"" x 8"" x 5"" Corrugated Mailers, 12-Pack"
FALSE,"3dRose Sarcasm noun the brains defense against the less intelligent. - Greeting Card, 6 by 6-inch"
FALSE,Gillette Fusion ProGlide Power Razor Cartridges 6.0 ea(pack of 2)
FALSE,"Protect Me Alert Series Hooded Sweatshirt and Bag Dispenser, Medium, Turquoise"
FALSE,"Laddawn Gusseted Poly Bags, 2 Mil, 10 X 6 X 24, Clear 500/Case"
FALSE,"CANDY PEPPERMINT BARK ROSE BOX 4 OZ., Case Pack of 12"
FALSE,Sakura Sumo Grip Mechanical Pencil Jumbo Eraser 0.5mm Lead GRAY Case 12ea
FALSE,"Disney Princess, Pure Sun Defense, SPF 50, For Sensitive Skin, Broad Spectrum, 6 oz (3 Pack) + Beyond BodiHeat Patch, 1 Ct"
FALSE,Ebe Reading Glasses Mens Womens Amber Red Oval Round Full Frame Anti Glare grade ckbdp9118
FALSE,6 Pack - Reliable 1 Fruit Flavored Acetaminophen USP 80mg 30 Tablets Each
FALSE,The Persistence of Critical Theory
FALSE,"SunSpire Carob Chips, Grain Sweetened, 25 Lb"
FALSE,Clearly
FALSE,MightySkins Protective Vinyl Skin Decal for YETI Tundra 110 qt Cooler Lid wrap cover sticker skins Bright Smoke
FALSE,"LEGO Ninjago Nya - Cloth Armor Skirt, The LEGO Ninjago Movie Minifigure"
FALSE,K-Mars US 75 Black Plastic Eyeglasses 54mm KMO
FALSE,"Prickley Pear Cling Stamps 1.75""X2.5""-Scribble Kitty"
FALSE,"Quartet Magnetic Dry Erase Board, Green Frame, 11 x 14 Inch"
FALSE,"Cups and Tape (7)-ERICAR114647 Print 4.75""x5.75"" by Eric Carbrey in a Flat Black Metal Frame"
FALSE,Integy RC Toy Model Hop-ups C23494BLACK Complete Billet Type II Rear Axle for AX10 and other 2.2 Custom DIY Projects
FALSE,Dark Age Cottage New
FALSE,Mens Colorado State Rams Short Sleeve Polo Shirt - XL
FALSE,Vertical Paper Holder Blue
FALSE,Unique Bargains Unique Bargains 2 Bags Flexible Rubber Hair Ties Bands Ponytail Braid Holder Elastics Black
FALSE,The Caroler's Handbook
FALSE,New International Harvester 715 Tractor Operator Manual
FALSE,"Avery Heavy-Duty Binder with One Touch EZD Rings 11 x 8 1/2 2"" Capacity Green 21009"
FALSE,Tribal Pinstripe Wall Decal - Vinyl Decal - Car Decal - 343 - 36 Inches
FALSE,"BRADY 145100 Warning Sign,B-302,10inHx14inW,Hazardous G2277838"
FALSE,Buckle-Down Seatbelt Buckle Dog Collar
FALSE,The Original Tush Cush-Navy
FALSE,"2 Pack - Ocean Blue Omega-3 2100 mg Dietary Supplement Softgels, Natural Orange 120 ea"
FALSE,StopTech 83.657.4700.51 StopTech Big Brake Kit Fits 05-07 G35
FALSE,Salve-ation Psoriasis/Eczema Therapeutic Grade Essential Oil Blend 10ml Roll-On Ready to Go! by Davina
FALSE,Keyline:B62-P GM Single-Sided VATS Key #7 - Plastic Head
FALSE,"Keizer Aluminum Wheels Direct Mount 10x8"" Polished Wheel P/N DL1083BLBC"
FALSE,(6 Pack) MILANI Stay Put Brow Color - Dark Brown
FALSE,PERIODIC TABLE OF ELEMENTS CHART
FALSE,NANETTE LEPORE (NEW) by Nanette Lepore - EAU DE PARFUM SPRAY 3.4 OZ - WOMEN
FALSE,"Ktaxon 2 Mil 48"" x 100' Lightproof Reflective Mylar Film Roll"
FALSE,"Ferrera Farms Prime Cuts Bully Stick 12\"" Prime Stick"
FALSE,"BAYSIDE CANDY JELLY BELLY JELLY BEANS 49 ASSORTED FLAVORS , 2LBS"
FALSE,"Yosoo Vintage E27 Bulbs Socket Holder / Base Copper Lamp Holder for Antique Light Bulb, Creative Wall Lamps, Vintage E27 Lamp Holder"
FALSE,ATTACK 180mm 50Degree Longboard Skateboard Trucks BLACK STAR SERIES RKP Set of 2
FALSE,Ignition Wire Set MOPAR 5093687AA fits 97-03 Dodge Dakota 3.9L-V6
FALSE,Lamp Housing For Sanyo PLC-XU30B / PLCXU30B Projector DLP LCD Bulb
FALSE,"Skin For Apple iPhone 7 Plus – Stained Glass Window | MightySkins Protective, Durable, and Unique Vinyl Decal wrap cover | Easy To Apply, Remove, and Change Styles | Made in the USA"
FALSE,Stanley Proto J1294 Black Oxide Combination Wrench (1 per Pack)
FALSE,Almay Line Smoothing Makeup SPF 15 160 Naked
FALSE,Nut Harvest Nut & Fruit Mix 6.75 oz. Bag
FALSE,HP Brochure Laser Paper Matte150 Sheet Brochure Paper
FALSE,"M-D Precision Components Adjustable Carpet Knee Kicker, 48058"
FALSE,"Green Giant Veggie Spirals Beets, 12.0 OZ"
FALSE,4Legs4Pets by Mahar Pet Cot
FALSE,3 Pack - CLEAN & CLEAR Continuous Control Acne Cleanser 5 oz
FALSE,YTX24HL-BS Motorcycle Battery for Yamaha 1100cc XV1100 Virago All 1999
FALSE,Techtronics
FALSE,Noahs Ark and the Ararat Adventures
FALSE,"Ancient Nutrition Bone Broth Protein Powder, Cinnamon Apple Flavor, 20 Servings Size"
FALSE,"BRADY 121822 Floor Marking Tape, Sq., 4In W, 8In L, PK20"
FALSE,"STANLEY-PROTO IND TOOLS 1/2"" DR. W/7/16 SCREW DRIVER"
FALSE,COMETIC GASKET KIT PREDATOR C7972
FALSE,Autel Robotics EVO Quadcopter + Extra Battery Combo
FALSE,Pro Milano Hair Straightening Brush Comb Italian Designed Hair Brush Straightener -Pink
FALSE,LAU PARTS 3Bld 20Dia 33Deg Cw Fan Blade OEM 60557101
FALSE,"HP 90W Smart Auto/Truck Adapter, ED493UT"
FALSE,"OMNIHIL Replacement 2-Port USB Charger+(WHT-30FT)MICRO-USB for Boxtron Hercules X3: Qualcomm Quick Charge 3.0, 10400mAh ultra slim power bank"
FALSE,"8GB 1X8GB Memory RAM Compatible with ASUS/ASmobile VivoBook S510U, VivoPC K20CD by CMS C106"
FALSE,CoverGirl Brow and Eye Makers Pencil - Midnight Brown (505)
FALSE,Women's Kenzo Madly Kenzo Kiss 'N Fly By Kenzo
FALSE,"4pcs Ultrasonic Animal Repeller, Solar Powered Pest Repeller, Waterproof Outdoor Repellent , Repel Squirrels, Foxes, Birds, Skunks, rod"
FALSE,GI Joe Frostbite Arctic Operations Specialist Hasbro Action Figure
FALSE,Bruynzeel Design Coloured Pencil Set 12/Pkg-
FALSE,"I Heart Crafting Double-Sided Cardstock 12""X12""-Diy Queen"
FALSE,"Bare Nature Vitamin Iced Tea - Guava Pineapple, 20 Fl. Oz. Bottles, 12 Ct"
FALSE,"Ness Enzymes, GI Relief #6 90 caps"
FALSE,Spencer Multifunction Baby Nappy Diaper Backpack Large Capacity Mummy Maternity Bag Waterproof Travel Laptop Backpack for Baby Care - Red
FALSE,"TuningPros DSV3-189-3 980mm 38.5"" 3.0mm Sunroof Moonroof Top Wind Deflector Visor For 1999-2010 Mazda B2500 B3000 B4000 Fix Windows in Dark Smoke 1 Pc Set"
FALSE,Sedal Revitalizing and Strengthening Shampoo 350ml - Sedal Revitalizacion y Fuerza Champu Con Cacao
FALSE,Bolners Fiesta Fiesta 2.5oz Tamale Masa Seasoning
FALSE,Pyranha Spray N Wipe Fly Spray
FALSE,Allied Compatible XFP TAA Transceiver&#44; 1310 nm Wave
FALSE,"LG G6 2017 Case, Maxessory Trailblazer Dual-Layer Heavy-Duty Hybrid + Built-in Belt Clip Holster w/ Rigid Rugged Kickstand Protective Armor Cover"
FALSE,"World Finer Foods Reese Olives, 4.75 oz"
FALSE,MightySkins Skin Decal Wrap Compatible with Lenovo Sticker Protective Cover 100's of Color Options
FALSE,"1/2""-20 x 2 1/2"" (PT) Fine Thread Socket Head Cap Screw Alloy Steel Black Oxide Pk 175"
FALSE,"CRL Silver Metallic 4"" Round Tube Blade - 146"" Length"
FALSE,"DreamLine SHEN-2428183630 Unidoor Plus 72"" High x 46"" Wide x 30-3/8"" Deep Hinged"
FALSE,"Redd Superfood Energy Bar, Mint Chocolate, 2.2 Oz"
FALSE,Too Faced Sparkling Glomour Gloss - Pink Bling 3.8ml/0.128oz
FALSE,Abba Pure Color Protection Shampoo 8.5 oz-Pack of 6
FALSE,Continental Elite 65153 SAE 30R9 Fuel Injection Hose
FALSE,Ebe Reading Glasses Mens Womens Tortoise Bold Rectangular Full Frame Anti Glare grade ckbdp9088
FALSE,Toshiba TLP-T61M Compatible Lamp for Toshiba Projector with 150 Days Replacement Warranty
FALSE,SE1009 Green 15 Inch Plastic Tug Tight Pull-Tight Seals Made In USA CASE OF 100
FALSE,Smart Blonde KC-8649 1. 5 x 3 inch Yuma Arizona Background Novelty Metal Key Chain
FALSE,"Unique Bargains Loose Curly Human Hair Extension 12""14""16"" 3 Bundles Remy Hair"
FALSE,Star TSP 654 - label printer - two-color (monochrome) - direct thermal
FALSE,Compact Auto Gift Set
FALSE,6 Pack - Spinbrush Super Mario Powered Kid's Toothbrush (Styles Vary) 1 Each
FALSE,University of Michigan Nylon Adjustable Dog Collar
FALSE,"Cervical Collar Medium Density Stabilizing Panel 4"" Height 10-1/2 to 22"""
FALSE,Zoan Synchrony Duo Sport Electric Snow Helmet Tourer Graphics Flou Green XXL 821-338
FALSE,Divine Wisdom and Warning : Decoded Messages from God
FALSE,CW-X Women's Insulator Endurance Pro Tights
FALSE,Sunex SU97734 Jumbo Crowfoot Wrench 0.5 in. Driver 1.06
FALSE,"[KLAIRS] x Between Mochi BB Cushion Pact SPF 40, 15g"
FALSE,Soehnle Easy Control Bathroom Scale
FALSE,2018 Megaloon Set
FALSE,"Sesame Beginnings Medium Flow Silicone Nipple, 1.0 CT"
FALSE,The Future of Sustainable Cities : Critical Reflections
FALSE,In Search of Freedom
FALSE,Seconds
FALSE,"Fintie Pencil Case Holder for Apple Pencil, Soft Silicone Drop Proof Impact Protection Carrying Case Sleeve Black"
FALSE,LUMARAI MORRO 20x10 +31 GLOSS BLK W/MIRROR LIP Wheel Rim (QTY: 1)
FALSE,Puppy Apparel Clothes Clothing Dog Sweatshirt Pullover Coat Hoodie (Gift for Pet)
FALSE,"Bobs Red Mill Spelt Flour, 24 Oz"
FALSE,"DecoArt ADC-17 Americana Chalky Finish Paint, 8-Ounce, Vintage"
FALSE,Panasonic KX-TA30850 12-BUTTON Monitor Telephone
FALSE,"AB Wheel, The Best Fitness Equipment for 6 Pack Abs & Core Workout Roller - with Innovative Non-Slip Rubber, Comfort Foam Grips"
FALSE,Weight Watchers French Vanilla Smoothie
FALSE,"Buckle-Down DL-W30350-N Narrow 0.5"" Cassette"
FALSE,Using Math Outdoors
FALSE,Lazer Brite Reflective Open-Design Dog Leash - Black Chain Link 4' Long x 1 Wide - Pack of 4
FALSE,Nine West NW1011 Eyeglasses
FALSE,"Galaxy S6 Case, Samsung Galaxy S6 Case, Njjex [Blue] Rugged Rubber Plastic Impact Defender Slim Hard Case Cover Shell For Samsung Galaxy S6 S VI G9200 GS6 All Carriers"
FALSE,Willow Creek Press 2018 What Puppies Teach Us Wall Calendar
FALSE,Philadelphia Flyers Zephyr Flame Flex Hat - White
FALSE,1999 2000 2001 2002 2003 Subaru Liberty Xenon Fog Lamps Driving Lights Foglamps BE BH Kit
FALSE,Radiology Cross Coder 2014
FALSE,"GREE WINDOW AIR CONDITIONER, WINDOW MOUNT, 6K BTU 115V R-410A, REMOTE CONTROL"
FALSE,Quilting Treasures Fabrics Color Blends Strawberry Pink
FALSE,Apple iPhone 6 Plus Wallet Case - Eat Sleep Game on Black
FALSE,HMK Superior TR Jacket Blue/Orange 2XL HM7JSUP2BLO2X
FALSE,Cambium ePMP 2000 5GHz Access Point Lite with Intelligent Filtering and Sync (FCC)
FALSE,Refurbished Rayovac 824-36PPF AAA Alkaline Batteries (36 pack)
FALSE,AGPtek Potty Dog Training Doorbells for Housebreaking Housetraining Adjustable Door Bell Length for Dog
FALSE,FOSSIL Eyeglasses 6076 0Y9z Striated Gray 54MM
FALSE,The Party Continues 60th Birthday Confetti - Party Supplies
FALSE,Auburn Leathercrafters Tuscany Leather Dog Collar
FALSE,Knot Perfumed Perfumed Body Lotion 6.7oz
FALSE,"555 Fried Sardines with Tausi (Small), 5.5 oz"
FALSE,Habitrail Playground Loft
FALSE,"Yaheetech 15.9"" Make-Up Bag Cosmetic Brush Case Storage Toiletry Organizer Artist Professional"
FALSE,I-Squeegee Phone Screen Cleaner with Keychain
FALSE,"Buckle-Down Pinocchio Poses Black White Confirm Name Disney Breakaway Plastic Clip Collar, Narrow-Large"
FALSE,LG F70 TREK Wallet Case - Celtic Cross on Nebula Brown
FALSE,Men's Silent Mime Costume
FALSE,"Day-lee Foods, Inc Crazy Cuizine Honey Sriracha Chicken"
FALSE,"NBA Cleveland Cavaliers Composition Book, 7.5"" by 9.75"", 100 Sheets, College Rule"
FALSE,MightySkins Snap-On Protective Hard Case Cover for Apple iPhone 4 Backdraft
FALSE,Charming Tails 30397 Christmas You Are So Deer to Me New 2016
FALSE,"Siren Eau-de-parfume Spray Women by Paris Hilton, 1 Ounce"
FALSE,Light-Up Dog Collar - Rechargeable Battery Powered LEDs
FALSE,"Mont Blanc - MB0545, Geometric, metal, men, PALLADIUM GREY(016 I), 55/17/145"
FALSE,RAM Mounts Garmin Nuvi 750/760/770 Cradle RAM-HOL-GA26U
FALSE,P.E. Games & Activities Kit for Grades 6-12
FALSE,2015 Ferrari 488 Spider in Metallic Blue- Limited Edition Resin Scale Model in 1:18 Scale by BBR
FALSE,3 Pack - Biotherm Homme Total Recharge Revitalizing Wake-Up Cleanser 4.22 oz
FALSE,"40-Sheet Capacity HC-240 Two-Hole Punch, 9/32"" Holes, Paper Guide, Silver"
FALSE,Mascot Hardware Handpainted Gerbera Round Knob (Set of 8)
FALSE,"Drive Medical VerteWrap LSO Back Brace, Extra Small"
FALSE,SCCONNECT 50U DEV MNT & SUP RENEWAL
FALSE,Dell Inspiron mini9-190 Replacement 8.9 LCD Screen Matte
FALSE,Heepo 1Pc Unisex Compression Leg Sleeve Sock Sports Running Football Calf Support Brace
FALSE,"SHANY Silky Shimmer Eye Shadow, Golden Flame"
FALSE,"Jolly Jack Halloween Paper Plates, 8 pack"
FALSE,Eros REGG91927 18 x 13 x 4 in. Gift Bag Christmas Jumbo 12 Assorted Prints - Pack of 72
FALSE,"10ml Fancy Swirled Perfume Roll On Bottle with Gold Cap and Black Velvet Pouch - 1/3 Oz Aromatherapy Bottle, Party Favor (Set of 3)"
FALSE,Bumble and Bumble - Mending Masque (For the Truly Damaged Hair) -150ml/5oz
FALSE,**DISCONTINUED**L'Oreal Studio Secrets Professional One Sweep Eye Shadow
FALSE,Lamp Housing For Toshiba 23402847A Projection TV Bulb DLP
FALSE,Washington Capitals Adidas NHL Men's Climalite Authentic Practice Jersey
FALSE,Pack of 16 Tree on Beach Fine Art Embossed Deluxe Christmas Greeting Cards
FALSE,"Aurora World Precious Moments Luvster Blanket Sparkle Unicorn Plush, 16"""
FALSE,"Duke Blue Devils Transfer Decal - 6.5"" x 2.75"""
FALSE,"Sony Vaio Vgn-nw235f Replacement LAPTOP LCD Screen 15.6"" WXGA HD CCFL SINGLE (Substitute Only. Not a )"
FALSE,"12BB 5.5:1 Metallic Casting Spinning Fishing Reel Wheel Tackle Accessories ,Casting Fishing Reel, Metallic Fishing Reel"
FALSE,"Wet n Wild Wild Shine Nail Color, Night Prowl, 0.43 fl oz"
FALSE,Value Candy Pink Rectangular Plastic Tablecover (1 ct)
FALSE,"Primary Collection Rectangular Activity Table, 30w x 72d x 25h, Fusion Maple"
FALSE,Pretend Play Town Toys Mozlly World Airport Friction Power Cars Vehicles and Planes (19pc Set)
FALSE,mooi lab d6184096-4.5-oz Raspberry Bath Bomb&#44; 4.5 oz
FALSE,Superior 1500 Series Brushed Microfiber Soft and Wrinkle Resistant Solid Duvet Cover Set
FALSE,"SnackWell's Minis Mini Vanilla Creme Sandwich Cookies, 6.25 oz, 5 pack"
FALSE,Gillette Venus Embrace Women's Razor Pink 1.0 ea(pack of 6)
FALSE,Bridgestone/Firestone 70/100-19M203 70/100 19 S/T Frt 119689 New
FALSE,"Owlpack Clear Poly Bags with Open End, 1.5 Mil, Perfect for Products, Merchandise, Goody Bags, Party Favors (4x4 inches)"
FALSE,Professional Nail Art Scraper Stamping Plate Double Ended Stamper Image Tool Set US
FALSE,billyboards Porcelain Menu Chalkboard
FALSE,"3"" WHALE SQUIRTS, Case of 144"
FALSE,"Cake Surprise 2 Ply Beverage Napkins, Case of 192"
FALSE,"Elizabeth Arden Ceramide Ultra Lipstick 10 Cinnamon .12 Oz. (New, No Box)"
FALSE,Yo-Zuri Snap Beans Ultralight Sinking Minnow Lure R1217
FALSE,Juki T Gauge For TL Series Machines
FALSE,32OZ MECHANICAL SCALE 6/CASE
FALSE,3D Diamond Protector Cover For Iphone 6/ 6S Plus 5.5Inch Checkered Pattern Mix
FALSE,"Personalized Silver-Tone Engraved Kids' ""Sweet"" Heart Locket"
FALSE,Product Not Found
FALSE,"Red Brown Beige Abstract Wallpaper Border Geometric Design, Roll 15' x 6.75''"
FALSE,Lawrence Police Department
FALSE,"Powder Mineral Brush,Black Gold Oversized Makeup Brush Blush Loose Powder Shadow Brush,Blush Powder Shadow Brush"
FALSE,lumex 6437s007a snap-on padded commode seat
FALSE,"S-noilite 16""/18""/20""/22""/24"" 100% Human Hair Extensions Natural Straight Clip In Hair Extentions Soft Reusable 8 pcs Black brown-18"",70g"
FALSE,"Terry's Chocolate Oranges 5.53 oz each (2 Items Per Order, not per case)"
FALSE,VOLKSWAGEN 1J0881405DMJTT GENUINE OEM SEAT COVER
FALSE,ACT 2008 Audi A3 HD/Race Sprung 6 Pad Clutch Kit
FALSE,COUTURE LA LA JUICY COUTURE by Juicy Couture EAU DE PARFUM ROLLERBALL .33 OZ MINI
FALSE,Princess Candle Set - Party Supplies
FALSE,"Arrowhead Mills Whole Grain Amaranth, 16 Oz"
FALSE,ECR4Kids 48'' Square Activity Table
FALSE,PeanutsÃ‚Â Valentine Sign Craft Kit (Pack of 12)
FALSE,Yellow Dog Design H-ALP104XL Alpine Roman H Harness - Extra Large
FALSE,Sharpie Glitter Paint Marker Water Based Extra Fine Point Light Pink
FALSE,Buckle-Down Digital Camo Martingale Dog Collar
FALSE,Aurora Instuments 003844 Gauge Panel
FALSE,LG Premier Pro Wallet Case - Eat Sleep Soccer on Black Case
FALSE,"PALASASA Small windmill and colorful happy birthday banner cake topper,Party Cake Decoration Supplies"
FALSE,JJ Cole Urban Toddler Bundleme
FALSE,"GMB H Yoke, 260-0649"
FALSE,"Hard Core Brands Lighted Dog Collar, Multiple Colors and Sizes Available"
FALSE,Philips Bare Lamp For Ask Proxima CompactC5 Projector DLP LCD Bulb
FALSE,"Cal-Hawk 1/4"" DR. Impact Universal Joint"
FALSE,Dayco 101216 90? Bent Tube Female Swivel 37? Flare (jic)
FALSE,Medjugorje : What It Means to Me
FALSE,"Simplicity 3 Pack Elastic Hair Ties White/Pink/Pink Leopard, 24 Count"
FALSE,"Groundskeeper Tuscan Receptacle, 13 X 13 X 38 3/8, Sandstone"
FALSE,"Joy! Crafts Cut & Emboss Die-Doves, 3.5""X2.25"""
FALSE,Lip Smacker Originals Lip Balm (Pack of 24)
FALSE,QMI 3'' Center Bar Pull
FALSE,112 M by Marilyn Miglin Eau De Parfum Spray 3.4 oz-100 ml-Women
FALSE,Ladies Routine West Virginia Mountaineers Long Sleeve Raglan Shirt
FALSE,3 PET KING RAWHIDE BRAIDED WHITE BONES 8 TREATS CLEANS TEETH STRENGTHENS GUMS
FALSE,Faora Secret Wishes Adult Halloween Costume
FALSE,Pull Out LED Magnifier Key Ring 45X Magnifying Glass
FALSE,Bulk Buys GB126-144 Confetti Rolls Set - 144 Piece
FALSE,Yellow Dog Design H-TK101SM Tiki Print Roman Harness - Small/Medium
FALSE,Tangerine Oil Natural Flavor by LorAnn Flavor Oils
FALSE,"Coverlet Patches Adhesive Bandage 1-1/2"" x 3"""
FALSE,"Buckle-Down Seatbelt Buckle Dog Collar - Polar Bear Repeat Baby Blue - 1"" Wide - Fits 15-26"" Neck - Large"
FALSE,How to Do Everything with Microsoft Office PowerPoint 2003
FALSE,12 FIVE NIGHTS AT FREDDY'S Birthday Invitation Cards 12 White Envelops Included
FALSE,Hollister Newport Beach by Hollister Body Spray 4.2 oz-125 ml-Men
FALSE,Mightyskins Protective Vinyl Skin Decal Cover for LG Thrill 4G Cell Phone wrap sticker skins Argentina Flag
FALSE,Elements Warm Faux Fur Stylish Jacket For Dogs Available In Rose Or Tan Almond (Large Pink Rose)
FALSE,Justice League Mens Superman Adult Dc Superhero Costume Top Shirt-Std
FALSE,Go-Parts » 1993 - 1998 Jeep Grand Cherokee Rear Tail Light Lamp Assembly / Lens / Cover - Right (Passenger) Side 55155738AA CH2801121 Replacement For Jeep Grand Cherokee
FALSE,"3 1/2""W x 32""D x 36""H Traditional Arts & Crafts Smooth Bracket, Douglas Fir"
FALSE,Freedom Performance Independence Shorty Exhaust System Chrome HD00246
FALSE,"McDonalds McCafe, T-Discs for Tassimo Hot Beverage System (56 Count) (4x6oz)"
FALSE,2 Pack - Windmill Vitamin C-500 Tablets Tangerine 60 ea
FALSE,Infocus IN34C Replacement Color Wheel
FALSE,"McCall's Pattern Misses' Tops, FF (16, 18, 20, 22)"
FALSE,TOSHIBA MINI NB200-SP2912A Laptop Screen 10.1 LED BOTTOM LEFT WSVGA 1024x600
FALSE,Quantum 340LPH Intank Fuel Pump Honda Odyssey 1995-2001
FALSE,"Tractor At Little Eaton-BILMAK47698 Print 16.25""x30"" by Bill Makinson in a Cafe Mocha"
FALSE,"Eclectic Collections Mona Lisa Eau de Parfum Spray for Women, 100 ml, 3.4 Ounce"
FALSE,Glominex Blacklight UV Reactive Paint Pint - Pink
FALSE,ECR4Kids 48in Cog Premium Thermo-Fused Adjustable Activity Table Grey/Blue/Blue - Standard Ball
FALSE,SPI Throttle Cable for Snowmobile POLARIS IQ WIDETRAK/EURO 2011-2014-SINGLE
FALSE,"SUNEX INTERNATIONAL INC SKT 3/8 ""DR 5/8"" 6PT DP IMP"
FALSE,"SKIN DECAL FOR OtterBox Commuter Samsung Galaxy S7 Edge Case - Peace on Nebula Multicolor DECAL, NOT A CASE"
FALSE,Genuine Volkswagen OEM 1J3 881 633 B B41 RELEASE LEVER
FALSE,Wiseco Wiseco - B1013 - Top End Bearing B1013
FALSE,"Rottie Pup Framed Print 39.25""x31"" by Dean Russo- Exclusive"
FALSE,Rufus & Coco RCSFG4US Sensitive & Fabulous Grooming Pack
FALSE,"CLYMER M324 Honda , Haynes Manual"
FALSE,"Jenny Lee Gourmet Apple Cinnamon Swirl Bread (1.3 lbs., 3 pk.)"
FALSE,Lifetime Range Rod
FALSE,LEPA BOL.Quiet LPBOL12R 120 mm Cooling Fan
FALSE,"Bic Wite-Out Quick Dry Correction Fluid, 20ml Bottle, White, Pack of 12"
FALSE,"Christmas ""Twilight Ornament"" Theme Square Ceramic Trivet Hot Plate"
FALSE,32 Square DIL14GWG 0.25 in. Oversized 3D Dinosaur Puzzle - Dilophosaurus&#44; Green&#44; White & Green - 44 Piece
FALSE,Motorcycle voltage regulator rectifier
FALSE,"Red Gift Wrap Bag by K-Kraft (Festive Red Stripes, 13 x 17.5 inches)"
FALSE,"(6 Pack) LA COLOR Jellie, Shimmer &amp; Sparkle Lip Gloss - Fabulous"
FALSE,Conserving Culture : A NEW DISCOURSE ON HERITAGE
FALSE,New Cadillac Golden Emblem Front Grille Clip Badge Fit Cadillac CTS LATE 2015
FALSE,"Hudson Baby Boy and Girl Fitted Crib Sheet, 2-Pack - Forest"
FALSE,"Medaglia D'Oro Instant Espresso Coffee, Original, 2 Oz, 1 Ct"
FALSE,Mediven Sheer and Soft 15-20 mmHg Thigh w/ Lace Silicone Top Band CT Wheat II - Ankle 8-8.75 inches
FALSE,MightySkins Skin Decal Wrap Compatible with Razer Sticker Protective Cover 100's of Color Options
FALSE,Zhena's Gypsy Tea Chamomile Loose Leaf Tea 1.0 oz each (3 Items Per Order)
FALSE,"Kaytee Birders Blend, 35-Pound"
FALSE,"RISE OF METHODISM: A STUDY OF BEDFORDSHIRE, 1736-1851"
FALSE,"Buckle-Down ""Steaks with MEAT Text"" Martingale Dog Collar"
FALSE,DC Justice League Snap & Wear-It Hero Set Assortment
FALSE,"Diamond Gloves Advance Powder-Free Soft Nitrile Industrial Gloves, Blue, Medium, 100 Count"
FALSE,The Heartbreak Messenger
FALSE,Acrylic Wall Rack Organizer Holds up to 60-70 Bottles Nail Polish nail polish holder nail polish storage
FALSE,"IPL Intense Pulse Light Hair Removal Machine Permanent Lady Epilator 100-240V, Lady Epilator, Permanent Hair Removal"
FALSE,Halloween 24pcpumpkin Lites A By Fun World
FALSE,Drag Specialties 0711-0195 Fuel/Oil Line
FALSE,"L'Oreal Paris Feria Multi-Faceted Shimmering Color, 100 Very Light Natural Blonde"
FALSE,Sony - UTXB03/30 - Sony UTXB03/30 UWP-D Series Bodypack Transmitter w/Omni Lavalier Mic
