Available,Product Name
FALSE,"Bittova Classic: Janacek, Stedron, Bittova, Etc"
FALSE,"Assorted Short Sleeve Onesies Bodysuits, 5pk (Baby Girl)"
FALSE,Beauty Travel Case Pretend Play Toy Fashion Beauty Play Set w/ Assorted Hair & Beauty Accessories
FALSE,Holy Angel Pendant Simulated Diamonds 14k Yellow Gold Finish Lab Created Cubic Zirconias Iced Out Solid Back
FALSE,Factory Effex 19-30530 Front Fender Graphics Kit - Style 16
FALSE,"Jigsaw Puzzle 500 Pieces 24""X18""Strawberry Tea"
FALSE,Saga of the Sioux : An Adaptation from Dee Brown's Bury My Heart at Wounded Knee
FALSE,New Flower Heart Metal Cutting Dies Stencils DIY Scrapbooking Album Paper Card
FALSE,Wind in the Reeds
FALSE,Male Power Mens Pocket Pool Pocket Jockstrap
FALSE,For Samsung Galaxy Tab E 9.6 Clear LCD Screen Protector Film Cover
FALSE,"South Bend Red/White Push Button Float (Assortment, 10 Pack)"
FALSE,CUSTOM TAILORED DASHBOARD COVERS VELOUR GRAY FOR CHEVROLET 1
FALSE,"Maevn PURE Women's 3 Panel V-Nect Top & Modern Yoga Pants Scrub Set [XXS - 3XL, FREE SHIPPING]"
FALSE,Sculpey Polymer Clay Just Orange
FALSE,Introduction to Policing 3rd Ed. + Law Enforcement Interpersonal Communication and Conflict Management
FALSE,"Refurbished Lenovo M82 SFF Desktop PC with Intel Core i5-3470 Processor, 4GB Memory, 500GB Hard Drive and Windows 10 Home (Monitor Not Included)"
FALSE,Girls Cutie Captain Child Halloween Costume Pirate Outfit Small (4-6)
FALSE,Iguana Med Med Flex II Unisex Stealth Cargo Pant Scrub Bottoms
FALSE,Reebok Men's Mesh Banded Shorts 2-Pack
FALSE,"Loadstone Studio 24 Inch Acrylic White & Black Reflective Display Table Background Boards, Product Table Top Photography Shooting, WMLS1486"
FALSE,Me Pregunto Por Que los Peces Tuvieron Patas : Y Otras Preguntas Sobre Prehistoria
FALSE,INSTEN 6-foot Type A to Mini 5-pin Type B USB Cable/ 4-Port USB Hub
FALSE,3834F Mad Ultimate Billfold - Purple
FALSE,MightySkins Snap-On Protective Hard Case Cover for Samsung Note 3 Neon Splatter
FALSE,"Olive Martini II-COLBAK141301 Print 30""x24"" by Color Bakery in a Affordable Red Mahogany Medium"
FALSE,Ultimate Telescopic Aluminum Volleyball Standard & Pad-Color:Royal
FALSE,Boyesen Waterpump and Impeller Kit White WPK-07W
FALSE,Baseball and Mitt - Wallet Flip Style Phone Case Compatible with the Apple iPhone X / Apple iPhone 10 Universal
FALSE,KMC REVERT 22x9.5 6x120.00 CHROME (15 mm) RIM
FALSE,"Tiryns : Der Prahistorische Palast der Konige Von Tiryns, Ergebnisse der Neuesten Ausgrabungen"
FALSE,"WD5000AAKS-08V0A0, DCM HGNNHTJAAN, Western Digital 500GB SATA 3.5 Hard Drive"
FALSE,"BL CCYR 2 1/2S Yoke Roller, Sealed, Crowned, 2 1/2"" Roller Diameter"
FALSE,Gorilla With Expensive Camera Tee Men's -Image by Shutterstock
FALSE,Go Sit On A Cactus Fun Font Tee Women's -Image by Shutterstock
FALSE,Sm. Purple Fire Dragon - Collectible Figurine Statue Figure Sculpture
FALSE,HMF Performance Full System Black w/TD-Blk Cap Exhaust Can Am Outlander L 15-16
FALSE,Zebra Vertical Black Design on Apple iPhone 5SE/5s/5 New Guardian Case by Coveroo
FALSE,Women's Rialto Adora Ballet Flat
FALSE,"CafePress - Fluent In Song Lyrics, Movie Quotes, Sarcasm T-Shi - Light T-Shirt - CP"
FALSE,Phil-Tone Theo Wanne Isotope Alto Saxophone Mouthpiece 8
FALSE,EVS KBBB1R-XXL Celtek Kidney Belt
FALSE,"Still Life With Matisse 2-JOHNOL125608 Print 6.5""x6.5"" by John Nolan in a Affordable Black Large"
FALSE,"Acer Travelmate 8371-354g32n Replacement LAPTOP LCD Screen 13.3"" WXGA HD LED DIODE (Substitute Replacement LCD Screen Only. Not a Laptop )"
FALSE,Port Company PC61 Traditional Menâ€s T-Shirt - Athletic Maroon - Large
FALSE,Rawlings NCAA Polycarbonate Hoop Set University Of North Carolina Tar Heels
FALSE,D'Artefax Leopard Spot Circle Novelty Knob
FALSE,"17-4 Stainless Steel Square Bar, Size: 2.750 (2-3/4 inch), Length: 5 inches"
FALSE,Awesome Live Love Crew Rowing Large Graphic Women's Cotton T-Shirt
FALSE,Mens NCAA UCLA Bruins Pull-over Hoodie (Black)
FALSE,"Fintie Samsung Galaxy Tab A 9.7 Tablet Case - Ultra Slim SmartShell Cover with Auto Sleep/Wake, Flower Burst"
FALSE,"Z420 Workstation, 1x Xeon E5-1650 3.2GHz Six Core Processor, 64GB DDR3 Memory, 1x 600GB 10K Hard Drive and 1x 1.4TB PCIe SSD, NVIDIA Quadro 2000, Windows 10 Pro 64-bit Installed, (Refurbished)"
FALSE,"Three Plays : Dividing the Estate, the Trip to Bountiful, and the Young Man from Atlanta"
FALSE,"Florida State University Seminoles ""Alley Oop"" Youth-Size Rubber Basketball"
FALSE,"Z800 Workstation, 2x Xeon X5680 3.33 6GHz Six Core Processors, 192GB DDR3 Memory, 1x 480GB SSD and 1x 2TB Hard Drive, NVIDIA Quadro K2000, Windows 10 Professional 64-bit Installed"
FALSE,New West Indian Readers
FALSE,Kenmore Water Heater Electric 40 gal. 60-1/4 in. H x 20 in. L x 20 in. W
FALSE,MightySkins Protective Vinyl Skin Decal for Motorola Moto 360 Smart Watch cover wrap sticker skins Checkered Flag
FALSE,"Dteck Flip Multi-Viewing Case For Amazon Kindle Paperwhite - Fit All Paperwhite Generations Prior to 2018, Not Fit All-New Paperwhite 10th Gen"
FALSE,LG X Power Armor Hybrid Case - Beige Hexagons on Green Fields
FALSE,Basics - Blank Adult Hoodie Sweatshirt
FALSE,"SKIN DECAL FOR Otterbox Commuter Apple iPhone 6 Case - Peace on Chevron Green Orange Blue DECAL, NOT A CASE"
FALSE,"Am Fm Radio Speaker, Black Studebaker Small Outdoor Retro Portable Am-fm Radio"
FALSE,Ralph Lauren Womens Belen Leather Closed Toe Loafers
FALSE,"Irwin 323016 Multi-Cutter Hammer Drill Bit, 1 in Dia x 13 in OAL, Chrome Vanadium Steel, 8 in Flute"
FALSE,Eagle NEW Blue Mens Size 19 Classic Fit Non Iron Stripe Dress Shirt
FALSE,Newmans 2ASDPLATE Backing Plate With Nut 3/4' Hole
FALSE,Skin Decal Wrap for Hana Modz V3 DNA 40 Mini sticker vape Colorful Hearts
FALSE,Die for Love: Library Edition
FALSE,031 - Unisex Long-Sleeve T-Shirt Disobey V For Vendetta Anonymous Fawkes Mask
FALSE,Women's Aerosoles Spin Cycle Ballet Flat
FALSE,Barjan 320600 Talk Back CB Radio External Speaker 12W Bulk
FALSE,"HP EliteBook 820 12.5"" Notebook w/ Intel i7-6600U, 8GB & 240GB SSD"
FALSE,"Nostalgic Warehouse MEABRN_PSG_238_NK Brown Porcelain Solid Brass Passage Knob Set with Meadows Rose and 2-3/8"" Backset"
FALSE,"""Axion AXG17291398/2 Axiom 4GB ECC Kit (2 x 2GB) TAA Compliant - 4 GB (2 x 2 GB) - DDR2 SDRAM - 800 MHz DDR2-800/PC2-6400 - ECC - Unbuffered - 240-pin - DIMM"""
FALSE,7500 24PORT GBE-SFP/2P 10GBE
FALSE,Harriton Men's Paradise Short-Sleeve Performance Shirt
FALSE,A CURVA DA CINTURA [DIGIPAK]
FALSE,Fleur De Lis Living Boxwood Ball Topiary in Pot
FALSE,OtterBox Symmetry Samsung Galaxy S6 Case - Silhouette Volleyball Woman on Black OtterBox Case
FALSE,I-N-C Mens Contrast Sitching Casual Denim Shorts
FALSE,Lutema Projector Replacement Lamp with Housing / Bulb for Epson EMP-280
FALSE,20pcs Red 17mm Car Wheel Lug Nut Cap Tyre Hub Screw Bolt Dust Cover Protector
FALSE,Maternal and Newborn Success
FALSE,Bridgestone Potenza RE960AS Pole Position RFT P245/50RF18 100W B (4 Ply) BW
FALSE,C&E 4 Pack Ultra Slim SVGA Super VGA 30/32AWG M/F Monitor Cable w/ ferrites Gold Plated Connector 35 Feet
FALSE,BBK 99-04 Mustang V6 Shorty Tuned Length Exhaust Headers - 1-5/8 Silver Ceramic
FALSE,New Way 862 - Women's Long Sleeve T-Shirt I Tried It At Home Experiment Fire Funny Humor Small Envy
FALSE,"Leatherman - Surge Multi-Tool, Black with Nylon Sheath"
FALSE,In Search of Jefferson's Moose: Notes on the State of Cyberspace
FALSE,"Skin For OtterBox Defender Apple iPad Pro 12.9 | MightySkins Protective, Durable"
FALSE,"94"" Bottom Width x 96 1/2"" Top Width x 5 1/2""H x 1 3/4""P Stockton Crosshead"
FALSE,LINCOLN INDUSTRIAL USA LN801233 LID SEAL O-RING
FALSE,Tote-O Lord (18 x 18)
FALSE,Girls` Scallop Tennis Skort Live Love Camp
FALSE,Flexible Thin-Film Solar Module 15.4 Volt 50 mA
FALSE,White Ink
FALSE,Blessed Are the Poor in Spirit : Volume II
FALSE,Halyard Health KIM 10042 Lab Coat&#44; White - Large&#44; 25 Per Case
FALSE,Compatible 1997 - 1998 Ford Windstar Corner Light Assembly / Lens Cover - Left (Driver) F78Z 15A201 AB FO2550116 Replacement For Ford Windstar
FALSE,Rock-a-Bye Bones : A Sarah Booth Delaney Mystery
FALSE,Troubleshooting Injection Moulding (Arburg)
FALSE,"2x Pack - UpStart Battery Olympus LI-40B Battery - Replacement for Olympus LI-40B, LI-42B Digital Camera Battery (800mAh, 3.7V, Lithium-Ion)"
FALSE,vest Anti-Radiation Case for Apple iPhone 5SE/5s/5
FALSE,MightySkins Skin Decal Wrap Compatible with Lifeproof Sticker Protective Cover 100's of Color Options
FALSE,Creepshow 2
FALSE,Lochinvar Spst Pressure Switch OEM 100109877
FALSE,Call of the Wild Howling the Full Moon Women's Racerback Alpha Wolf
FALSE,Cotton Covered Quilting & Piecing Thread 250yd-September Sky
FALSE,Insten Tuff Vines Hybrid Case For Samsung Galaxy Grand Prime - Yellow/Black (+ Tempered Glass Protector)
FALSE,The Vandals
FALSE,"Split Cable, ZebHym,"
FALSE,Gold Roll-up Sunshade Fits Cadillac Escalade 1999-2000
FALSE,"Delicious Belle Of The Ball Sexy Costume, Yellow, Large"
FALSE,Mens Saucony Grid SD Ether Rose Gold S70310-1
FALSE,"Refurbished HP 840 G1 14"" Laptop with Intel Core i5-4200U 1.6GHz Processor, 8GB Memory, 256GB SSD, Win 10 Pro (64-bit)"
FALSE,DR2 NEW Pink Womens Size Large L V-Neck Printed Front-Pleat Blouse
FALSE,Back from the Dead
FALSE,A4 Drop Ship Youth 3/4 Sleeve Utility Shirt
FALSE,SWAK Designs Women's Plus Size Candice Chiffon Dress
FALSE,Agency and Embodiment
FALSE,"Egret Baits VuDu Shrimp 3.25"" , Cajun Pepper"
FALSE,INSTEN Hard Snap-on Dual Layer Hybrid Case Cover For Apple iPhone 6 Plus/ 6s Plus
FALSE,50 Piece Needle Set on a Hanging Card - Pack of 24
FALSE,E4 Safety Certified Rigid Seat Belt Extension for 2005 Hyundai Elantra Front Seats Gray 3 Inches from Seat Belt Extender Pros
FALSE,Lo Que Hice Por Amor
FALSE,"MightySkins Protective Vinyl Skin Decal for Apple MacBook 12"" (2015) wrap cover sticker skins Highway"
FALSE,Fluke P3012-KPA-P Deadweight Testers
FALSE,Chrysler LHS Bright White Replacement Light Bulbs for Headlamps Headlights Head Lamps Lights
FALSE,Swimline Hydrotools Starter Pool Cleaning Set
FALSE,"BEMATECH KB1700B-BK-RJRJ12 BEMATECH, KB1700 PROGRAMMABLE KEYPAD-PS/2 INT, LEGEND SHEET B, 12' RJ TO RJ CABLE-BLK KB1700B-BK-RJRJ12"
FALSE,Awkward Styles Unisex USA Flag Pitbull Graphic Sweatshirt Tops American Flag Pitbull Patriotic 4th of July
FALSE,Bulk Buy: Lion Brand Fishermen's Wool Yarn (6-Pack)
FALSE,Crane Cams 680931 Crane Racing Camshafts
FALSE,Ice Skates Jackson Supreme 5500 Women's Boot
FALSE,Dr. Comfort Paradise Women's Casual Shoe: 4.5 X-Wide (E-2E) Black Velcro
FALSE,Bachmann 62452 Union Pacific GP7 Diesel Locomotive #116 w/DCC
FALSE,"HP Z2 Mini G3 Workstation Ultra Small Form Factor Premium Workstation Desktop PC (Intel Xeon E3 Quad-Core, 32GB RAM, 1TB HDD + 256GB PCIe SSD, NVIDIA Quadro M620, WiFi, Bluetooth, Win10 Pro)"
FALSE,Ac Adapter for Sony Vaio PCG-FR100 VAIO PCG-GRS515M PCG-NV105
FALSE,LB1 High Performance Laptop Battery for Toshiba C650-191 [6 Cells 10.8V]
FALSE,Buddhism and Jainism
FALSE,Tuscom Cute Mochi Squishy Cat Squeeze Healing Fun Kids Kawaii Toy Stress Reliever Decor
FALSE,"Rohl A2400 Country Bath Shower Valve Trim, Available in Various Colors"
FALSE,Lush NEW Red Womens Size Medium M Boho Printed Wide-Leg Pants
FALSE,The Number 5
FALSE,Northern Industrial Tools 139274 Air Cutoff Tool
FALSE,"Walk With Me-CHRMOY114613 Print 11.5""x17.25"" by Chris Moyer in a Black Grande"
FALSE,Vanity Fair Smoothing Comfort Brief
FALSE,Refurbished Dell Latitude E7440 i5 1.9GHz 16GB 500GB Windows 10 Pro 64 Laptop Camera B
FALSE,For 2007-2014 Chevy Silverado/GMC Sierra 6.5Ft Short Bed Aluminum Frame Hard Tri-Fold Tonneau Cover 08 09 10 11 12 13
FALSE,The Other Barack: The Bold and Reckless Life of President Obama's Father
FALSE,1042 - Unisex Long-Sleeve T-Shirt Free Hugs And Maybe A Kiss If You're Lucky
FALSE,Lucky Leather 747C Mens Brown Cowhide Leather Car Coat
FALSE,Car Motor Xenon White T10 Car Side Wedge 3528/5630 SMD LED Backup Light
FALSE,Scarab
FALSE,Jake and the Neverland Pirates 24 Piece Puzzle
FALSE,"ST3320620AS, 9BJ14G-300, 3.AAC, 100413260 C, Seagate SATA 3.5 PCB"
FALSE,Jojo Siwa Black Hair Bow
FALSE,Sleazy Lycra Shoulder Guard Large Royal Blue
FALSE,Keva Brain Builders Junior
FALSE,Ecclesiastes 8:15 so I commend the enjoymentâ€¦ Vinyl Decal Sticker Quote - Small - Metallic Gold
FALSE,M18 x 2.50 x 200 MM (PT) Coarse Thread DIN 931 Class 8.8 Hex Cap Screw (Bolt) Medium Carbon Steel Black Oxide Pk 20
FALSE,Crime of Virtuosity
FALSE,Kangol Baron Trilby
FALSE,Compatible HP/Compaq Pavilion ZD7389CL-PM018UA ZD7389CL-PM018UAR zd7390 zd7390EA ZD7390EA-PN592EA zd7392 zd7392EA ZD7392EA-PN602EA zd7395 zd7395EA Deep Blue 6600mAh/98Wh 12 Cell Compatible Battery
FALSE,Ingushetia Full Zipper Bike Short Sleeve Cycling Jersey for Women - Size 3XL
FALSE,Plant Pathology and Plant Pathogens
FALSE,Alpinestars T-Jaws Air Textile Jacket Black/White Lg 3301514-12-L
FALSE,"Abstract Heart Plant Wall Decal - Wall Sticker, Vinyl Wall Art, Home Decor, Wall Mural - S125 - 12in x 13in, Royal blue"
FALSE,25708 Throttle/Brake Linkage Multi-Colored
FALSE,Drunken Monkeys
FALSE,Sports Parts Inc SM-01094 Taillight Assembly
FALSE,LG PTAC 15 100 BTU/Cooling 11 900 BTU/Heating Heat Pump - LP153HD3B
FALSE,"Womens AR35 Adarra Wide Calf Over The Knee Boots, Black Smooth"
FALSE,ERMENEGILDO ZEGNA Sunglasses EZ0004 14A Shiny Light Ruthenium 63MM
FALSE,"Insect Repelling Patch Countertop Display, 20 Count"
FALSE,Yo Gabba Gabba Mens T-Shirt - Hello Friends Distressed Yellow Print Group image
FALSE,85054 Shock Body Set 12x67-87mm Firestorm (2)
FALSE,Eddie Bauer Women's Favorite Long-Sleeve Crewneck T-Shirt
FALSE,BTI projector lamp -
FALSE,FMF Snap Intake Wing 18401
FALSE,"View From The Chapel B/W-HARLAN78296 Print 19""x19"" by Harold Silverman - Landscapes in a Affordable Brazilian Walnut Medium"
FALSE,Pokemon Diamond & Pearl Dialga #1
FALSE,L'Occitane - Peony Pivoine Sublime CC Cream SPF 20 - #Medium -30ml/1oz
FALSE,Insten Book-Style Leather Glitter Cover Case w/stand/Diamond For Alcatel One Touch Evolve 2 - Hot Pink/Silver
FALSE,Mightyskins Protective Vinyl Skin Decal Cover for LifeProof iPad Mini 1/2/3 Case nuud wrap sticker skins Chaos
FALSE,Stud Boy Pro Series Super Lite Double Backing Plate Black - .75in. 2512-P1-BLK
FALSE,MOTION PRO BLACK VINYL FRONT BRAKE CABLE
FALSE,Pro Pinstripe Jersey Sleeveles
FALSE,Fruit of the Loom T-Shirts HD Cotton Tank Top
FALSE,IMMORTAL 1978 - A Legend Was Born - 39th Birthday Gift T-shirt - Dark Heather
FALSE,centric 928.44035 Street Kit
FALSE,Alcatel Verso Electrical Outlet Case
FALSE,"Birthdays For Him Luxury Topper Set, A4"
FALSE,Zimtown Swings High Back Full Bucket Swing Seat with Plastic Coated Chains - Swing Set Green
FALSE,Dragon Alliance X1s Split Snow Goggles with LumaLens Green Ion Finish
FALSE,TREK Blue Intense Translucent 20 oz - Pom Pom Cheer Mom Tumbler
FALSE,NOS 13765-24NOS Precision SS Stainless Steel Nitrous Funnel Jet; Size .024 in.;
FALSE,"Fourth of July Red White & Blue Metal Star String Lights , 6 Feet"
FALSE,CUSTOM TAILORED DASHBOARD COVERS POLYCARPET GRAY FOR TOYOTA
FALSE,Youth Zoom 2.0 Shirt-222620
FALSE,Bearing Society in Mind: Theories and Politics of the Social Formation
FALSE,"Desantis Mini Scabbard Holster fits KAHR P380, Right Hand, Tan - 019TAR8Z0 - Desantis"
FALSE,Eddie Bauer Women's Passenger Ponte 5-Pocket Pants
FALSE,Sunsets Stained Glass Muse Bikini Top D-DD Cups
FALSE,60-OK0AMB7000-C07 Asus TF201 Docking Board
FALSE,LG V20 Hybrid Stand Case - M Carbon
FALSE,Case Logic IFOL-308PHLOX Folio Case for 7.85-inch Apple iPad Mini - Phlox
FALSE,Mercury Mercruiser Quicksilver New Oem Part # 90-8M0056559 Manual-Parts
FALSE,"Biofictional Histories, Mutations and Forms"
FALSE,Fashionable Girl In Green Dress Tee Women's -Image by Shutterstock
FALSE,MBJ WB670 Womens Fold-Over Maxi Skirt XXXL TAUPE
FALSE,"Hanes Alive Sheer to Waist Pantyhose, Style 811"
FALSE,"Pse 2017 Brute Force Lite Rts Pkg Left Hand 29"" 60 Lbs Skullworks 2"
FALSE,Dude! Your Girlfriend Keeps Checking Me Out - Funny Men's T-Shirt
FALSE,"Triton 10 Amp 4"" x 24"" Belt Sander, T41200BS"
FALSE,"Coronet Race Dee Bit - 5"""
FALSE,"1.5"" Flexo Remix PET Expandable Braided Sleeving - Jungle - 40FT"
FALSE,Mightyskins Protective Vinyl Skin Decal Cover for BlackBerry Q10 Cell Phone SQN100-3 wrap sticker skins Wolf
FALSE,Panasonic ETD75LE40 Zoom Projector Lens for 3-Chip DLP Projectors
FALSE,Enovate IT GC-MOUSE-10 Optical Mouse - 3 Button - USB - Wired - Black
FALSE,RSD Bronzo Leather Gloves
FALSE,Window Tint Film Mitsubishi (all doors) DIY
FALSE,B&O Play Beoplay A6 Bluetooth Speaker White
FALSE,Das Grundstucksrecht : Bd 1
FALSE,Heavy Duty Handlebar Motorcycle Mount Holder Kit fits Apple iPad 2 3 & 4
FALSE,Pair High Low R1234YF A/C Quick Coupler Connector Adapter for Jaguar Land Rover
FALSE,6.6 in. SuperSpeed USB Device Cable - Blue
FALSE,ZTE Fanfare Wallet Case - Sunflower Portrait Case
FALSE,"Musica Sveciae: Swedish Fiddlers Of The Past, Vol. 26-28"
FALSE,Women's Slender Stretch Slimming Skinny Jeans With Glitz Back Pocket Available in Regular and Petite
FALSE,Wyndham WCS777760DGWARINTM24 Morano Double Sink Bathroom Vanity in Glossy White
FALSE,Little Live Pets Surprise Chick - Tilly
FALSE,Memory-Based Logic Synthesis
FALSE,Ives Fs441 Us5 Floor Door Stop
FALSE,Tulane Green Wave Muscle Mug
FALSE,centric 83.133.0023.73
FALSE,FREEing Kantai Collection: Kancolle: I-168 PVC Figure
FALSE,Zac Rachel Women's Long Sleeve Button Down Woven/Knit Shirt - Black - Medium
FALSE,Ikon Massive
FALSE,Disney's Tinker Bell Light Green Dress Children's Costume (Size 4-6X)
FALSE,"Plus Size Pirate Boot, 3 3/4''"
FALSE,The Book of James Carrom
FALSE,Replacement TV Remote Control for LG 47LE5310-ZB Television
FALSE,Mad Scientist Boy Child Halloween Costume
FALSE,740160-001 HP Chromebook 14-Q Laptop Motherboard 4GB RAM w/ Intel Celeron 295...
FALSE,Fenwick Eagle Salmon/Steelhead Casting Fishing Rod
FALSE,Fishouflage Classic Perf. L/S Crew (M)- Redfish/Black
FALSE,DuraTech Roof Support Trim
FALSE,Augusta 1235 Ladies Triumph Jersey
FALSE,Water Level Sensor Curved Two Wire Stainless Steel Horizontal Float Switch
FALSE,LG Fiesta Wallet Case - Basket Ball Case
FALSE,Monroe SC2945 Steering Damper
FALSE,(Pre-Owned Original Part) UNDER DASH FUSE BOX 1998 Eclipse R233753
FALSE,Osram Bare Lamp For Epson PowerLite 800 Projector DLP LCD Bulb
FALSE,"5X Bi Technologies / Tt Electronics Hm42-10001Lftr Transformer, Pulse, 1:1:1, 300Uh"
FALSE,"Union 3"" Female Ports Stainless Steel Pipe Fitting"
FALSE,Stronghold
FALSE,LG Fortune Armor Hybrid Case - Soccer Ball
FALSE,I Love my Stepmother- sun and rainbow letters Toddler T-Shirt
FALSE,NYDJ Womens Marilyn Slimming Fit Medium Wash Straight Leg Jeans
FALSE,Bloomsbury Market Orchid Floral Arrangement in Wooden Small Square Container
FALSE,"(2) Blades Replace Cub Cadet MTD 942-04244 942-04290 LTX1046 LTX1045 46"""
FALSE,Philips Lamp Housing For Sony XL-5200J / XL5200J Projection TV Bulb DLP
FALSE,Have You Hugged a Cactus Today Infant Creeper
FALSE,Colors LED Light 6 Buttons Wired USB2.0 Optical Gaming Game Mouse for Computer
FALSE,Liyu Adult Black Patent Zipper Closure Sturdy Sole Oxford Shoes
FALSE,"The Three Bears-DENLUN16442 Print 26.5""x21.75"" by Denton Lund in a Black Grande"
FALSE,Colorful Paisley Monkey Head Muscle Tank Women's -Image by Shutterstock
FALSE,#1 P.T. - Wallet Flip Style Phone Case Compatible with the Samsung Galaxy s8 Plus / s8+ Universal
FALSE,OtterBox Commuter Samsung Galaxy Note 5 Case - Neon Fractal Spiral on White OtterBox Case
FALSE,100 Facts: 100 Facts Knights & Castles: An Exciting Medieval World of Brave Knights and Incredible C (Paperback)
FALSE,Within Temptation - Black Symphony [DVD]
FALSE,Sequential Words with Your Pets
FALSE,"Z620 Workstation, 2x Xeon E5-2690 v2 3.0GHz Ten Core Processors, 128GB DDR3 Memory, 1x 480GB SSD, NVIDIA Quadro NVS 510, Windows 10 Professional 64-bit Installed, (Refurbished)"
FALSE,Eachine Tiny QX90 QX95 Micro FPV Racing Quadcopter Spare Parts Propeller Protection Cover
FALSE,WatchGuard WGT56001-US Firebox T55-W Network Security Appliance w/ 1yr Standard
FALSE,INTERNATIONAL ELECTRONICS INC SSWILMBZ BZ FNSH MULLN KYPD 26 BIT WGND
FALSE,Vermin & Ashes (Vinyl)
FALSE,Faux Real F132134 Big Size Merry F*ckin&#039; Christmas Costume-2X
FALSE,UPG 54914 Ubcwy29V Dual 9V Charger
FALSE,"MightySkins Skin For Lenovo Flex 5 15"" (2017) | Protective, Durable, and Unique Vinyl Decal wrap cover | Easy To Apply, Remove, and Change Styles | Made in the USA"
FALSE,Big Button Speakerphone
FALSE,"13""x 6"" Glass Display Dome Cloche with Black Wood Base for Gold Rose Display"
FALSE,Toy State Caterpillar Big Builder Backhoe Lands Remote
FALSE,Intellian i-Series DISH Network Multi-Satellite Interface Multi-Switch (MIM)
FALSE,Tropics of Vienna - eBook
FALSE,Shakespearean Criticism
FALSE,INC International Concepts Deep Black Pants Size 18 NWT - Movaz
FALSE,Shop4Ever Men's Colon Cancer Awareness Ribbon Support Hooded Sweatshirt Hoodie
FALSE,"Mini Water Proof Wireless Speaker for LG Q8, Candy, Phoenix Plus, K11 Plus, BLU Vivo XI+, Studio G4, C5, C4 (Yellow)"
FALSE,8GB 2X4GB Memory RAM for Apple Xserve Xeon (2008) Black Diamond Memory Module 240pin PC2-6400 800MHz DDR2 Fully Buffered FBDIMM Upgrade
FALSE,"Press Play Lightning to USB Cable, 10'"
FALSE,Lenovo THINKPAD T440P 20AN0072IX Laptop Screen 14 SLIM LED BOTTOM RIGHT WXGA HD
FALSE,"Refurbished Generic LENOVO 04W1594 LAPTOP LCD SCREEN 11.6"" WXGA HD DIODE (SUBSTITUTE REPLACEMENT LCD SCREEN ONLY. NOT A LAPTOP ) (THINKPAD X131E)"
FALSE,"Junior Large Paint By Number Kit 15.25""X11.25""-3 Of A Kind"
FALSE,Play-Doh Launch Game with 3 Cans of Dough
FALSE,CSU Colorado Rams Confetti Clear Case for Galaxy 8+
FALSE,"Offray 423806 0. 25 inch Simply Sheer Asiana Ribbon - 100 Yards, Burgundy"
FALSE,Pocahontas Adult Costume 88923 - Small 4-6
FALSE,Scott Dawson - NXT TakerOver Elite Exclusive Toy Wrestling Action Figure
FALSE,T-Mobile REVVL Armor Hybrid Case - Silhouette Kissing Lips on Black
FALSE,B-52 Matrix-1000 V2 700W Active 3-Piece Speaker System
FALSE,PACKED EM SPARE LV
FALSE,"HP MP9 DIGITAL SIGNAGE PLAYER MODEL 9000, INTEL CORE I3-4160T @3.10GHZ, 4GB RAM, 500GB SSD, INTEL GRAPHICS 4400, WINDOWS 7 thin client (Certified Refurbished)"
FALSE,"G.R.I. 100-T-B Surf Mini 1"" Term Brn"
FALSE,Lamp Housing For IBM MicroPortable Data Projector DLP LCD Bulb
FALSE,Quick Cooking for Diabetes : 70 recipes in 30 minutes or less
FALSE,Marlon Brando
FALSE,Making Time
FALSE,Casual Blouses Plus Size Lattice Marled Handkerchief T-shirt For Women
FALSE,NIKON D5200 DX DSLR CAMERA 18-55MM AF-P + LENS BRUSH + LENS CLEANING PEN + CASE + TRIPOD + 16GB SD CARD + READER
FALSE,"Mega Bloks Halo 12"" Figure Asrt"
FALSE,"Diecast Car & Accessory Package - 1956 Plymouth Savoy w/ Black Top, Red - Signature Models 32341 - 1/32 Scale Diecast Model Toy Car w/display case"
FALSE,No Crumby Days Donut Patch by Summer Por Vida
FALSE,​360 Degree Three Sections Full Protection Hard Case for iPhone8 plus Ultra Thin Mobile Phone Cover
FALSE,Black Cat Jumpsuit Adult Costume
FALSE,Refurbished StarTech MUYHSFMM 3.5mm 4 Pin to 2x3 Pin 3.5mm Headset Splitter Adapter - F/M
FALSE,"12ct Light Gunmetal Gray Shatterproof 4-Finish Christmas Ball Ornaments 4"" (100mm)"
FALSE,MightySkins Protective Vinyl Skin Decal for LG G Vista wrap cover sticker skins Flower Child
FALSE,"HP Pavilion X360 2-in-1 15.6"" Premium Touchscreen Convertible Laptop / Tablet (Intel i7 Processor, 8GB RAM, 512GB SSD, FHD Touch 1920 x 1080 , NVIDIA GeForce 940M, Bluetooth, Win 10) Silver"
FALSE,"MightySkins Skin For Samsung Chromebook 3 11.6"", 11.6"" | Protective, Durable, and Unique Vinyl Decal wrap cover Easy To Apply, Remove, Change Styles Made in the USA"
FALSE,"Z800 Workstation, 2x Xeon E5530 2.4 4GHz Quad Core Processors, 32GB DDR3 Memory, 1x 480GB SSD, NVIDIA Quadro K5000, Windows 10 Professional 64-bit Installed"
FALSE,MUNDAZE Blue Flaming Skull Case Cover For LG Stylo 4 Plus / Stylo 4+ / Stylo 4
FALSE,Insten Summer Butterflies Hard Dual Layer Plastic Silicone Case w/stand For HTC Desire 626/626s - Yellow/Hot Pink
FALSE,Girl's Doctor Costume
FALSE,8 Color Bundle Pack! - Skull Tube Face Mask Festival Style Multi-Function Bandana Beanie Scarf Headband Motorcycle Sports Mask Rave Mask Outdoor Face Protection Rave Mask Value Pack!
FALSE,FunnyDay Wireless Bluetooth V4.1 A2DP 94dB Sport Stereo In_Ear Earphone Headset Headphone
FALSE,Dress It Up Embellishments-Mushroom Houses
FALSE,Ted Kluszewski Cincinnati Reds 1956 Topps #25 Card
FALSE,Samsung Galaxy S6 Edge Case - VENA [vDiary] Slim Tri-Fold Leather Wallet Case with Stand Flip Cover for Samsung Galaxy S6 Edge (Teal / Navy Blue)
FALSE,"Refurbished Dell T320 8 x 3.5"" HS E5-2450 8C 2.1Ghz 24GB 8x 2TB SAS H710 2x 495W"
FALSE,ILY Magnet - 2-inch- Purple -One Magnet
FALSE,Picadilly NEW White Black Womens Size 3X Plus V-Neck Sheath Dress
FALSE,End of Philosophy of Religion
FALSE,"Lenovo 110-15IBR 80TR0005US 15.6"" HD WXGA eDP Slim Display Replacement LCD LED Screen Non-Touch New"
FALSE,"Premium Over-Head Stereo HandsfreeHeadset Headphones w/ Mic for Asus ROG Phone,ZenFone 5, 5 (2018), 5Z, 5Q, 5 Lite (2018), Max Pro (M1),Live (L1),Max (M1) (Blue Pattern) + MND Stylus"
FALSE,"Diecast Car & Mechanic Set Package - 1957 Chevy Bel Air, Black - Motor Max 73228NB - 1/24 Scale Diecast Model Car w/Mechanic Set"
FALSE,OFFRAY RIBBON TAMPA BAY RAYS MLB 2 1/2 INCHES x 9 FEET
FALSE,5 1/2 Inch Platform Shoes Slingback Pumpes Rhinestone Glamour Sexy Shoes
FALSE,"Durango Western Boots Mens 11"" Leather Cowboy Heel Oiled Peanut TR762"
FALSE,Mightyskins Protective Vinyl Skin Decal Cover for OtterBox Preserver iPhone 5 / 5S Case wrap sticker skins Hallucinate
FALSE,Modern Israeli & NATO Chevrons - White New
FALSE,Montessori Basic Life Skills Development Material For Kids Practical Dressing Frame Learn To Dress Kits (Set of 8)
FALSE,EagleCell Zebra Hard Rhinestone Cover Case For BLU Studio 5.5 - Black/Silver
FALSE,Verus Crystal Bumper Shockproof Slim Clear Bumper Case for Apple iPhone 6/6S
