Available,Product Name
FALSE,CHRYSLER OEM 07-09 Aspen Dash Cluster Switch-Switch Bezel 5JG50DX9AB
FALSE,Buckle-Down DL-W30537 El Salvador Flag Black Dog Leash
FALSE,"Artist Watercolor viridian, 5 ml (pack of 2)"
FALSE,Cyber Security and Global Information Assurance : Threat Analysis and Response Solutions
FALSE,Rainy Day Sessions
FALSE,"4 Pack - K-Y Liquibeads Vaginal Moisturizer, 6 Beads"
FALSE,Strong Leather Company 76900-5042 Side Open Badge Case 504 - 76900-5042 - Strong Leather Company
FALSE,Panda Superstore PS-SPO7702515011-SUSAN00280 Creative Multifunction Wash Bag Portable Travel Pouch Cosmetic Bag&#44; Dark Blue
FALSE,"ConvaTec SUR-FIT - Natura - Stomahesive - Flexible 3/4"" Pre-Cut Skin Barrier - 1-3/4"" Flange"
FALSE,MRM - Kids Multi-Vitamin Liquid Orange Mango - 16 Fl oz.
FALSE,Remi Collection 24 Inch Towel Bar
FALSE,BikeMaster Replacement Bulb for HID Light Kit 8000k H4HL - Blue 8000K H4HL BULB
FALSE,SparkSettings Frosty Paper Plates Cut Proof Heavy Duty Compostable Square Party Plates Disposable Paper Plastic Plates for All Occasions 20 Count Dessert Salad Plates Caribbean Blue
FALSE,Da-Lite Tensioned Cosmopolitan Electrol - projection screen - 84 in (83.9 in)
FALSE,Solaris Seethes
FALSE,Bendix 33890 Wheel Cylinder
FALSE,Apple iPhone 8 plus case by Insten Frosted Rubber Case for Apple iPhone 8 Plus / iPhone 7 Plus - Blue
FALSE,China Slim Tea Extra Strength For Men And Women 72 Tea Bags
FALSE,Sport Aid Deluxe Wrist Brace XL Long 1 Each
FALSE,Counterfeit Detector Pen&#44; with UV Light Cap&#44; Black
FALSE,"Pterosaur Wall Decal - dinosaur wall decal, sticker, mural vinyl art home decor - 3765 - Orange, 47in x 24in"
FALSE,"Vickerman 14"" Finial Drop Christmas Ornaments, Pack of 2"
FALSE,"3M 361 2 x 1.25100 White Glass Cloth/Silicone Adhesive Electrical Tape, 65 degrees F to 450 degrees F, 1.25 Length, 2 Width"
FALSE,"2 Pack Fabric Eyeglass Case, Slip In Eyeglass Case Soft Fits Medium Glasses, Women"
FALSE,"Goodmark Right Side Window Regulator for Chevy 3100, 3B, 3C, 3D, 3E, 3F, 3G"
FALSE,A Field Guide to Edible Mushrooms of California
FALSE,Conjure Aromatherapy Scented Oil Imagine Create Future Desires 2 Dram Bottle by Aura Accord
FALSE,"FeitElectric 40 Watt (60 Watt Equivalent) , G25 Halogen, Dimmable Light Bulb, Warm White (3000K) E26 Base"
FALSE,"PDD 4 Front Rail Silver Idler Wheels Kit for Snowmobile YAMAHA RX-1,Mountain,ER,LE 2003-2005"
FALSE,C2F197836BK1
FALSE,Tutto 1XL Black Monster Machine Bag on Wheels
FALSE,Surthrival Pine Pollen Pure Potency 50ml
FALSE,2 Pack Nature's Bounty Cardio-Health Probiotic Support 60 capsules each
FALSE,Strong Leather Company 88950-11282 Dr Bdg Cs Fw 2Id R/Flp 1128 - 88950-11282 - Strong Leather Company
FALSE,Shoplet select 2 Mil Gusseted Poly Bags SHPPB1616
FALSE,Sweet Pea in a Pod - Baby Shower or First Birthday Party Water Bottle Sticker Labels - Set of 10
FALSE,IN-16/1186 Surfing Rubber Duckies Per Dozen
FALSE,Wal-mart Bakery 1/4 White Cake W/white Buttercream
FALSE,OtterBox Commuter Samsung Galaxy S6 Case - KEEP CALM and Game On on White OtterBox Case
FALSE,"Lamy Z24 Fountain Pen Ink Converter, Pack of 5 (LMY_Z24_P5)"
FALSE,ddi 381371 georgia postcard - ga100 stone mtn multiview&#44; case of 500
FALSE,"Belimo LMB24-3-T Motor Rotary, 45 in-lb, On/Off/Float, 24Vac, 24Vdc"
FALSE,Elite Hand Painted Boat Glass Oval Vessel Bathroom Sink
FALSE,"Buckle-Down ""Skewed Squares Stacked"" Martingale Dog Collar"
FALSE,Replacement for RF IDEAS RDR-6E81AK0
FALSE,Travel Cosmetic Toiletry Bag Case Portable Storage Pouch Hanging Bag
FALSE,CellularOutfitter Charge and Sync Cable - 5ft. Connector with Slim Micro USB Housing - Black
FALSE,"College Life Extreme : Lies, Sex, Drugs and Violence"
FALSE,"Pemberly Row 49"" Bath Vanity with Quartz Marble Top in White"
FALSE,"Yes To Carrots Nourishing Super Rich Body Butter, 6 Ounce"
FALSE,Country Brook Petz Southern Forest Camo Featherweight Deluxe Dog Collar
FALSE,"Records of REV. John Casper Stoever : Baptismal and Marriage, 1730-1779 - Scholar's Choice Edition"
FALSE,Troy Lee Designs 2016 Ruckus Bike Jersey Formation Red Mens All Sizes
FALSE,"Trolli Evil Twins Gummi Candy, 4.25 Oz."
FALSE,Final Fantasy VII Vincent Valentine Static Arts Gallery Statuette
FALSE,Ebe Reading Glasses Mens Womens Black Blue Retro Acetate Anti-Glare Lenses Light Weight c1219
FALSE,Star Hollow Candle Company Candy Corn Room Spray
FALSE,"3 1/2""W x 20""D x 20""H Funston Craftsman Smooth Bracket, Douglas Fir"
FALSE,Folksingers of the 60's / Various
FALSE,"Online Labels - 1.1"" x 3.5"" Waterproof Labels for DYMO Printers - 4,200 Labels, 12 Rolls - Same As DYMO 30252"
FALSE,WESTGATE G4 Base Lamp 9 X Smd5050 2W 12V Circle Shape 3200K
FALSE,36.5 in x 60.5 in Aluminum Frame Vinyl Bulletin Board - Ebony
FALSE,University of Iowa Holiday Christmas Ornament
FALSE,billyboards Porcelain School Chalkboard
FALSE,"ICE BREAKERS COOL BLASTS Chews, Peppermint, Sugar Free, 0.8 Ounce Box (Pack of 6)"
FALSE,3 1/2 x 4 7/8 (fits inside a 4 Bar envelope) Chocolate Brown Base Blank Foldover Cards -500 per pack
FALSE,Women's Knee High Stockings -15-20 mmHg Natural
FALSE,"That's it Super Sampler, Pack of 24, (4 Apple+Blueberry, 4 Apple+Strawberry, 4 Apple+Pineapple, 4 Apple+Pear, 4 Apple+Cherry, 4 Apple Banana)"
FALSE,"Redondos Sliced Pipi Kaula, 6 Oz."
FALSE,"Chloraseptic Sore Throat Spray, Menthol, 6-Ounce (177 ml) (Pack of 3)"
FALSE,Giant 36in. Purple Balloons (Set of 2)
FALSE,"Adjustable Patella Stabilizer Knee Strap Brace Support for Hiking, Soccer, Basketball, Running"
FALSE,"2WFR4 15 Sheet Battery Operated Stapler, 3/8 In Throat"
FALSE,Spoke Sleeves White for Honda CRF230L 2008-2009
FALSE,Master Grooming Tools Ergonomic Dematting Pet Combs
FALSE,"Activon Topical Analgesic, 2.0 OZ"
FALSE,"Sun Brand Madras Curry Powder, 4 oz (Pack of 12)"
FALSE,Adventure Time Cartoon Network Tv Show - Marceline Jake Finn Group HUG Logo Sticker
FALSE,Heepo Baby Bib Cotton Pom Pom Trim Cartoon Fox Feather Triangle Infants Saliva Towel
FALSE,Felt Lady Bug Mobile - Global Groove
FALSE,Numero Uno by Rasasi - 75 ml
FALSE,"Dalite-84989LS Cosmo,Tnsd 8X10 Dt"
FALSE,harbor breeze mazon 44-inch bronze flush mount indoor ceiling fan with light kit and remote 3 blade
FALSE,"Stocking, Anti-Embolism Thigh Med Reg (Units Per Dozen: 12)"
FALSE,"Buckle-Down ""Stripes Red Blue Green"" Dog Leash"
FALSE,Benmer Strap Quick Release Clip Clamp Mount 360 Degree Rotation for Gopro Hero 4 3+ 3 2 1 Black
FALSE,"Presto flexright underwear, extended absorbency, large, 44""-58"" part no. aub44040 (56/case)"
FALSE,"Colavita Capers, 4.76 Oz"
FALSE,(20x) Caudalie Vinexpert Eye & Lip Serum .05 Oz (1 Oz total)
FALSE,Culinary Herbs; Their Cultivation Harvesting Curing and Uses
FALSE,"Hair Straightening Brush, Anion Hair Care, Anti Scald, Massage Straightening Irons"
FALSE,Marsh Industries MR-306-3PK0 3 inch x 6' Aluminum Map Rail with Natural Cork Insert - 3 Package
FALSE,"Russell Stover Sugar-Free Pecan Delights, Coconut, & Caramel Variety Candy Pack, 10 Oz."
FALSE,Magnaflow 36303 Universal Catalytic Converter - CARB Compliant
FALSE,ATD Tools 22T LOW PRO AIR AXLE JACK 7328
FALSE,"LG X Power Case, K6 Case - Wydan Wallet Leather Credit Card Flip Book Style Folio Kicktand Feature Cover w/ Wrist Strap Anchor - Mint Green"
FALSE,Wacom Intuos3 Digital Airbrush Pen
FALSE,Kingfisher Lane Guest Chair in Black
FALSE,"Graco Extend2Fit Platinum 4-in-1 Convertible Car Seat, Carlen"
FALSE,Replacement for SIGNAL STAT 3693W GREEN LED REPLACEMENT replacement light bulb lamp
FALSE,"Petcurean Go! Fit + Free Chicken, Turkey & Trout All Stages Dry Cat Food, 4 Lb"
FALSE,Refurbished Generic IBM-LENOVO THINKPAD EDGE E525 1200-39U REPLACEMENT LAPTOP 15.6' LED LCD SCREEN
FALSE,Industrial and Specialty Polymers and Their Applications
FALSE,"For LG V10 / F600 Case, INNOVAA Shockproof Armor Case"
FALSE,Tom Ford Lip Color Sheer 0.07Oz/2g New In Box [Choose Your Shade]
FALSE,PCT D12RBLD Food Container - Combo 250
FALSE,Ebe Reading Glasses Mens Womens Tortoise Rectanuglar Chic Anti Glare grade ckbdp9123
FALSE,"FA Hour Roll-On Deodorant, Exotic Garden 1.7 oz (Pack of 3)"
FALSE,"Soft Fit Universal Thumb Spica Brace Universal, Navy"
FALSE,Burton & Burton 360 Deluxe Grey Pk/50 Pack/50 Balloons
FALSE,Safety 1st - Clear View Clippers
FALSE,Superb Choice 12V PANASONIC National EZ7200X Power Tool Battery
FALSE,BluTrack Starter Set
FALSE,"Tonnino Tuna Fillets, Capers & Garlic In Olive Oil, 6.7 Oz"
FALSE,Venosan VenoSoft 20-30 mmHg Below Knee Stocking Closed Toe
FALSE,180/55ZR-17 (73W) Bridgestone Battlax S21 Hypersport Rear Motorcycle Tire for MV Agusta Stradale 2015-2016
FALSE,Forsaken Ravage Leader 1111
FALSE,Urban Environment UV Protection Cream SPF 40 (For Face & Body)-50ml/1.9oz
FALSE,Round Keyhole Thin Plastic Horn Rim Tri-focal Progressive Reader Eyeglasses Green Pink Stripe 3.0
FALSE,"Gillette Body Non Foaming Shave Gel for Men, 5.9 Fl Oz + Sensor Excel Refill Blades 10 Ct. + Schick Slim Twin ST for Sensitive Skin"
FALSE,"Evolve Meatball Classics Beef, Sweet Potato & Herb Formula, 8.0 OZ"
FALSE,Diagnostic Scan Tools For Late Models
FALSE,MightySkins Skin Decal Wrap Compatible with Apple Sticker Protective Cover 100's of Color Options
FALSE,"Cotton Ball, Prem Med (Units Per Case: 4000)"
FALSE,WM1-AK Mid Body Compression with Side Zippers-Above Knee&#44; Medium - Black
FALSE,Steel Wire Fishing Line to Hook Connector Floating 5PCS
FALSE,"iPhone 6/6s Ultra-Clear Screen Protector Glass, Tempered Glass Screen Protector for Apple iPhone 6/6s"
FALSE,Chocolate Dipped Ariel Brut Non Alcoholic Champagne Gift
FALSE,Green Hairspray
FALSE,McKesson Ultra Adult Absorbent Underwear Pull On Large Disposable Heavy Absorbency Case of 72
FALSE,CHANNEL VISION SATIN NICKEL INTERCOM SYSTEM
FALSE,ROSENICE 2pcs Portable Natural Loofah Luffa Bath Body Shower Sponge Scrubber
FALSE,"HP-COMPAQ ENVY DV6-7246US 15.6"" Laptop LCD LED Display Screen"
FALSE,Unique Bargains Home Blackboard Mathematical Symbol Design Fridge Refrigerator Magnets Set
FALSE,"COVERGIRL Outlast All-Day Moisturizing Lip Color, 560 Wild Berry"
FALSE,"PM COMPANY Color-Coded Kraft Currency Straps, Dollar Bill, $50, Self-Adhesive, 1000/Pack"
FALSE,"48"" Rect Resin Table & 6x14"" Chairs - Sand"
FALSE,Sylvania 64770 - MP350/400/C/PS/BU-ONLY 350 watt Metal Halide Light Bulb
FALSE,Buxom Buxom Big & Healthy Lip Polish Gabby
FALSE,Mini Automatic 7 Egg Incubator di gital Chicken Poultry Hatcher Egg Hatcher Incubator With Automatic Temperature Control
FALSE,"MightySkins Skin For OtterBox Commuter iPhone 8 Plus | Protective, Durable, and Unique Vinyl Decal wrap cover | Easy To Apply, Remove, and Change Styles | Made in the USA"
FALSE,ESP LTD M-100FM Electric Guitar Level 2 See-Thru Black 888366003602
FALSE,Apple iPhone SE Wallet Case - Flaming Skull Case
FALSE,2011 finest xfractors #101 DEMARCO MURRAY dallas cowboy rc BGS 10 pristine
FALSE,"15.6"" WXGA Glossy Laptop LED Screen For HP 2000-430CA"
FALSE,Spicebomb by Viktor & Rolf - Men - Eau De Toilette Spray 5 oz
FALSE,FUNKO 11777PXAST WALKING DEAD S7 POP VINYL ASSORTMENT
FALSE,Fiber One Chocolate Chip Protein Bars - 4.8oz (Pack of 4)
FALSE,Eye Buy Express Prescription Glasses Mens Womens Orange Bold Rounded Rectangular Translucent Reading Glasses Anti Glare grade
FALSE,Jim Shore Disney Tinkerbell With Snowflake Figurine
FALSE,Christopher Radko Glass Plum Frosty Snowman Christmas Ornament #1017624
FALSE,Kitty Nest 18 X 24 X 40
FALSE,10GBASE-LR SFP+ 1310NM 10KM TELCO SYSTEMS OEM BTI-10GLR-DD-SFP+
FALSE,6 Step Tiny Steps for Tiny Dogs
FALSE,NCAA Iowa State Cyclones Zippered Pencil Pouch with Grommets
FALSE,Parker Laboratories Aquasonic Clear 5 Liter Sonicpac Each Part No.03-50
FALSE,Complete Medical 113103 Casual Medical Legwear For Men&#44; 15-20mmhg&#44; Extra Large&#44; Black
FALSE,"MEDca Universal Hot and Cold Therapy Reusable Microwavable Gel Pack |Soft & Comfortable Heating or Cooling Therapy for Sprains, EXTRA DURABLE NYLON QUALITY In 5 x 10"
FALSE,100% Pure Long Last Liquid Eye Liner Dark Chocolate
FALSE,WALKER EXHAUST - RESONATOR ASSY
FALSE,"Petflect Green Purple Vertically Striped Dog Collar - Reflective - Nylon - Super Strength - X-Large, Neck 26""-32"""
FALSE,Window Tint Film Chevy (back doors) DIY
FALSE,"Tripp Lite 25m Duplex Multimode Fiber Patch Cable LC/LC 50/125 100Gb, Lime Green"
FALSE,"Coated Ceramic Mounted Flap Wheel, Straight Shank Type, 2"" Dia., 1"" Face Width,"
FALSE,"Soft Activity Book - 1,2,3...Come Count with Me"
FALSE,"000748 Holiday Party Collar, XS Multi Colored Bunnies"
FALSE,JUICY COUTURE Eyeglasses 917 0RV7 Satin Wine 47MM
FALSE,"Colavita Pasta STARS, 16oz (454g)"
FALSE,Torani Lime Syrup 25 oz each (3 Items Per Order)
FALSE,Green Giant Vfs Season Grilled Potato
FALSE,"Ti Amo Dressing Kit, Misty Grey"
FALSE,American River Ultra Choke-Free Mesh Dog Harness by Doggie Design - Black X-Small
FALSE,Scalloped Metal Hinge Embellishments 15/
FALSE,storefront christmas LED Decoration Light Gold Color Star Shape Vine Wedding Party event
FALSE,"Prairie Farms Vitamin D Milk, 16 Oz."
FALSE,"Children's TYLENOL Pain + Fever Oral Suspension, Cherry, 4 oz (Pack of 4)"
FALSE,"Pacific Catch Halibut Slide Rig with Single Hook, Size 14"
FALSE,ESP LTD JH-600 Jeff Hanneman Signature Series Electric Guitar Level 3 Black 888365966953
FALSE,macy Cough Formula CF Cough and Cold - 4 Oz
FALSE,simplehuman&reg; Pet Food Storage Can - Stainless Steel
FALSE,BnoInc 20978 Philips Avent Nighttime Pacifier&#44; Pack of 2
FALSE,"One N Only Argan Oil Color Conditioner, Ash-Violet 5.2 oz"
FALSE,"Common Good Floor Cleaner, Bergamot, 32 Fl Oz"
FALSE,"Three Things That Makes Good Coffee: Sugar, Sugar and More Sugar Wall Decal - wall decal, sticker, quotes and sayings - W5082 - Light pink, 35in x 18in"
FALSE,Christie LX25a Original Lamp/Bulb with Generic Housing for Christie Projector with 90 Days Replacement Warranty
FALSE,"3dRose Snowglobe Winter Village with Bunnies - Greeting Cards, 6 by 6-inches, set of 12"
FALSE,"(2x) Revlon Kiss Plumping Lip Creme, 515 Almond Suede, 0.25 Oz / 7.1g Each"
FALSE,All Sales Blast 3rd Brk Light Cover-Polished
FALSE,GODSPEED REAR LOWER CONTROL ARM BILLET ALUMINUM SPHERICAL FOR HONDA CIVIC 96-00
FALSE,La Diaspora (2984)
FALSE,"iPhone 8 Case, iPhone 7 Case, by Insten Scorpio FreeStyle Challenger Hard Plastic/TPU Hybrid Shockproof Cover Case For Apple iPhone 8 / iPhone 7 - Black"
FALSE,Ebe Reading Glasses Mens Womens Round Black Silver Full Frame Engraved Anti Glare grade ckbtr9091
FALSE,13030 MOMOI DIAMOND 30LB
FALSE,"Samsung Galaxy On5 Case, Galaxy On5 Phone Case, by Insten Hearts Quicksand Glitter Hybrid PC/TPU Dual Layer Case For Samsung Galaxy On5 - Purple"
FALSE,Coastal Shower Doors Paragon Series 61'' x 58'' Sliding Framed Tub Door
FALSE,Zinsco Single Pole Thick Breaker - HACR Rated
FALSE,DesignOvation Walcott Framed Magnetic Board Wall Organizer with Clip
FALSE,Scunci No Slip Super Band&#44; Pack of 6
FALSE,"24 PACKS : Colgate Total Whitening Gel Toothpaste, 7.8 Ounce"
FALSE,"E.L.F. Cosmetics, Beautifully Bare, Smooth Matte Eyeshadow, Brown Cashmere, 0.22 oz(pack of 4)"
FALSE,"Buckle-Down DL-W30481-N Narrow 0.5"" Double Swag Black White Red Stripe Dog Leash"
FALSE,"Celebrations By Sweetworks Candy Sweet Shapes, 12oz Bag"
FALSE,"ACCL RS-232 DB25 Male to DB25 Female Jumper Box (Cable Testing Set), 5pk"
FALSE,"MAGNETI MARELLI, MM BRAKES, OEDISCBRAKEFRICTION, PAD KIT"
FALSE,"Jillson & Roberts Medium Gift Bags, Traditional Nutcracker (12 Pcs)"
FALSE,"Business Source Basic D-Ring White View Binders - 5"" Binder Capacity - D-Ring Fastener - Polypropylene - White - 2.10 lb - 1 Each"
FALSE,"Plastic Table Cover, 54"" x 108"", Hunter Green"
FALSE,"Buckle-Down Martingale Dog Collar - Splatter Black White - 1"" Wide - Fits 15-26"" Neck Size - Large"
FALSE,GREAT PLANES Wing Set Escapade MX .46/EP ARF GPMA2000
FALSE,6 Inch Thick Odor-Free Bully Sticks - 25 Pack
FALSE,"Organic Sprouted Pumpkin Seeds, 2 Pounds - Non-GMO, Kosher, No Shell, Unsalted, Raw Kernels, Vegan Superfood, Bulk Pepitas - by Food to Live"
FALSE,"BH Baby Decorative Nursery Pillow, 17.5"", Cat Beard"
FALSE,Home Vegetable Meat Fresh Vacuum Sealer Food Storage Bags Clear 30 x 40cm 20 Pcs
FALSE,Philosophy of Evolutionary Biology : Volume I
FALSE,Way To Celebrate Valentine Kiddie Card
FALSE,VicTsing Chest Strap Vest Harness Soft Padded Ajustable and Convenient Sport Working Training Dogs for Outdoor Activities Random Color (Size S)
FALSE,"Kraft Honey Hickory Smoke Barbecue Sauce, 18.0 oz Bottle"
FALSE,Toshiba M640 PSMPBU-0FM02E Laptop Screen 14 LED BOTTOM LEFT WXGA HD
FALSE,Unique Bargains 2 Pcs Aquarium Green Magenta Emulational Plastic Jellyfish Decor
FALSE,"BRADY Wire Marker,Wire Sleeve,PermaSleeve(R) 3PS-250-2-WT-4"
FALSE,Superb Choice 6-cell LENOVO FRU 42T4787 Laptop Battery
FALSE,Original TV Remote Control for ELEMENT ELDTW401 Television
FALSE,Election 2016 Carly Fiorina Varsity Black Adult Tank Top
FALSE,"Z620 Workstation, 2x Xeon E5-2630 v2 2.6GHz Six Core Processors, 48GB DDR3 Memory, 1x 2TB Hard Drive, NVIDIA Quadro K4000, Windows 10 Professional 64-bit Installed, (Refurbished)"
FALSE,MXQ Android Quad-Core WiFi HDMI 1080P Smart TV Box 8GB Support Kodi
FALSE,Oblivion Hunter
FALSE,"TCK Elite Baseball Football Knee High Striped Socks (F) Graphite, Purple, White (M)"
FALSE,Sport-Tek Ladies PosiCharge Competitor Tee
FALSE,Dodge CHRYSLER OEM 2003 Ram 1500 Van Roof-Rail Right 55347422AE
FALSE,Lamp Housing For Optoma EzPro731 Projector DLP LCD Bulb
FALSE,Halo Reach Play Arts Kai Blue Spartan Action Figure [Mark V]
FALSE,Crayola Washable Paint
FALSE,"SKIN DECAL FOR OtterBox Symmetry Samsung Galaxy S7 Case - Christmas Snowflake Blue Ornaments DECAL, NOT A CASE"
FALSE,M.Outfitter 308734 Laser Tools & Merch Kit
FALSE,"Official Minecraft Craftables Series 1 Figure 3-Pack Set Blind Pack ""3 Random Styles"""
FALSE,GATES BELTS & HOSES - 16GS16FLH90120X
FALSE,Ergotron - 97-586 - Ergotron TeachWell 97-586 Desk Mount for Flat Panel Display - 22 Screen Support - 14.11 lb Load
FALSE,Airaid 202-248 AIRAID MXP Series Cold Air Dam Intake System
FALSE,James Martin Furniture Brittany 36 in. Single Bathroom Vanity
FALSE,Kenneth James Sultana Lattice Texture Wallpaper
FALSE,Trading Nation : Advancing Australia's Interests in World Markets
FALSE,"The Short, Short-Story Omnibus-1"
FALSE,Miss Lulu Bett
FALSE,Fly Racing Kinetic Vector Pants Red/Black/Yellow 30 369-53230
FALSE,Uirapuru (CD)
FALSE,For 15-17 Golf/GTI/Sportwagen MK7 (Halogen) 3D Halo Projector Headlights Smoke
FALSE,"Beruflich in Peru : Trainingsprogramm Fur Manager, Fach- Und Fuhrungskrafte"
FALSE,(Pre-Owned Original Part) Driver Left Taillight Tail Light Fits 04 05 06 Chevrolet Tahoe GMC Yukon R307594
FALSE,"Phalanx Defense Stealth H&K HK HECKLER & KOCH P30 P-30 Holster Multi-Fit OWB Belt Right Hand, Black + Ultimate Arms Gear 9mm/.40/.45 Mag Pouch"
FALSE,Mens Cotton Flat Front Belted Plad Shorts
FALSE,Sternklang
FALSE,"Violent Sensations : Sex, Crime, and Utopia in Vienna and Berlin, 1860-1914"
FALSE,Awkward Styles Sugar Skull Shirts for Men Jolly Roger Skull and Crossbones Men's Tee Shirt Tops Day of Dead Tshirts Pirate Flag Shirts Skull T-shirts Dia de Los Muertos T Shirts for Men
FALSE,FashionOutfit Women's Solid Open Front Draped Neck Sleeveless Vest Cardigan - Made in USA
FALSE,12 Pcs 3D Butterfly Stickers DIY Mural Art Decal Wall Stickers Crafts Wall Paper Decor (Yellow Series)
FALSE,4/137 STI HD4 Limited Edition Alloy Wheel 14x7 5.0 + 2.0 Matte Black for Can-Am Commander 1000 2011-2014
FALSE,MightySkins Skin Decal Wrap Compatible with Smoant Sticker Protective Cover 100's of Color Options
FALSE,"Indoor/Outdoor Area Rug with Rubber Marine Backing for Patio, Porch, Deck, Boat, Basement or Garage with Premium Bound Polyester Edges Blue 8""x24"" stair treads (set of 13)"
FALSE,Refurbished HP EliteBook 8540p Laptop i7 Dual-Core 8GB 500GB Win 7 Pro B v.WBA
FALSE,Reeds Aberdeen Asset Management Western Almanac 2014
FALSE,San Francisco Giants Women's Oversized Long Sleeve Ombre Spirit Jersey T-Shirt - Black
FALSE,MightySkins Protective Vinyl Skin Decal for OtterBox Resurgence iPhone 6 Power Case wrap cover sticker skins Bright Stones
FALSE,Seifelden 80GB Hard Disk Drive with 3 Year Warranty for Compaq Presario V6107AU Laptop Notebook HDD Computer (Certified Refurbished)
FALSE,EBC 08-10 Ford Flex 3.5 Greenstuff Front Brake Pads
FALSE,"Danielson Salmon Knotless Net with 42"" Handle, 27"" x 30"""
FALSE,Harry Potter Gryffindor Quidditch Seeker Uniform Shortie PJ Set
FALSE,"Heather Blue Diamond Chambray, Fabric By the Yard"
FALSE,Urbane Urbane Classic Crossover Scrub Top Scrub Top
FALSE,Superb Choice 8-cell GATEWAY 7000GZ Series Laptop Battery
FALSE,Sony PlayStation 4 Ride Video Game
FALSE,Refurbished NASCAR 2008 - PlayStation 2
FALSE,"Replacement Alta MDD03D-HEL,MDD03D-HER Pair Power Mirror For LHS Concorde Vision"
FALSE,"Simplicity Pattern Bags, One Size"
FALSE,Global Portuguese
FALSE,"Premium Over-Head Stereo HandsfreeHeadset Headphones w/ Mic for LG Q8, Q9, Candy,Tribute Empire, Phoenix 4,Phoenix Plus, K11 Plus (White Pattern) + MND Stylus"
FALSE,"Theory and Practice of Model Transformations : 5th International Conference, Icmt 2012, Prague, Czech Republic, May 28-29, 2012. Proceedings"
FALSE,"Champro Adult Wristband Playbook, Single, Cardinal Camo Adult"
FALSE,UCLA Wired USB Keyboard NCAA
FALSE,Arkansas Razorbacks NCAA Thriller Full Zip Hooded Sweatshirt - Heather Black
FALSE,GATES BELTS & HOSES - COUPLING
FALSE,ifrogz Tadpole On the Go Bluetooth Speaker w/ Belt Clip - Blue
FALSE,1/7 TCW Round Diamond Platinum over Sterling Silver 3-Piece Bridal Engagement Wedding Ring Set
FALSE,"Crystal Ball 20th Anniversary, Vol. 5"
FALSE,LA Choppers Complete Handlebar Cable And Brake Line Kits Black Vinyl/Stainless Mini Ape Hangers LA-8110KT2B-08B
FALSE,SPI-SPORT PART Imported CDI Box for Snowmobile POLARIS EURO WIDETRAK GT 1995 & 1997
FALSE,FITTING BRUSH 1/2 IN.
FALSE,Biltek LED High Beam Conversion Bulbs for 2007 Chevrolet Silverado Classic (9005 Bulbs)
FALSE,"For iPhone 6/6S Plus 5.5"" Case, EpicGadget(TM) 3D Luxury Sparkle Glitter Quicksand Falling Star Liquid Water Case For iPhone 6+ Plus, iPhone 6S + Plus, + 1 Screen Film (Purple)"
FALSE,Mens NCAA Mississippi State Bulldogs Quarter-Zip Long Sleeve Tee Shirt (Heather Charcoal)
FALSE,Alno Inc Infinity Wall Mounted Towel Bar
FALSE,Genuine W0133-1736911 Engine Cooling Fan Blade for Audi Models
FALSE,AutoMeter 1402 Designer Black Street Rod Kit
FALSE,CafePress - FIN Nuts Squirrel - Cute Infant Baby Football Bodysuit
FALSE,MightySkins Protective Bumper Case Cover for Motorola Moto G XT1032 hybrid tpu rubber plastic Love Jesus
FALSE,Original TV Remote Control for Memorex Mi2031/2032 Television
FALSE,Firestone Precision Sport Tire 205/60R15
FALSE,Ply Gem Raised Panel Shutter (Set of 2)
FALSE,SkylineWears Womens One Piece Fashion Playsuit Ladies Jumpsuit
FALSE,Tenba Tools Zipper Pulls - Black - 10 Pack - Differentiates Pockets & Pouches
FALSE,Complete Fantasias for Harpsichord
FALSE,Classic Mesh Ivy Newsboy Ivy Cap Hat Crochet Driving Golf Ventair Cabbie
FALSE,2 TCW Round Cubic Zirconia Eternity Band in Sterling Silver
FALSE,Smart-AVI HDC-VXS Format Converters
FALSE,Green Sparkle Mermaid Blue Lagoon Storybook Adult Womens Costume
FALSE,Intimacy
FALSE,"Political Parties in Conflict-Prone Societies : Regulation, Engineering and Democratic Development"
FALSE,"Volkswagen 4E0 407 271 AX, CV Axle Shaft"
FALSE,HP Pavilion DV5 Cooling Fan & Heatsink- 492314-001 -Refurbished
FALSE,Arabesque Flower Circle Design Tee Women's -Image by Shutterstock
FALSE,2011-2011 BMW 550I (F10) Select-Fit Car Cover Kit
FALSE,Apex Ambulator Active Walker Strap - Mens - Black
FALSE,American Imaginations 21.5-in. W 3H8-in. Ceramic Top Set In White Color - Overflow Drain Incl.
FALSE,WH1X2733 GE Cl Clutch Sp Genuine OEM WH1X2733
FALSE,Brand New Specialty Products Company Sp78090 Saturn Rear Toe Tool
FALSE,Villanova University Confetti Glitter Case for iPhone X
FALSE,Wind Vest Windshield Clear 14in. x 16in. 10-1299C
FALSE,"Plein Air Culvert-RUSFRE98534 Print 14.25""x11"" by Rusty Frentner in a Affordable White Medium"
FALSE,2YR ADVANCED GATEWAY SECURITY SUITE BNDL FOR TZ 300 SERIES
FALSE,Property Law
FALSE,Women's Aviana 2457 Satin and Lace Minimizer Bra
FALSE,Women's Sterling Silver Cat Fashion Ring
FALSE,All Through The Night (Vinyl)
FALSE,PDP SNOWFLAP
FALSE,Vulcan Plier Groove Joint 8In
FALSE,"Mexico En La Obra de Octavio Paz, I. El Peregrino En Su Patria : Historia y Politica de Mexico, 2. Presente Fluido"
FALSE,Bulk Buy: Ruby Rock It (6-Pack) Fundamentals Sentiments Stickers Mini Sentiments FUN21
FALSE,Economic Openness and Territorial Politics in China
FALSE,Women with Control Controlways Top with Cut- Out A273771
FALSE,"Polyamide Imide (PAI) 4203 Round Rod, Diameter: 1.750 (1-3/4 inch), Length: 8 inches"
FALSE,Open Opus
FALSE,Neptune
FALSE,Casual Nights Women's 2 Piece Floral Robe and Gown Set
FALSE,"Diecast Car & Chevron Shop Tools Package - Topo Fuel Altered, Black w/ Yellow Flames - Greenlight 96170E - 1/64 Scale Diecast Model Toy Car w/Chevron Shop Tools"
FALSE,Yamaha FC4A Piano style Sustain Foot Pedal Level 2 Regular 190839225160
FALSE,LG Harmony Hybrid Slim Case - Grizzly Bear
FALSE,"Rusticware 972 Double Knuckle Cabinet Pull with 5"" Center"
FALSE,Uncanny Congruencies : Penn State School of Visual Arts Alumni
FALSE,Safety
FALSE,La Caricia del Mar/Unidos Por el Mar = The Caress of the Sea/United by the Sea
FALSE,"Port Authority K110 Dry Zone UV Micro-Mesh Polo, Gusty Grey, S"
FALSE,UPG UBCD5313B Universal D5313/D5913 AAA 50Pack Universal Alkaline Batteries
FALSE,Living Beyond a Broken Marriage
FALSE,"JGB Enterprises Eagle Hose Tank Truck 150 Oil and Fuel Resistant Rubber Hose Assembly, Black, 3"" Male x Female Camlocks (CxE), 150 PSI Max Pressure, 3"" Hose ID, 20' Length"
FALSE,"Targus Universal 360 Case for 8"" Tablets, Black"
FALSE,Awkward Styles Shamrock Flag St. Patrick's Day Shirt Men Irish Gifts for Him Lucky T Shirt Saint Patrick's Day Shamrock Tshirt Irish Clover Shirt Funny Irish Men's Shirt Lucky Irish Flag Tshirt
